tunableop_results0.csv
Validator,PT_VERSION,2.11.0
Validator,HIP_VERSION,702
Validator,HIPBLASLT_VERSION,100200-2a3887e159
Validator,GCN_ARCH_NAME,gfx1151
Validator,ROCBLAS_VERSION,5.3.0.2a3887e159
GemmAndBiasTunableOp_float_TN,tn_1024_1000_12544_ld_12544_12544_1024,Default,77.281
GemmAndBiasTunableOp_float_TN,tn_1024_1000_1024_ld_1024_1024_1024,Gemm_Hipblaslt_1285,6.47008
GemmAndBiasTunableOp_float_TN,tn_91_1000_1024_ld_1024_1024_91,Gemm_Hipblaslt_1287,1.27659
GemmAndBiasTunableOp_float_TN,tn_364_1000_1024_ld_1024_1024_364,Gemm_Hipblaslt_1286,3.68833
GemmAndBiasTunableOp_float_TN,tn_128_100_576_ld_576_576_128,Gemm_Hipblaslt_1287,0.27509
GemmAndBiasTunableOp_float_TN,tn_2_100_128_ld_128_128_2,Gemm_Hipblaslt_1286,0.0498298
GemmAndBiasTunableOp_float_TN,tn_4_100_128_ld_128_128_4,Gemm_Hipblaslt_1286,0.0454468
GemmAndBiasTunableOp_float_TN,tn_2304_1370_768_ld_768_768_2304,Gemm_Hipblaslt_1286,6.18184
GemmStridedBatchedTunableOp_float_TN,tn_1370_1370_64_B_12_ld_768_768_1370,Gemm_Rocblas_-1162085757,7.70405
GemmStridedBatchedTunableOp_float_NN,nn_64_1370_1370_B_12_ld_2304_1370_64,Gemm_Rocblas_-1162085061,4.51479
GemmAndBiasTunableOp_float_TN,tn_768_1370_768_ld_768_768_768,Gemm_Hipblaslt_1285,3.06364
GemmAndBiasTunableOp_float_TN,tn_3072_1370_768_ld_768_768_3072,Gemm_Hipblaslt_1287,10.3373
GemmAndBiasTunableOp_float_TN,tn_768_1370_3072_ld_3072_3072_768,Gemm_Hipblaslt_1287,9.67842
GemmAndBiasTunableOp_Half_TN,tn_2304_50_768_ld_768_768_2304,Gemm_Hipblaslt_1139,0.170914
GemmStridedBatchedTunableOp_float_TN,tn_50_50_64_B_12_ld_768_768_50,Gemm_Rocblas_-1162085757,0.0469644
GemmStridedBatchedTunableOp_float_NN,nn_64_50_50_B_12_ld_768_50_64,Gemm_Rocblas_-1162085061,0.038137
GemmAndBiasTunableOp_Half_TN,tn_768_50_768_ld_768_768_768,Default,0.043562
GemmAndBiasTunableOp_Half_TN,tn_3072_50_768_ld_768_768_3072,Gemm_Hipblaslt_1183,0.385736
GemmAndBiasTunableOp_Half_TN,tn_768_50_3072_ld_3072_3072_768,Gemm_Hipblaslt_1066,0.0315053
GemmTunableOp_Half_NN,nn_512_1_768_ld_512_768_512,Gemm_Rocblas_-1162084875,0.0272049
GemmAndBiasTunableOp_float_TN,tn_128_35_576_ld_576_576_128,Gemm_Hipblaslt_1285,0.0923884
GemmAndBiasTunableOp_float_TN,tn_2_35_128_ld_128_128_2,Gemm_Hipblaslt_1286,0.0297516
GemmAndBiasTunableOp_float_TN,tn_4_35_128_ld_128_128_4,Gemm_Hipblaslt_1286,0.0281911
GemmAndBiasTunableOp_float_TN,tn_128_73_576_ld_576_576_128,Gemm_Hipblaslt_1286,0.101302
GemmAndBiasTunableOp_float_TN,tn_2_73_128_ld_128_128_2,Gemm_Hipblaslt_1286,0.029568
GemmAndBiasTunableOp_float_TN,tn_4_73_128_ld_128_128_4,Gemm_Hipblaslt_1287,0.0227135
GemmAndBiasTunableOp_float_TN,tn_256_1_1152_ld_1152_1152_256,Gemm_Hipblaslt_1286,0.235981
GemmAndBiasTunableOp_float_TN,tn_2_1_256_ld_256_256_2,Gemm_Hipblaslt_1284,0.0503933
GemmAndBiasTunableOp_float_TN,tn_4_1_256_ld_256_256_4,Gemm_Hipblaslt_1286,0.0396006
GemmAndBiasTunableOp_float_TN,tn_10_1_256_ld_256_256_10,Gemm_Hipblaslt_1286,0.042625
GemmAndBiasTunableOp_float_TN,tn_128_48_576_ld_576_576_128,Gemm_Hipblaslt_1286,0.0249141
GemmAndBiasTunableOp_float_TN,tn_2_48_128_ld_128_128_2,Gemm_Hipblaslt_1286,0.0237836
GemmAndBiasTunableOp_float_TN,tn_4_48_128_ld_128_128_4,Gemm_Hipblaslt_1286,0.0237299
GemmAndBiasTunableOp_float_TN,tn_128_46_576_ld_576_576_128,Gemm_Hipblaslt_1287,0.0411559
GemmAndBiasTunableOp_float_TN,tn_2_46_128_ld_128_128_2,Gemm_Hipblaslt_1286,0.0288556
GemmAndBiasTunableOp_float_TN,tn_4_46_128_ld_128_128_4,Gemm_Hipblaslt_1286,0.0305163
GemmAndBiasTunableOp_float_TN,tn_128_112_576_ld_576_576_128,Gemm_Hipblaslt_1287,0.101171
GemmAndBiasTunableOp_float_TN,tn_2_112_128_ld_128_128_2,Gemm_Hipblaslt_1286,0.0286035
GemmAndBiasTunableOp_float_TN,tn_4_112_128_ld_128_128_4,Gemm_Hipblaslt_1285,0.0241359
GemmAndBiasTunableOp_float_TN,tn_256_5_1152_ld_1152_1152_256,Gemm_Hipblaslt_1286,0.230772
GemmAndBiasTunableOp_float_TN,tn_2_5_256_ld_256_256_2,Gemm_Hipblaslt_1286,0.0617339
GemmAndBiasTunableOp_float_TN,tn_4_5_256_ld_256_256_4,Gemm_Hipblaslt_1286,0.0394848
GemmAndBiasTunableOp_float_TN,tn_10_5_256_ld_256_256_10,Gemm_Hipblaslt_1286,0.0397746
GemmAndBiasTunableOp_float_TN,tn_128_282_576_ld_576_576_128,Gemm_Hipblaslt_1287,0.138729
GemmAndBiasTunableOp_float_TN,tn_2_282_128_ld_128_128_2,Gemm_Hipblaslt_1286,0.0312918
GemmAndBiasTunableOp_float_TN,tn_4_282_128_ld_128_128_4,Gemm_Hipblaslt_1286,0.0314296
GemmAndBiasTunableOp_float_TN,tn_256_40_1152_ld_1152_1152_256,Gemm_Hipblaslt_1286,0.272877
GemmAndBiasTunableOp_float_TN,tn_2_40_256_ld_256_256_2,Gemm_Hipblaslt_1286,0.0425946
GemmAndBiasTunableOp_float_TN,tn_4_40_256_ld_256_256_4,Gemm_Hipblaslt_1286,0.0418316
GemmAndBiasTunableOp_float_TN,tn_10_40_256_ld_256_256_10,Gemm_Hipblaslt_1286,0.0412056
GemmAndBiasTunableOp_float_TN,tn_128_44_576_ld_576_576_128,Gemm_Hipblaslt_1286,0.027669
GemmAndBiasTunableOp_float_TN,tn_2_44_128_ld_128_128_2,Gemm_Hipblaslt_1286,0.0283971
GemmAndBiasTunableOp_float_TN,tn_4_44_128_ld_128_128_4,Gemm_Hipblaslt_1286,0.0465629
GemmAndBiasTunableOp_float_TN,tn_256_3_1152_ld_1152_1152_256,Gemm_Hipblaslt_1284,0.145112
GemmAndBiasTunableOp_float_TN,tn_2_3_256_ld_256_256_2,Gemm_Hipblaslt_1286,0.0407472
GemmAndBiasTunableOp_float_TN,tn_4_3_256_ld_256_256_4,Gemm_Hipblaslt_1286,0.0406409
GemmAndBiasTunableOp_float_TN,tn_10_3_256_ld_256_256_10,Gemm_Hipblaslt_1284,0.0261549
GemmAndBiasTunableOp_float_TN,tn_128_126_576_ld_576_576_128,Gemm_Hipblaslt_1287,0.104739
GemmAndBiasTunableOp_float_TN,tn_2_126_128_ld_128_128_2,Gemm_Hipblaslt_1286,0.0297405
GemmAndBiasTunableOp_float_TN,tn_4_126_128_ld_128_128_4,Gemm_Hipblaslt_1285,0.0236915
GemmAndBiasTunableOp_float_TN,tn_256_10_1152_ld_1152_1152_256,Gemm_Hipblaslt_1286,0.220037
GemmAndBiasTunableOp_float_TN,tn_2_10_256_ld_256_256_2,Gemm_Hipblaslt_1286,0.0650168
GemmAndBiasTunableOp_float_TN,tn_4_10_256_ld_256_256_4,Gemm_Hipblaslt_1286,0.0390019
GemmAndBiasTunableOp_float_TN,tn_10_10_256_ld_256_256_10,Gemm_Hipblaslt_1286,0.0407163
GemmAndBiasTunableOp_float_TN,tn_128_64_576_ld_576_576_128,Gemm_Hipblaslt_1286,0.138374
GemmAndBiasTunableOp_float_TN,tn_2_64_128_ld_128_128_2,Gemm_Hipblaslt_1286,0.0283142
GemmAndBiasTunableOp_float_TN,tn_4_64_128_ld_128_128_4,Gemm_Hipblaslt_1286,0.0306233
GemmAndBiasTunableOp_float_TN,tn_128_56_576_ld_576_576_128,Gemm_Hipblaslt_1284,0.0505332
GemmAndBiasTunableOp_float_TN,tn_2_56_128_ld_128_128_2,Gemm_Hipblaslt_1285,0.0236037
GemmAndBiasTunableOp_float_TN,tn_4_56_128_ld_128_128_4,Gemm_Hipblaslt_1286,0.0306361
GemmAndBiasTunableOp_float_TN,tn_256_12_1152_ld_1152_1152_256,Gemm_Hipblaslt_1286,0.145101
GemmAndBiasTunableOp_float_TN,tn_2_12_256_ld_256_256_2,Gemm_Hipblaslt_1286,0.0626108
GemmAndBiasTunableOp_float_TN,tn_4_12_256_ld_256_256_4,Gemm_Hipblaslt_1286,0.0402924
GemmAndBiasTunableOp_float_TN,tn_10_12_256_ld_256_256_10,Gemm_Hipblaslt_1284,0.0253963
GemmAndBiasTunableOp_float_TN,tn_128_295_576_ld_576_576_128,Gemm_Hipblaslt_1287,0.156013
GemmAndBiasTunableOp_float_TN,tn_2_295_128_ld_128_128_2,Gemm_Hipblaslt_1286,0.0292948
GemmAndBiasTunableOp_float_TN,tn_4_295_128_ld_128_128_4,Gemm_Hipblaslt_1287,0.0227717
GemmAndBiasTunableOp_float_TN,tn_256_19_1152_ld_1152_1152_256,Gemm_Hipblaslt_1286,0.240856
GemmAndBiasTunableOp_float_TN,tn_2_19_256_ld_256_256_2,Gemm_Hipblaslt_1286,0.0407244
GemmAndBiasTunableOp_float_TN,tn_4_19_256_ld_256_256_4,Gemm_Hipblaslt_1286,0.0409707
GemmAndBiasTunableOp_float_TN,tn_10_19_256_ld_256_256_10,Gemm_Hipblaslt_1286,0.042054
GemmAndBiasTunableOp_float_TN,tn_128_136_576_ld_576_576_128,Gemm_Hipblaslt_1285,0.0710751
GemmAndBiasTunableOp_float_TN,tn_2_136_128_ld_128_128_2,Gemm_Hipblaslt_1286,0.0300654
GemmAndBiasTunableOp_float_TN,tn_4_136_128_ld_128_128_4,Gemm_Hipblaslt_1286,0.0293264
GemmAndBiasTunableOp_float_TN,tn_128_164_576_ld_576_576_128,Gemm_Hipblaslt_1287,0.120802
GemmAndBiasTunableOp_float_TN,tn_2_164_128_ld_128_128_2,Gemm_Hipblaslt_1286,0.0326811
GemmAndBiasTunableOp_float_TN,tn_4_164_128_ld_128_128_4,Gemm_Hipblaslt_1284,0.0230586
GemmAndBiasTunableOp_float_TN,tn_128_69_576_ld_576_576_128,Gemm_Hipblaslt_1286,0.19549
GemmAndBiasTunableOp_float_TN,tn_2_69_128_ld_128_128_2,Gemm_Hipblaslt_1286,0.0288184
GemmAndBiasTunableOp_float_TN,tn_4_69_128_ld_128_128_4,Gemm_Hipblaslt_1286,0.02889
GemmAndBiasTunableOp_float_TN,tn_128_8_576_ld_576_576_128,Gemm_Hipblaslt_1286,0.134041
GemmAndBiasTunableOp_float_TN,tn_2_8_128_ld_128_128_2,Gemm_Hipblaslt_1286,0.0460151
GemmAndBiasTunableOp_float_TN,tn_4_8_128_ld_128_128_4,Gemm_Hipblaslt_1286,0.0279406
GemmAndBiasTunableOp_float_TN,tn_256_2_1152_ld_1152_1152_256,Gemm_Hipblaslt_1286,0.134901
GemmAndBiasTunableOp_float_TN,tn_2_2_256_ld_256_256_2,Gemm_Hipblaslt_1286,0.0245262
GemmAndBiasTunableOp_float_TN,tn_4_2_256_ld_256_256_4,Gemm_Hipblaslt_1286,0.0260074
GemmAndBiasTunableOp_float_TN,tn_10_2_256_ld_256_256_10,Gemm_Hipblaslt_1286,0.0406494
GemmAndBiasTunableOp_float_TN,tn_128_40_576_ld_576_576_128,Gemm_Hipblaslt_1286,0.085245
GemmAndBiasTunableOp_float_TN,tn_2_40_128_ld_128_128_2,Gemm_Hipblaslt_1286,0.0282822
GemmAndBiasTunableOp_float_TN,tn_4_40_128_ld_128_128_4,Gemm_Hipblaslt_1286,0.0516894
GemmAndBiasTunableOp_float_TN,tn_128_140_576_ld_576_576_128,Gemm_Hipblaslt_1287,0.221404
GemmAndBiasTunableOp_float_TN,tn_2_140_128_ld_128_128_2,Gemm_Hipblaslt_1286,0.0289914
GemmAndBiasTunableOp_float_TN,tn_4_140_128_ld_128_128_4,Gemm_Hipblaslt_1286,0.0294631
GemmAndBiasTunableOp_float_TN,tn_128_139_576_ld_576_576_128,Gemm_Hipblaslt_1286,0.0726585
GemmAndBiasTunableOp_float_TN,tn_2_139_128_ld_128_128_2,Gemm_Hipblaslt_1286,0.0293805
GemmAndBiasTunableOp_float_TN,tn_4_139_128_ld_128_128_4,Gemm_Hipblaslt_1286,0.0297781
GemmAndBiasTunableOp_float_TN,tn_256_8_1152_ld_1152_1152_256,Gemm_Hipblaslt_1287,0.105551
GemmAndBiasTunableOp_float_TN,tn_2_8_256_ld_256_256_2,Gemm_Hipblaslt_1286,0.0630311
GemmAndBiasTunableOp_float_TN,tn_4_8_256_ld_256_256_4,Gemm_Hipblaslt_1286,0.0644851
GemmAndBiasTunableOp_float_TN,tn_10_8_256_ld_256_256_10,Gemm_Hipblaslt_1286,0.0510145
GemmAndBiasTunableOp_float_TN,tn_128_104_576_ld_576_576_128,Gemm_Hipblaslt_1286,0.0729077
GemmAndBiasTunableOp_float_TN,tn_2_104_128_ld_128_128_2,Gemm_Hipblaslt_1286,0.0393762
GemmAndBiasTunableOp_float_TN,tn_4_104_128_ld_128_128_4,Gemm_Hipblaslt_1286,0.0454728
GemmAndBiasTunableOp_float_TN,tn_128_85_576_ld_576_576_128,Gemm_Hipblaslt_1286,0.100087
GemmAndBiasTunableOp_float_TN,tn_2_85_128_ld_128_128_2,Gemm_Hipblaslt_1286,0.0294824
GemmAndBiasTunableOp_float_TN,tn_4_85_128_ld_128_128_4,Gemm_Hipblaslt_1286,0.0239539
GemmAndBiasTunableOp_float_TN,tn_256_7_1152_ld_1152_1152_256,Gemm_Hipblaslt_1286,0.139954
GemmAndBiasTunableOp_float_TN,tn_2_7_256_ld_256_256_2,Gemm_Hipblaslt_1286,0.0393462
GemmAndBiasTunableOp_float_TN,tn_4_7_256_ld_256_256_4,Gemm_Hipblaslt_1286,0.0396035
GemmAndBiasTunableOp_float_TN,tn_10_7_256_ld_256_256_10,Gemm_Hipblaslt_1286,0.0255749
GemmAndBiasTunableOp_float_TN,tn_128_23_576_ld_576_576_128,Gemm_Hipblaslt_1286,0.0802909
GemmAndBiasTunableOp_float_TN,tn_2_23_128_ld_128_128_2,Gemm_Hipblaslt_1286,0.0279102
GemmAndBiasTunableOp_float_TN,tn_4_23_128_ld_128_128_4,Gemm_Hipblaslt_1286,0.0249864
GemmAndBiasTunableOp_float_TN,tn_128_34_576_ld_576_576_128,Gemm_Hipblaslt_1286,0.0292852
GemmAndBiasTunableOp_float_TN,tn_2_34_128_ld_128_128_2,Gemm_Hipblaslt_1286,0.0111306
GemmAndBiasTunableOp_float_TN,tn_4_34_128_ld_128_128_4,Gemm_Hipblaslt_1286,0.0109218
GemmAndBiasTunableOp_float_TN,tn_128_512_576_ld_576_576_128,Gemm_Hipblaslt_1287,0.0561683
GemmAndBiasTunableOp_float_TN,tn_2_512_128_ld_128_128_2,Gemm_Hipblaslt_1286,0.014193
GemmAndBiasTunableOp_float_TN,tn_4_512_128_ld_128_128_4,Gemm_Hipblaslt_1286,0.0139856
GemmAndBiasTunableOp_float_TN,tn_128_407_576_ld_576_576_128,Gemm_Hipblaslt_1287,0.0509292
GemmAndBiasTunableOp_float_TN,tn_2_407_128_ld_128_128_2,Gemm_Hipblaslt_1286,0.0133664
GemmAndBiasTunableOp_float_TN,tn_4_407_128_ld_128_128_4,Gemm_Hipblaslt_1286,0.0133504
GemmAndBiasTunableOp_float_TN,tn_256_13_1152_ld_1152_1152_256,Gemm_Hipblaslt_1286,0.0555166
GemmAndBiasTunableOp_float_TN,tn_2_13_256_ld_256_256_2,Gemm_Hipblaslt_1286,0.0162014
GemmAndBiasTunableOp_float_TN,tn_4_13_256_ld_256_256_4,Gemm_Hipblaslt_1286,0.0158114
GemmAndBiasTunableOp_float_TN,tn_10_13_256_ld_256_256_10,Gemm_Hipblaslt_1286,0.0162418
GemmAndBiasTunableOp_float_TN,tn_128_86_576_ld_576_576_128,Gemm_Hipblaslt_1287,0.0291398
GemmAndBiasTunableOp_float_TN,tn_2_86_128_ld_128_128_2,Gemm_Hipblaslt_1284,0.0111418
GemmAndBiasTunableOp_float_TN,tn_4_86_128_ld_128_128_4,Gemm_Hipblaslt_1286,0.0109097
GemmAndBiasTunableOp_float_TN,tn_128_146_576_ld_576_576_128,Gemm_Hipblaslt_1287,0.0332183
GemmAndBiasTunableOp_float_TN,tn_2_146_128_ld_128_128_2,Gemm_Hipblaslt_1287,0.0136882
GemmAndBiasTunableOp_float_TN,tn_4_146_128_ld_128_128_4,Gemm_Hipblaslt_1287,0.0137419
GemmAndBiasTunableOp_float_TN,tn_128_93_576_ld_576_576_128,Gemm_Hipblaslt_1287,0.0311374
GemmAndBiasTunableOp_float_TN,tn_2_93_128_ld_128_128_2,Gemm_Hipblaslt_1286,0.0133552
GemmAndBiasTunableOp_float_TN,tn_4_93_128_ld_128_128_4,Gemm_Hipblaslt_1286,0.0136946
GemmAndBiasTunableOp_float_TN,tn_128_17_576_ld_576_576_128,Gemm_Hipblaslt_1287,0.032757
GemmAndBiasTunableOp_float_TN,tn_2_17_128_ld_128_128_2,Gemm_Hipblaslt_1286,0.0139531
GemmAndBiasTunableOp_float_TN,tn_4_17_128_ld_128_128_4,Gemm_Hipblaslt_1286,0.0139498
GemmAndBiasTunableOp_float_TN,tn_128_15_576_ld_576_576_128,Gemm_Hipblaslt_1287,0.0320965
GemmAndBiasTunableOp_float_TN,tn_2_15_128_ld_128_128_2,Gemm_Hipblaslt_1286,0.0139555
GemmAndBiasTunableOp_float_TN,tn_4_15_128_ld_128_128_4,Gemm_Hipblaslt_1286,0.0140048
GemmAndBiasTunableOp_float_TN,tn_128_25_576_ld_576_576_128,Gemm_Hipblaslt_1286,0.0296696
GemmAndBiasTunableOp_float_TN,tn_2_25_128_ld_128_128_2,Gemm_Hipblaslt_1286,0.013477
GemmAndBiasTunableOp_float_TN,tn_4_25_128_ld_128_128_4,Gemm_Hipblaslt_1286,0.0133071
GemmAndBiasTunableOp_float_TN,tn_128_54_576_ld_576_576_128,Gemm_Hipblaslt_1287,0.0326936
GemmAndBiasTunableOp_float_TN,tn_2_54_128_ld_128_128_2,Gemm_Hipblaslt_1287,0.0148264
GemmAndBiasTunableOp_float_TN,tn_4_54_128_ld_128_128_4,Gemm_Hipblaslt_1286,0.0145839
GemmAndBiasTunableOp_float_TN,tn_128_305_576_ld_576_576_128,Gemm_Hipblaslt_1287,0.040948
GemmAndBiasTunableOp_float_TN,tn_2_305_128_ld_128_128_2,Gemm_Hipblaslt_1286,0.0144677
GemmAndBiasTunableOp_float_TN,tn_4_305_128_ld_128_128_4,Gemm_Hipblaslt_1286,0.0143214
GemmAndBiasTunableOp_float_TN,tn_128_252_576_ld_576_576_128,Gemm_Hipblaslt_1287,0.0349464
GemmAndBiasTunableOp_float_TN,tn_2_252_128_ld_128_128_2,Gemm_Hipblaslt_1286,0.0121737
GemmAndBiasTunableOp_float_TN,tn_4_252_128_ld_128_128_4,Gemm_Hipblaslt_1286,0.0118932
GemmAndBiasTunableOp_float_TN,tn_128_165_576_ld_576_576_128,Gemm_Hipblaslt_1287,0.0373308
GemmAndBiasTunableOp_float_TN,tn_2_165_128_ld_128_128_2,Gemm_Hipblaslt_1286,0.0147799
GemmAndBiasTunableOp_float_TN,tn_4_165_128_ld_128_128_4,Gemm_Hipblaslt_1286,0.0146997
GemmAndBiasTunableOp_float_TN,tn_128_214_576_ld_576_576_128,Gemm_Hipblaslt_1285,0.027118
GemmAndBiasTunableOp_float_TN,tn_2_214_128_ld_128_128_2,Gemm_Hipblaslt_1284,0.0105647
GemmAndBiasTunableOp_float_TN,tn_4_214_128_ld_128_128_4,Gemm_Hipblaslt_1284,0.010531
GemmAndBiasTunableOp_float_TN,tn_128_60_576_ld_576_576_128,Gemm_Hipblaslt_1286,0.0210261
GemmAndBiasTunableOp_float_TN,tn_2_60_128_ld_128_128_2,Gemm_Hipblaslt_1286,0.0104998
GemmAndBiasTunableOp_float_TN,tn_4_60_128_ld_128_128_4,Gemm_Hipblaslt_1284,0.0105996
GemmAndBiasTunableOp_float_TN,tn_256_4_1152_ld_1152_1152_256,Gemm_Hipblaslt_1286,0.0324716
GemmAndBiasTunableOp_float_TN,tn_2_4_256_ld_256_256_2,Gemm_Hipblaslt_1286,0.0137302
GemmAndBiasTunableOp_float_TN,tn_4_4_256_ld_256_256_4,Gemm_Hipblaslt_1286,0.0136389
GemmAndBiasTunableOp_float_TN,tn_10_4_256_ld_256_256_10,Gemm_Hipblaslt_1286,0.0133832
GemmAndBiasTunableOp_float_TN,tn_128_6_576_ld_576_576_128,Gemm_Hipblaslt_1286,0.0198178
GemmAndBiasTunableOp_float_TN,tn_2_6_128_ld_128_128_2,Gemm_Hipblaslt_1286,0.0106329
GemmAndBiasTunableOp_float_TN,tn_4_6_128_ld_128_128_4,Gemm_Hipblaslt_1286,0.0106906
GemmAndBiasTunableOp_float_TN,tn_128_18_576_ld_576_576_128,Gemm_Hipblaslt_1286,0.0194227
GemmAndBiasTunableOp_float_TN,tn_2_18_128_ld_128_128_2,Gemm_Hipblaslt_1286,0.0105319
GemmAndBiasTunableOp_float_TN,tn_4_18_128_ld_128_128_4,Gemm_Hipblaslt_1286,0.0105587
GemmAndBiasTunableOp_float_TN,tn_128_91_576_ld_576_576_128,Gemm_Hipblaslt_1284,0.0212918
GemmAndBiasTunableOp_float_TN,tn_2_91_128_ld_128_128_2,Gemm_Hipblaslt_1286,0.0103183
GemmAndBiasTunableOp_float_TN,tn_4_91_128_ld_128_128_4,Gemm_Hipblaslt_1286,0.0104401
GemmAndBiasTunableOp_float_TN,tn_128_41_576_ld_576_576_128,Gemm_Hipblaslt_1284,0.0201504
GemmAndBiasTunableOp_float_TN,tn_2_41_128_ld_128_128_2,Gemm_Hipblaslt_1286,0.0104589
GemmAndBiasTunableOp_float_TN,tn_4_41_128_ld_128_128_4,Gemm_Hipblaslt_1286,0.0105579
GemmAndBiasTunableOp_float_TN,tn_128_59_576_ld_576_576_128,Gemm_Hipblaslt_1286,0.0232899
GemmAndBiasTunableOp_float_TN,tn_2_59_128_ld_128_128_2,Gemm_Hipblaslt_1284,0.0104758
GemmAndBiasTunableOp_float_TN,tn_4_59_128_ld_128_128_4,Gemm_Hipblaslt_1286,0.0105852
GemmAndBiasTunableOp_float_TN,tn_128_61_576_ld_576_576_128,Gemm_Hipblaslt_1286,0.0208381
GemmAndBiasTunableOp_float_TN,tn_2_61_128_ld_128_128_2,Gemm_Hipblaslt_1286,0.0104753
GemmAndBiasTunableOp_float_TN,tn_4_61_128_ld_128_128_4,Gemm_Hipblaslt_1286,0.0105505
GemmAndBiasTunableOp_float_TN,tn_128_155_576_ld_576_576_128,Gemm_Hipblaslt_1284,0.0265544
GemmAndBiasTunableOp_float_TN,tn_2_155_128_ld_128_128_2,Gemm_Hipblaslt_1286,0.0103992
GemmAndBiasTunableOp_float_TN,tn_4_155_128_ld_128_128_4,Gemm_Hipblaslt_1286,0.0104136
GemmAndBiasTunableOp_float_TN,tn_256_90_1152_ld_1152_1152_256,Gemm_Hipblaslt_1285,0.0416081
GemmAndBiasTunableOp_float_TN,tn_2_90_256_ld_256_256_2,Gemm_Hipblaslt_1286,0.0132433
GemmAndBiasTunableOp_float_TN,tn_4_90_256_ld_256_256_4,Gemm_Hipblaslt_1286,0.0130206
GemmAndBiasTunableOp_float_TN,tn_10_90_256_ld_256_256_10,Gemm_Hipblaslt_1286,0.0127637
GemmAndBiasTunableOp_float_TN,tn_128_458_576_ld_576_576_128,Gemm_Hipblaslt_1285,0.0358328
GemmAndBiasTunableOp_float_TN,tn_2_458_128_ld_128_128_2,Gemm_Hipblaslt_1286,0.0103022
GemmAndBiasTunableOp_float_TN,tn_4_458_128_ld_128_128_4,Gemm_Hipblaslt_1286,0.0103431
GemmAndBiasTunableOp_float_TN,tn_256_6_1152_ld_1152_1152_256,Gemm_Hipblaslt_1286,0.0323033
GemmAndBiasTunableOp_float_TN,tn_2_6_256_ld_256_256_2,Gemm_Hipblaslt_1286,0.0136557
GemmAndBiasTunableOp_float_TN,tn_4_6_256_ld_256_256_4,Gemm_Hipblaslt_1286,0.0135612
GemmAndBiasTunableOp_float_TN,tn_10_6_256_ld_256_256_10,Gemm_Hipblaslt_1286,0.0134073
GemmAndBiasTunableOp_float_TN,tn_128_404_576_ld_576_576_128,Gemm_Hipblaslt_1285,0.0344787
GemmAndBiasTunableOp_float_TN,tn_2_404_128_ld_128_128_2,Gemm_Hipblaslt_1284,0.0104906
GemmAndBiasTunableOp_float_TN,tn_4_404_128_ld_128_128_4,Gemm_Hipblaslt_1286,0.010394
GemmAndBiasTunableOp_float_TN,tn_128_211_576_ld_576_576_128,Gemm_Hipblaslt_1285,0.0287871
GemmAndBiasTunableOp_float_TN,tn_2_211_128_ld_128_128_2,Gemm_Hipblaslt_1286,0.0105607
GemmAndBiasTunableOp_float_TN,tn_4_211_128_ld_128_128_4,Gemm_Hipblaslt_1286,0.0105855
GemmAndBiasTunableOp_float_TN,tn_128_119_576_ld_576_576_128,Gemm_Hipblaslt_1284,0.0220027
GemmAndBiasTunableOp_float_TN,tn_2_119_128_ld_128_128_2,Gemm_Hipblaslt_1286,0.0102333
GemmAndBiasTunableOp_float_TN,tn_4_119_128_ld_128_128_4,Gemm_Hipblaslt_1284,0.0105254
GemmAndBiasTunableOp_float_TN,tn_128_4_576_ld_576_576_128,Gemm_Hipblaslt_1286,0.020049
GemmAndBiasTunableOp_float_TN,tn_2_4_128_ld_128_128_2,Gemm_Hipblaslt_1286,0.0106653
GemmAndBiasTunableOp_float_TN,tn_4_4_128_ld_128_128_4,Gemm_Hipblaslt_1286,0.0107611
GemmAndBiasTunableOp_float_TN,tn_128_116_576_ld_576_576_128,Gemm_Hipblaslt_1284,0.0219562
GemmAndBiasTunableOp_float_TN,tn_2_116_128_ld_128_128_2,Gemm_Hipblaslt_1286,0.0103439
GemmAndBiasTunableOp_float_TN,tn_4_116_128_ld_128_128_4,Gemm_Hipblaslt_1286,0.0102461
GemmAndBiasTunableOp_float_TN,tn_128_1_576_ld_576_576_128,Gemm_Hipblaslt_1286,0.0198923
GemmAndBiasTunableOp_float_TN,tn_2_1_128_ld_128_128_2,Gemm_Hipblaslt_1286,0.0106272
GemmAndBiasTunableOp_float_TN,tn_4_1_128_ld_128_128_4,Gemm_Hipblaslt_1286,0.0106537
GemmAndBiasTunableOp_float_TN,tn_128_74_576_ld_576_576_128,Gemm_Hipblaslt_1286,0.021212
GemmAndBiasTunableOp_float_TN,tn_2_74_128_ld_128_128_2,Gemm_Hipblaslt_1286,0.0103496
GemmAndBiasTunableOp_float_TN,tn_4_74_128_ld_128_128_4,Gemm_Hipblaslt_1286,0.0103195
GemmAndBiasTunableOp_float_TN,tn_128_416_576_ld_576_576_128,Gemm_Hipblaslt_1285,0.0347344
GemmAndBiasTunableOp_float_TN,tn_2_416_128_ld_128_128_2,Gemm_Hipblaslt_1286,0.0115474
GemmAndBiasTunableOp_float_TN,tn_4_416_128_ld_128_128_4,Gemm_Hipblaslt_1284,0.0114717
GemmAndBiasTunableOp_float_TN,tn_128_205_576_ld_576_576_128,Gemm_Hipblaslt_1285,0.0271328
GemmAndBiasTunableOp_float_TN,tn_2_205_128_ld_128_128_2,Gemm_Hipblaslt_1286,0.0104889
GemmAndBiasTunableOp_float_TN,tn_4_205_128_ld_128_128_4,Gemm_Hipblaslt_1284,0.0103508
GemmAndBiasTunableOp_float_TN,tn_128_36_576_ld_576_576_128,Gemm_Hipblaslt_1286,0.0208537
GemmAndBiasTunableOp_float_TN,tn_2_36_128_ld_128_128_2,Gemm_Hipblaslt_1286,0.0106028
GemmAndBiasTunableOp_float_TN,tn_4_36_128_ld_128_128_4,Gemm_Hipblaslt_1286,0.0105591
GemmAndBiasTunableOp_float_TN,tn_128_79_576_ld_576_576_128,Gemm_Hipblaslt_1286,0.0215687
GemmAndBiasTunableOp_float_TN,tn_2_79_128_ld_128_128_2,Gemm_Hipblaslt_1286,0.0104946
GemmAndBiasTunableOp_float_TN,tn_4_79_128_ld_128_128_4,Gemm_Hipblaslt_1286,0.0103495
GemmAndBiasTunableOp_float_TN,tn_128_313_576_ld_576_576_128,Gemm_Hipblaslt_1285,0.0304727
GemmAndBiasTunableOp_float_TN,tn_2_313_128_ld_128_128_2,Gemm_Hipblaslt_1284,0.011139
GemmAndBiasTunableOp_float_TN,tn_4_313_128_ld_128_128_4,Gemm_Hipblaslt_1284,0.0110972
GemmAndBiasTunableOp_float_TN,tn_128_180_576_ld_576_576_128,Gemm_Hipblaslt_1285,0.0281792
GemmAndBiasTunableOp_float_TN,tn_2_180_128_ld_128_128_2,Gemm_Hipblaslt_1286,0.0104637
GemmAndBiasTunableOp_float_TN,tn_4_180_128_ld_128_128_4,Gemm_Hipblaslt_1286,0.0105098
GemmAndBiasTunableOp_float_TN,tn_128_123_576_ld_576_576_128,Gemm_Hipblaslt_1284,0.0223489
GemmAndBiasTunableOp_float_TN,tn_2_123_128_ld_128_128_2,Gemm_Hipblaslt_1286,0.0103011
GemmAndBiasTunableOp_float_TN,tn_4_123_128_ld_128_128_4,Gemm_Hipblaslt_1286,0.0104858
GemmAndBiasTunableOp_float_TN,tn_128_72_576_ld_576_576_128,Gemm_Hipblaslt_1284,0.0215037
GemmAndBiasTunableOp_float_TN,tn_2_72_128_ld_128_128_2,Gemm_Hipblaslt_1286,0.0103755
GemmAndBiasTunableOp_float_TN,tn_4_72_128_ld_128_128_4,Gemm_Hipblaslt_1286,0.0104759
GemmAndBiasTunableOp_float_TN,tn_128_66_576_ld_576_576_128,Gemm_Hipblaslt_1286,0.0212845
GemmAndBiasTunableOp_float_TN,tn_2_66_128_ld_128_128_2,Gemm_Hipblaslt_1284,0.0105262
GemmAndBiasTunableOp_float_TN,tn_4_66_128_ld_128_128_4,Gemm_Hipblaslt_1284,0.0105852
GemmAndBiasTunableOp_float_TN,tn_128_239_576_ld_576_576_128,Gemm_Hipblaslt_1285,0.0310462
GemmAndBiasTunableOp_float_TN,tn_2_239_128_ld_128_128_2,Gemm_Hipblaslt_1286,0.0108681
GemmAndBiasTunableOp_float_TN,tn_4_239_128_ld_128_128_4,Gemm_Hipblaslt_1286,0.0107463
GemmAndBiasTunableOp_float_TN,tn_128_481_576_ld_576_576_128,Gemm_Hipblaslt_1285,0.0390705
GemmAndBiasTunableOp_float_TN,tn_2_481_128_ld_128_128_2,Gemm_Hipblaslt_1284,0.0111535
GemmAndBiasTunableOp_float_TN,tn_4_481_128_ld_128_128_4,Gemm_Hipblaslt_1284,0.0112541
GemmAndBiasTunableOp_float_TN,tn_256_41_1152_ld_1152_1152_256,Gemm_Hipblaslt_1284,0.0346318
GemmAndBiasTunableOp_float_TN,tn_2_41_256_ld_256_256_2,Gemm_Hipblaslt_1286,0.0132702
GemmAndBiasTunableOp_float_TN,tn_4_41_256_ld_256_256_4,Gemm_Hipblaslt_1286,0.0134466
GemmAndBiasTunableOp_float_TN,tn_10_41_256_ld_256_256_10,Gemm_Hipblaslt_1286,0.0130154
GemmAndBiasTunableOp_float_TN,tn_128_95_576_ld_576_576_128,Gemm_Hipblaslt_1284,0.0206165
GemmAndBiasTunableOp_float_TN,tn_2_95_128_ld_128_128_2,Gemm_Hipblaslt_1286,0.0103404
GemmAndBiasTunableOp_float_TN,tn_4_95_128_ld_128_128_4,Gemm_Hipblaslt_1286,0.0104052
GemmAndBiasTunableOp_float_TN,tn_128_175_576_ld_576_576_128,Gemm_Hipblaslt_1284,0.029306
GemmAndBiasTunableOp_float_TN,tn_2_175_128_ld_128_128_2,Gemm_Hipblaslt_1286,0.0106704
GemmAndBiasTunableOp_float_TN,tn_4_175_128_ld_128_128_4,Gemm_Hipblaslt_1284,0.0105884
GemmAndBiasTunableOp_float_TN,tn_128_261_576_ld_576_576_128,Gemm_Hipblaslt_1285,0.0269108
GemmAndBiasTunableOp_float_TN,tn_2_261_128_ld_128_128_2,Gemm_Hipblaslt_1284,0.0106129
GemmAndBiasTunableOp_float_TN,tn_4_261_128_ld_128_128_4,Gemm_Hipblaslt_1284,0.0104577
GemmAndBiasTunableOp_float_TN,tn_128_77_576_ld_576_576_128,Gemm_Hipblaslt_1286,0.0235452
GemmAndBiasTunableOp_float_TN,tn_2_77_128_ld_128_128_2,Gemm_Hipblaslt_1286,0.0104829
GemmAndBiasTunableOp_float_TN,tn_4_77_128_ld_128_128_4,Gemm_Hipblaslt_1286,0.0105747
GemmAndBiasTunableOp_float_TN,tn_128_57_576_ld_576_576_128,Gemm_Hipblaslt_1286,0.0211051
GemmAndBiasTunableOp_float_TN,tn_2_57_128_ld_128_128_2,Gemm_Hipblaslt_1286,0.0105099
GemmAndBiasTunableOp_float_TN,tn_4_57_128_ld_128_128_4,Gemm_Hipblaslt_1286,0.0103259
GemmAndBiasTunableOp_float_TN,tn_128_101_576_ld_576_576_128,Gemm_Hipblaslt_1284,0.0217286
GemmAndBiasTunableOp_float_TN,tn_2_101_128_ld_128_128_2,Gemm_Hipblaslt_1286,0.0102233
GemmAndBiasTunableOp_float_TN,tn_4_101_128_ld_128_128_4,Gemm_Hipblaslt_1284,0.0104244
GemmAndBiasTunableOp_float_TN,tn_128_378_576_ld_576_576_128,Gemm_Hipblaslt_1285,0.0314116
GemmAndBiasTunableOp_float_TN,tn_2_378_128_ld_128_128_2,Gemm_Hipblaslt_1286,0.0117666
GemmAndBiasTunableOp_float_TN,tn_4_378_128_ld_128_128_4,Gemm_Hipblaslt_1286,0.011751
GemmAndBiasTunableOp_float_TN,tn_256_67_1152_ld_1152_1152_256,Gemm_Hipblaslt_1284,0.0387018
GemmAndBiasTunableOp_float_TN,tn_2_67_256_ld_256_256_2,Gemm_Hipblaslt_1286,0.0132879
GemmAndBiasTunableOp_float_TN,tn_4_67_256_ld_256_256_4,Gemm_Hipblaslt_1286,0.0131676
GemmAndBiasTunableOp_float_TN,tn_10_67_256_ld_256_256_10,Gemm_Hipblaslt_1286,0.0129132
GemmAndBiasTunableOp_float_TN,tn_128_80_576_ld_576_576_128,Gemm_Hipblaslt_1286,0.0208874
GemmAndBiasTunableOp_float_TN,tn_2_80_128_ld_128_128_2,Gemm_Hipblaslt_1286,0.0103964
GemmAndBiasTunableOp_float_TN,tn_4_80_128_ld_128_128_4,Gemm_Hipblaslt_1286,0.0103989
GemmAndBiasTunableOp_float_TN,tn_128_16_576_ld_576_576_128,Gemm_Hipblaslt_1286,0.0198983
GemmAndBiasTunableOp_float_TN,tn_2_16_128_ld_128_128_2,Gemm_Hipblaslt_1286,0.0106505
GemmAndBiasTunableOp_float_TN,tn_4_16_128_ld_128_128_4,Gemm_Hipblaslt_1286,0.0106797
GemmAndBiasTunableOp_float_TN,tn_128_87_576_ld_576_576_128,Gemm_Hipblaslt_1286,0.0211395
GemmAndBiasTunableOp_float_TN,tn_2_87_128_ld_128_128_2,Gemm_Hipblaslt_1286,0.0103375
GemmAndBiasTunableOp_float_TN,tn_4_87_128_ld_128_128_4,Gemm_Hipblaslt_1286,0.0104144
GemmAndBiasTunableOp_float_TN,tn_128_52_576_ld_576_576_128,Gemm_Hipblaslt_1286,0.0209211
GemmAndBiasTunableOp_float_TN,tn_2_52_128_ld_128_128_2,Gemm_Hipblaslt_1286,0.0105976
GemmAndBiasTunableOp_float_TN,tn_4_52_128_ld_128_128_4,Gemm_Hipblaslt_1286,0.0104193
GemmAndBiasTunableOp_float_TN,tn_128_58_576_ld_576_576_128,Gemm_Hipblaslt_1284,0.020338
GemmAndBiasTunableOp_float_TN,tn_2_58_128_ld_128_128_2,Gemm_Hipblaslt_1286,0.010374
GemmAndBiasTunableOp_float_TN,tn_4_58_128_ld_128_128_4,Gemm_Hipblaslt_1284,0.0105342
GemmAndBiasTunableOp_float_TN,tn_128_110_576_ld_576_576_128,Gemm_Hipblaslt_1286,0.0225914
GemmAndBiasTunableOp_float_TN,tn_2_110_128_ld_128_128_2,Gemm_Hipblaslt_1286,0.0103727
GemmAndBiasTunableOp_float_TN,tn_4_110_128_ld_128_128_4,Gemm_Hipblaslt_1286,0.010392
GemmAndBiasTunableOp_float_TN,tn_128_42_576_ld_576_576_128,Gemm_Hipblaslt_1284,0.0221182
GemmAndBiasTunableOp_float_TN,tn_2_42_128_ld_128_128_2,Gemm_Hipblaslt_1286,0.0105527
GemmAndBiasTunableOp_float_TN,tn_4_42_128_ld_128_128_4,Gemm_Hipblaslt_1286,0.010707
GemmAndBiasTunableOp_float_TN,tn_128_144_576_ld_576_576_128,Gemm_Hipblaslt_1284,0.0237131
GemmAndBiasTunableOp_float_TN,tn_2_144_128_ld_128_128_2,Gemm_Hipblaslt_1286,0.0103595
GemmAndBiasTunableOp_float_TN,tn_4_144_128_ld_128_128_4,Gemm_Hipblaslt_1284,0.010424
GemmAndBiasTunableOp_float_TN,tn_128_184_576_ld_576_576_128,Gemm_Hipblaslt_1285,0.0259177
GemmAndBiasTunableOp_float_TN,tn_2_184_128_ld_128_128_2,Gemm_Hipblaslt_1284,0.0103127
GemmAndBiasTunableOp_float_TN,tn_4_184_128_ld_128_128_4,Gemm_Hipblaslt_1286,0.0103812
GemmAndBiasTunableOp_float_TN,tn_128_45_576_ld_576_576_128,Gemm_Hipblaslt_1286,0.0209732
GemmAndBiasTunableOp_float_TN,tn_2_45_128_ld_128_128_2,Gemm_Hipblaslt_1286,0.0104778
GemmAndBiasTunableOp_float_TN,tn_4_45_128_ld_128_128_4,Gemm_Hipblaslt_1286,0.0105695
GemmAndBiasTunableOp_float_TN,tn_128_213_576_ld_576_576_128,Gemm_Hipblaslt_1285,0.0272558
GemmAndBiasTunableOp_float_TN,tn_2_213_128_ld_128_128_2,Gemm_Hipblaslt_1286,0.010519
GemmAndBiasTunableOp_float_TN,tn_4_213_128_ld_128_128_4,Gemm_Hipblaslt_1286,0.0104958
GemmAndBiasTunableOp_float_TN,tn_128_130_576_ld_576_576_128,Gemm_Hipblaslt_1284,0.0242361
GemmAndBiasTunableOp_float_TN,tn_2_130_128_ld_128_128_2,Gemm_Hipblaslt_1286,0.0103171
GemmAndBiasTunableOp_float_TN,tn_4_130_128_ld_128_128_4,Gemm_Hipblaslt_1286,0.0102946
GemmAndBiasTunableOp_float_TN,tn_128_215_576_ld_576_576_128,Gemm_Hipblaslt_1285,0.0287302
GemmAndBiasTunableOp_float_TN,tn_2_215_128_ld_128_128_2,Gemm_Hipblaslt_1286,0.0105559
GemmAndBiasTunableOp_float_TN,tn_4_215_128_ld_128_128_4,Gemm_Hipblaslt_1286,0.0106766
GemmAndBiasTunableOp_float_TN,tn_128_134_576_ld_576_576_128,Gemm_Hipblaslt_1284,0.0233304
GemmAndBiasTunableOp_float_TN,tn_2_134_128_ld_128_128_2,Gemm_Hipblaslt_1286,0.0103595
GemmAndBiasTunableOp_float_TN,tn_4_134_128_ld_128_128_4,Gemm_Hipblaslt_1286,0.0103475
GemmAndBiasTunableOp_float_TN,tn_128_117_576_ld_576_576_128,Gemm_Hipblaslt_1284,0.0212974
GemmAndBiasTunableOp_float_TN,tn_2_117_128_ld_128_128_2,Gemm_Hipblaslt_1286,0.010275
GemmAndBiasTunableOp_float_TN,tn_4_117_128_ld_128_128_4,Gemm_Hipblaslt_1284,0.0104657
GemmAndBiasTunableOp_float_TN,tn_128_219_576_ld_576_576_128,Gemm_Hipblaslt_1285,0.0244809
GemmAndBiasTunableOp_float_TN,tn_2_219_128_ld_128_128_2,Gemm_Hipblaslt_1286,0.0102802
GemmAndBiasTunableOp_float_TN,tn_4_219_128_ld_128_128_4,Gemm_Hipblaslt_1286,0.0102713
GemmAndBiasTunableOp_float_TN,tn_128_106_576_ld_576_576_128,Gemm_Hipblaslt_1287,0.177499
GemmAndBiasTunableOp_float_TN,tn_2_106_128_ld_128_128_2,Gemm_Hipblaslt_1286,0.0296752
GemmAndBiasTunableOp_float_TN,tn_4_106_128_ld_128_128_4,Gemm_Hipblaslt_1286,0.0300787
GemmAndBiasTunableOp_float_TN,tn_128_43_576_ld_576_576_128,Gemm_Hipblaslt_1286,0.0885262
GemmAndBiasTunableOp_float_TN,tn_2_43_128_ld_128_128_2,Gemm_Hipblaslt_1286,0.029823
GemmAndBiasTunableOp_float_TN,tn_4_43_128_ld_128_128_4,Gemm_Hipblaslt_1285,0.0231412
GemmAndBiasTunableOp_float_TN,tn_128_148_576_ld_576_576_128,Gemm_Hipblaslt_1287,0.119823
GemmAndBiasTunableOp_float_TN,tn_2_148_128_ld_128_128_2,Gemm_Hipblaslt_1286,0.0512855
GemmAndBiasTunableOp_float_TN,tn_4_148_128_ld_128_128_4,Gemm_Hipblaslt_1285,0.0224973
GemmAndBiasTunableOp_float_TN,tn_128_341_576_ld_576_576_128,Gemm_Hipblaslt_1286,0.127902
GemmAndBiasTunableOp_float_TN,tn_2_341_128_ld_128_128_2,Gemm_Hipblaslt_1286,0.0325795
GemmAndBiasTunableOp_float_TN,tn_4_341_128_ld_128_128_4,Gemm_Hipblaslt_1286,0.0289422
GemmAndBiasTunableOp_float_TN,tn_128_336_576_ld_576_576_128,Gemm_Hipblaslt_1285,0.194393
GemmAndBiasTunableOp_float_TN,tn_2_336_128_ld_128_128_2,Gemm_Hipblaslt_1286,0.0431073
GemmAndBiasTunableOp_float_TN,tn_4_336_128_ld_128_128_4,Gemm_Hipblaslt_1286,0.0526521
GemmAndBiasTunableOp_float_TN,tn_128_399_576_ld_576_576_128,Gemm_Hipblaslt_1285,0.159858
GemmAndBiasTunableOp_float_TN,tn_2_399_128_ld_128_128_2,Gemm_Hipblaslt_1286,0.0379873
GemmAndBiasTunableOp_float_TN,tn_4_399_128_ld_128_128_4,Gemm_Hipblaslt_1286,0.0463675
GemmAndBiasTunableOp_float_TN,tn_128_70_576_ld_576_576_128,Gemm_Hipblaslt_1285,0.0850921
GemmAndBiasTunableOp_float_TN,tn_2_70_128_ld_128_128_2,Gemm_Hipblaslt_1286,0.0284781
GemmAndBiasTunableOp_float_TN,tn_4_70_128_ld_128_128_4,Gemm_Hipblaslt_1286,0.0293286
GemmAndBiasTunableOp_float_TN,tn_128_33_576_ld_576_576_128,Gemm_Hipblaslt_1286,0.135309
GemmAndBiasTunableOp_float_TN,tn_2_33_128_ld_128_128_2,Gemm_Hipblaslt_1286,0.0294868
GemmAndBiasTunableOp_float_TN,tn_4_33_128_ld_128_128_4,Gemm_Hipblaslt_1286,0.0286725
GemmAndBiasTunableOp_float_TN,tn_128_27_576_ld_576_576_128,Gemm_Hipblaslt_1286,0.0811222
GemmAndBiasTunableOp_float_TN,tn_2_27_128_ld_128_128_2,Gemm_Hipblaslt_1286,0.0473133
GemmAndBiasTunableOp_float_TN,tn_4_27_128_ld_128_128_4,Gemm_Hipblaslt_1286,0.0493179
GemmAndBiasTunableOp_float_TN,tn_128_13_576_ld_576_576_128,Gemm_Hipblaslt_1286,0.0891974
GemmAndBiasTunableOp_float_TN,tn_2_13_128_ld_128_128_2,Gemm_Hipblaslt_1286,0.0249772
GemmAndBiasTunableOp_float_TN,tn_4_13_128_ld_128_128_4,Gemm_Hipblaslt_1286,0.0465049
GemmAndBiasTunableOp_float_TN,tn_128_21_576_ld_576_576_128,Gemm_Hipblaslt_1286,0.0839748
GemmAndBiasTunableOp_float_TN,tn_2_21_128_ld_128_128_2,Gemm_Hipblaslt_1286,0.0303568
GemmAndBiasTunableOp_float_TN,tn_4_21_128_ld_128_128_4,Gemm_Hipblaslt_1286,0.0235284
GemmAndBiasTunableOp_float_TN,tn_128_9_576_ld_576_576_128,Gemm_Hipblaslt_1286,0.01969
GemmAndBiasTunableOp_float_TN,tn_2_9_128_ld_128_128_2,Gemm_Hipblaslt_1284,0.0107527
GemmAndBiasTunableOp_float_TN,tn_4_9_128_ld_128_128_4,Gemm_Hipblaslt_1286,0.0106128
GemmAndBiasTunableOp_float_TN,tn_128_5_576_ld_576_576_128,Gemm_Hipblaslt_1286,0.0198912
GemmAndBiasTunableOp_float_TN,tn_2_5_128_ld_128_128_2,Gemm_Hipblaslt_1286,0.0106661
GemmAndBiasTunableOp_float_TN,tn_4_5_128_ld_128_128_4,Gemm_Hipblaslt_1286,0.0107423
GemmAndBiasTunableOp_float_TN,tn_128_31_576_ld_576_576_128,Gemm_Hipblaslt_1286,0.0194812
GemmAndBiasTunableOp_float_TN,tn_2_31_128_ld_128_128_2,Gemm_Hipblaslt_1286,0.0105151
GemmAndBiasTunableOp_float_TN,tn_4_31_128_ld_128_128_4,Gemm_Hipblaslt_1284,0.0104946
GemmAndBiasTunableOp_float_TN,tn_128_249_576_ld_576_576_128,Gemm_Hipblaslt_1285,0.029147
GemmAndBiasTunableOp_float_TN,tn_2_249_128_ld_128_128_2,Gemm_Hipblaslt_1284,0.0106236
GemmAndBiasTunableOp_float_TN,tn_4_249_128_ld_128_128_4,Gemm_Hipblaslt_1284,0.0105943
GemmAndBiasTunableOp_float_TN,tn_128_480_576_ld_576_576_128,Gemm_Hipblaslt_1285,0.0357158
GemmAndBiasTunableOp_float_TN,tn_2_480_128_ld_128_128_2,Gemm_Hipblaslt_1284,0.011329
GemmAndBiasTunableOp_float_TN,tn_4_480_128_ld_128_128_4,Gemm_Hipblaslt_1284,0.0111811
GemmAndBiasTunableOp_float_TN,tn_128_137_576_ld_576_576_128,Gemm_Hipblaslt_1284,0.024818
GemmAndBiasTunableOp_float_TN,tn_2_137_128_ld_128_128_2,Gemm_Hipblaslt_1286,0.0105243
GemmAndBiasTunableOp_float_TN,tn_4_137_128_ld_128_128_4,Gemm_Hipblaslt_1286,0.0106224
GemmAndBiasTunableOp_float_TN,tn_128_11_576_ld_576_576_128,Gemm_Hipblaslt_1286,0.0199692
GemmAndBiasTunableOp_float_TN,tn_2_11_128_ld_128_128_2,Gemm_Hipblaslt_1286,0.0106304
GemmAndBiasTunableOp_float_TN,tn_4_11_128_ld_128_128_4,Gemm_Hipblaslt_1286,0.0109102
GemmAndBiasTunableOp_float_TN,tn_128_24_576_ld_576_576_128,Gemm_Hipblaslt_1286,0.0202238
GemmAndBiasTunableOp_float_TN,tn_2_24_128_ld_128_128_2,Gemm_Hipblaslt_1286,0.010612
GemmAndBiasTunableOp_float_TN,tn_4_24_128_ld_128_128_4,Gemm_Hipblaslt_1286,0.0106232
GemmAndBiasTunableOp_float_TN,tn_128_159_576_ld_576_576_128,Gemm_Hipblaslt_1284,0.0255775
GemmAndBiasTunableOp_float_TN,tn_2_159_128_ld_128_128_2,Gemm_Hipblaslt_1286,0.0104036
GemmAndBiasTunableOp_float_TN,tn_4_159_128_ld_128_128_4,Gemm_Hipblaslt_1286,0.0105656
GemmAndBiasTunableOp_float_TN,tn_128_29_576_ld_576_576_128,Gemm_Hipblaslt_1286,0.0207776
GemmAndBiasTunableOp_float_TN,tn_2_29_128_ld_128_128_2,Gemm_Hipblaslt_1286,0.0106408
GemmAndBiasTunableOp_float_TN,tn_4_29_128_ld_128_128_4,Gemm_Hipblaslt_1286,0.0106044
GemmAndBiasTunableOp_float_TN,tn_128_49_576_ld_576_576_128,Gemm_Hipblaslt_1286,0.0201067
GemmAndBiasTunableOp_float_TN,tn_2_49_128_ld_128_128_2,Gemm_Hipblaslt_1284,0.0104477
GemmAndBiasTunableOp_float_TN,tn_4_49_128_ld_128_128_4,Gemm_Hipblaslt_1286,0.0104509
GemmAndBiasTunableOp_float_TN,tn_128_71_576_ld_576_576_128,Gemm_Hipblaslt_1286,0.0216224
GemmAndBiasTunableOp_float_TN,tn_2_71_128_ld_128_128_2,Gemm_Hipblaslt_1286,0.010378
GemmAndBiasTunableOp_float_TN,tn_4_71_128_ld_128_128_4,Gemm_Hipblaslt_1284,0.0107166
GemmAndBiasTunableOp_float_TN,tn_128_156_576_ld_576_576_128,Gemm_Hipblaslt_1284,0.0268655
GemmAndBiasTunableOp_float_TN,tn_2_156_128_ld_128_128_2,Gemm_Hipblaslt_1284,0.0105615
GemmAndBiasTunableOp_float_TN,tn_4_156_128_ld_128_128_4,Gemm_Hipblaslt_1286,0.0104865
GemmAndBiasTunableOp_float_TN,tn_128_270_576_ld_576_576_128,Gemm_Hipblaslt_1285,0.0266979
GemmAndBiasTunableOp_float_TN,tn_2_270_128_ld_128_128_2,Gemm_Hipblaslt_1284,0.0104529
GemmAndBiasTunableOp_float_TN,tn_4_270_128_ld_128_128_4,Gemm_Hipblaslt_1286,0.0103479
GemmAndBiasTunableOp_float_TN,tn_128_32_576_ld_576_576_128,Gemm_Hipblaslt_1286,0.02057
GemmAndBiasTunableOp_float_TN,tn_2_32_128_ld_128_128_2,Gemm_Hipblaslt_1286,0.0106036
GemmAndBiasTunableOp_float_TN,tn_4_32_128_ld_128_128_4,Gemm_Hipblaslt_1286,0.0105447
GemmAndBiasTunableOp_float_TN,tn_128_334_576_ld_576_576_128,Gemm_Hipblaslt_1285,0.0299445
GemmAndBiasTunableOp_float_TN,tn_2_334_128_ld_128_128_2,Gemm_Hipblaslt_1284,0.0112372
GemmAndBiasTunableOp_float_TN,tn_4_334_128_ld_128_128_4,Gemm_Hipblaslt_1286,0.0109863
GemmAndBiasTunableOp_float_TN,tn_128_50_576_ld_576_576_128,Gemm_Hipblaslt_1284,0.0207703
GemmAndBiasTunableOp_float_TN,tn_2_50_128_ld_128_128_2,Gemm_Hipblaslt_1286,0.0455359
GemmAndBiasTunableOp_float_TN,tn_4_50_128_ld_128_128_4,Gemm_Hipblaslt_1287,0.0409392
GemmAndBiasTunableOp_float_TN,tn_128_280_576_ld_576_576_128,Gemm_Hipblaslt_1285,0.0269673
GemmAndBiasTunableOp_float_TN,tn_2_280_128_ld_128_128_2,Gemm_Hipblaslt_1284,0.011115
GemmAndBiasTunableOp_float_TN,tn_4_280_128_ld_128_128_4,Gemm_Hipblaslt_1284,0.0109891
GemmAndBiasTunableOp_float_TN,tn_128_271_576_ld_576_576_128,Gemm_Hipblaslt_1285,0.0259238
GemmAndBiasTunableOp_float_TN,tn_2_271_128_ld_128_128_2,Gemm_Hipblaslt_1286,0.0104713
GemmAndBiasTunableOp_float_TN,tn_4_271_128_ld_128_128_4,Gemm_Hipblaslt_1286,0.0101052
GemmAndBiasTunableOp_float_TN,tn_128_7_576_ld_576_576_128,Gemm_Hipblaslt_1284,0.0196495
GemmAndBiasTunableOp_float_TN,tn_2_7_128_ld_128_128_2,Gemm_Hipblaslt_1286,0.0109122
GemmAndBiasTunableOp_float_TN,tn_4_7_128_ld_128_128_4,Gemm_Hipblaslt_1286,0.0111719
GemmAndBiasTunableOp_float_TN,tn_128_109_576_ld_576_576_128,Gemm_Hipblaslt_1287,0.109593
GemmAndBiasTunableOp_float_TN,tn_2_109_128_ld_128_128_2,Gemm_Hipblaslt_1286,0.0287602
GemmAndBiasTunableOp_float_TN,tn_4_109_128_ld_128_128_4,Gemm_Hipblaslt_1286,0.0239179
GemmAndBiasTunableOp_float_TN,tn_128_267_576_ld_576_576_128,Gemm_Hipblaslt_1287,0.0852264
GemmAndBiasTunableOp_float_TN,tn_2_267_128_ld_128_128_2,Gemm_Hipblaslt_1286,0.0531287
GemmAndBiasTunableOp_float_TN,tn_4_267_128_ld_128_128_4,Gemm_Hipblaslt_1286,0.0315703
GemmAndBiasTunableOp_float_TN,tn_128_10_576_ld_576_576_128,Gemm_Hipblaslt_1286,0.0839167
GemmAndBiasTunableOp_float_TN,tn_2_10_128_ld_128_128_2,Gemm_Hipblaslt_1285,0.0232102
GemmAndBiasTunableOp_float_TN,tn_4_10_128_ld_128_128_4,Gemm_Hipblaslt_1286,0.0444667
GemmAndBiasTunableOp_float_TN,tn_128_37_576_ld_576_576_128,Gemm_Hipblaslt_1286,0.129503
GemmAndBiasTunableOp_float_TN,tn_2_37_128_ld_128_128_2,Gemm_Hipblaslt_1286,0.0306774
GemmAndBiasTunableOp_float_TN,tn_4_37_128_ld_128_128_4,Gemm_Hipblaslt_1284,0.0229565
GemmAndBiasTunableOp_float_TN,tn_128_81_576_ld_576_576_128,Gemm_Hipblaslt_1284,0.0209957
GemmAndBiasTunableOp_float_TN,tn_2_81_128_ld_128_128_2,Gemm_Hipblaslt_1286,0.0104112
GemmAndBiasTunableOp_float_TN,tn_4_81_128_ld_128_128_4,Gemm_Hipblaslt_1286,0.0103911
GemmAndBiasTunableOp_float_TN,tn_128_92_576_ld_576_576_128,Gemm_Hipblaslt_1284,0.0208168
GemmAndBiasTunableOp_float_TN,tn_2_92_128_ld_128_128_2,Gemm_Hipblaslt_1284,0.0100173
GemmAndBiasTunableOp_float_TN,tn_4_92_128_ld_128_128_4,Gemm_Hipblaslt_1286,0.0102714
GemmAndBiasTunableOp_float_TN,tn_128_161_576_ld_576_576_128,Gemm_Hipblaslt_1284,0.0273696
GemmAndBiasTunableOp_float_TN,tn_2_161_128_ld_128_128_2,Gemm_Hipblaslt_1284,0.0103992
GemmAndBiasTunableOp_float_TN,tn_4_161_128_ld_128_128_4,Gemm_Hipblaslt_1286,0.0104133
GemmAndBiasTunableOp_float_TN,tn_128_369_576_ld_576_576_128,Gemm_Hipblaslt_1285,0.0315575
GemmAndBiasTunableOp_float_TN,tn_2_369_128_ld_128_128_2,Gemm_Hipblaslt_1284,0.0104196
GemmAndBiasTunableOp_float_TN,tn_4_369_128_ld_128_128_4,Gemm_Hipblaslt_1286,0.0104084
GemmAndBiasTunableOp_float_TN,tn_128_26_576_ld_576_576_128,Gemm_Hipblaslt_1286,0.0194446
GemmAndBiasTunableOp_float_TN,tn_2_26_128_ld_128_128_2,Gemm_Hipblaslt_1286,0.0105534
GemmAndBiasTunableOp_float_TN,tn_4_26_128_ld_128_128_4,Gemm_Hipblaslt_1286,0.0105964
GemmAndBiasTunableOp_float_TN,tn_128_105_576_ld_576_576_128,Gemm_Hipblaslt_1286,0.0224467
GemmAndBiasTunableOp_float_TN,tn_2_105_128_ld_128_128_2,Gemm_Hipblaslt_1284,0.0104665
GemmAndBiasTunableOp_float_TN,tn_4_105_128_ld_128_128_4,Gemm_Hipblaslt_1286,0.0104135
GemmAndBiasTunableOp_float_TN,tn_128_39_576_ld_576_576_128,Gemm_Hipblaslt_1286,0.0194086
GemmAndBiasTunableOp_float_TN,tn_2_39_128_ld_128_128_2,Gemm_Hipblaslt_1286,0.0106064
GemmAndBiasTunableOp_float_TN,tn_4_39_128_ld_128_128_4,Gemm_Hipblaslt_1286,0.0104918
GemmAndBiasTunableOp_float_TN,tn_128_65_576_ld_576_576_128,Gemm_Hipblaslt_1284,0.0210674
GemmAndBiasTunableOp_float_TN,tn_2_65_128_ld_128_128_2,Gemm_Hipblaslt_1286,0.010475
GemmAndBiasTunableOp_float_TN,tn_4_65_128_ld_128_128_4,Gemm_Hipblaslt_1286,0.0103932
GemmAndBiasTunableOp_float_TN,tn_128_193_576_ld_576_576_128,Gemm_Hipblaslt_1285,0.0284781
GemmAndBiasTunableOp_float_TN,tn_2_193_128_ld_128_128_2,Gemm_Hipblaslt_1284,0.0104942
GemmAndBiasTunableOp_float_TN,tn_4_193_128_ld_128_128_4,Gemm_Hipblaslt_1286,0.0104821
GemmAndBiasTunableOp_float_TN,tn_128_118_576_ld_576_576_128,Gemm_Hipblaslt_1286,0.0227854
GemmAndBiasTunableOp_float_TN,tn_2_118_128_ld_128_128_2,Gemm_Hipblaslt_1286,0.0102369
GemmAndBiasTunableOp_float_TN,tn_4_118_128_ld_128_128_4,Gemm_Hipblaslt_1284,0.0103936
GemmAndBiasTunableOp_float_TN,tn_128_22_576_ld_576_576_128,Gemm_Hipblaslt_1286,0.0197136
GemmAndBiasTunableOp_float_TN,tn_2_22_128_ld_128_128_2,Gemm_Hipblaslt_1286,0.0106316
GemmAndBiasTunableOp_float_TN,tn_4_22_128_ld_128_128_4,Gemm_Hipblaslt_1284,0.0108556
GemmAndBiasTunableOp_float_TN,tn_128_89_576_ld_576_576_128,Gemm_Hipblaslt_1284,0.0212092
GemmAndBiasTunableOp_float_TN,tn_2_89_128_ld_128_128_2,Gemm_Hipblaslt_1286,0.0104285
GemmAndBiasTunableOp_float_TN,tn_4_89_128_ld_128_128_4,Gemm_Hipblaslt_1286,0.010541
GemmAndBiasTunableOp_float_TN,tn_128_151_576_ld_576_576_128,Gemm_Hipblaslt_1284,0.0241937
GemmAndBiasTunableOp_float_TN,tn_2_151_128_ld_128_128_2,Gemm_Hipblaslt_1286,0.0103916
GemmAndBiasTunableOp_float_TN,tn_4_151_128_ld_128_128_4,Gemm_Hipblaslt_1286,0.0103812
GemmAndBiasTunableOp_float_TN,tn_128_194_576_ld_576_576_128,Gemm_Hipblaslt_1285,0.0279752
GemmAndBiasTunableOp_float_TN,tn_2_194_128_ld_128_128_2,Gemm_Hipblaslt_1284,0.010475
GemmAndBiasTunableOp_float_TN,tn_4_194_128_ld_128_128_4,Gemm_Hipblaslt_1286,0.0105907
GemmAndBiasTunableOp_float_TN,tn_128_244_576_ld_576_576_128,Gemm_Hipblaslt_1285,0.0282088
GemmAndBiasTunableOp_float_TN,tn_2_244_128_ld_128_128_2,Gemm_Hipblaslt_1286,0.0107287
GemmAndBiasTunableOp_float_TN,tn_4_244_128_ld_128_128_4,Gemm_Hipblaslt_1286,0.0107567
GemmAndBiasTunableOp_float_TN,tn_128_127_576_ld_576_576_128,Gemm_Hipblaslt_1284,0.0237371
GemmAndBiasTunableOp_float_TN,tn_2_127_128_ld_128_128_2,Gemm_Hipblaslt_1286,0.0104024
GemmAndBiasTunableOp_float_TN,tn_4_127_128_ld_128_128_4,Gemm_Hipblaslt_1284,0.010303
GemmAndBiasTunableOp_float_TN,tn_128_304_576_ld_576_576_128,Gemm_Hipblaslt_1285,0.0271617
GemmAndBiasTunableOp_float_TN,tn_2_304_128_ld_128_128_2,Gemm_Hipblaslt_1284,0.0105651
GemmAndBiasTunableOp_float_TN,tn_4_304_128_ld_128_128_4,Gemm_Hipblaslt_1286,0.0104761
GemmAndBiasTunableOp_float_TN,tn_128_51_576_ld_576_576_128,Gemm_Hipblaslt_1286,0.0203717
GemmAndBiasTunableOp_float_TN,tn_2_51_128_ld_128_128_2,Gemm_Hipblaslt_1286,0.0104537
GemmAndBiasTunableOp_float_TN,tn_4_51_128_ld_128_128_4,Gemm_Hipblaslt_1286,0.0104958
GemmAndBiasTunableOp_float_TN,tn_128_63_576_ld_576_576_128,Gemm_Hipblaslt_1286,0.0218344
GemmAndBiasTunableOp_float_TN,tn_2_63_128_ld_128_128_2,Gemm_Hipblaslt_1286,0.0105947
GemmAndBiasTunableOp_float_TN,tn_4_63_128_ld_128_128_4,Gemm_Hipblaslt_1284,0.0105916
GemmAndBiasTunableOp_float_TN,tn_128_191_576_ld_576_576_128,Gemm_Hipblaslt_1285,0.0285491
GemmAndBiasTunableOp_float_TN,tn_2_191_128_ld_128_128_2,Gemm_Hipblaslt_1286,0.0104256
GemmAndBiasTunableOp_float_TN,tn_4_191_128_ld_128_128_4,Gemm_Hipblaslt_1284,0.0105491
GemmAndBiasTunableOp_float_TN,tn_128_47_576_ld_576_576_128,Gemm_Hipblaslt_1286,0.0201063
GemmAndBiasTunableOp_float_TN,tn_2_47_128_ld_128_128_2,Gemm_Hipblaslt_1284,0.0106128
GemmAndBiasTunableOp_float_TN,tn_4_47_128_ld_128_128_4,Gemm_Hipblaslt_1286,0.0105351
GemmAndBiasTunableOp_float_TN,tn_128_2_576_ld_576_576_128,Gemm_Hipblaslt_1286,0.0199131
GemmAndBiasTunableOp_float_TN,tn_2_2_128_ld_128_128_2,Gemm_Hipblaslt_1284,0.010917
GemmAndBiasTunableOp_float_TN,tn_4_2_128_ld_128_128_4,Gemm_Hipblaslt_1286,0.0106873
GemmAndBiasTunableOp_float_TN,tn_128_454_576_ld_576_576_128,Gemm_Hipblaslt_1285,0.0358998
GemmAndBiasTunableOp_float_TN,tn_2_454_128_ld_128_128_2,Gemm_Hipblaslt_1284,0.0109799
GemmAndBiasTunableOp_float_TN,tn_4_454_128_ld_128_128_4,Gemm_Hipblaslt_1286,0.0104874
GemmAndBiasTunableOp_float_TN,tn_256_23_1152_ld_1152_1152_256,Gemm_Hipblaslt_1286,0.0329922
GemmAndBiasTunableOp_float_TN,tn_2_23_256_ld_256_256_2,Gemm_Hipblaslt_1286,0.0131031
GemmAndBiasTunableOp_float_TN,tn_4_23_256_ld_256_256_4,Gemm_Hipblaslt_1286,0.013267
GemmAndBiasTunableOp_float_TN,tn_10_23_256_ld_256_256_10,Gemm_Hipblaslt_1286,0.0129095
GemmAndBiasTunableOp_float_TN,tn_128_206_576_ld_576_576_128,Gemm_Hipblaslt_1285,0.0295009
GemmAndBiasTunableOp_float_TN,tn_2_206_128_ld_128_128_2,Gemm_Hipblaslt_1286,0.0107988
GemmAndBiasTunableOp_float_TN,tn_4_206_128_ld_128_128_4,Gemm_Hipblaslt_1284,0.0106032
GemmAndBiasTunableOp_float_TN,tn_128_355_576_ld_576_576_128,Gemm_Hipblaslt_1285,0.0319402
GemmAndBiasTunableOp_float_TN,tn_2_355_128_ld_128_128_2,Gemm_Hipblaslt_1284,0.0112572
GemmAndBiasTunableOp_float_TN,tn_4_355_128_ld_128_128_4,Gemm_Hipblaslt_1286,0.0112752
GemmAndBiasTunableOp_float_TN,tn_128_121_576_ld_576_576_128,Gemm_Hipblaslt_1284,0.0230498
GemmAndBiasTunableOp_float_TN,tn_2_121_128_ld_128_128_2,Gemm_Hipblaslt_1286,0.0102437
GemmAndBiasTunableOp_float_TN,tn_4_121_128_ld_128_128_4,Gemm_Hipblaslt_1286,0.0104352
GemmAndBiasTunableOp_float_TN,tn_128_186_576_ld_576_576_128,Gemm_Hipblaslt_1285,0.0291333
GemmAndBiasTunableOp_float_TN,tn_2_186_128_ld_128_128_2,Gemm_Hipblaslt_1286,0.0104549
GemmAndBiasTunableOp_float_TN,tn_4_186_128_ld_128_128_4,Gemm_Hipblaslt_1286,0.0105711
GemmAndBiasTunableOp_float_TN,tn_128_78_576_ld_576_576_128,Gemm_Hipblaslt_1286,0.0210156
GemmAndBiasTunableOp_float_TN,tn_2_78_128_ld_128_128_2,Gemm_Hipblaslt_1286,0.0105643
GemmAndBiasTunableOp_float_TN,tn_4_78_128_ld_128_128_4,Gemm_Hipblaslt_1286,0.0104261
GemmAndBiasTunableOp_float_TN,tn_128_246_576_ld_576_576_128,Gemm_Hipblaslt_1285,0.0285411
GemmAndBiasTunableOp_float_TN,tn_2_246_128_ld_128_128_2,Gemm_Hipblaslt_1284,0.0106236
GemmAndBiasTunableOp_float_TN,tn_4_246_128_ld_128_128_4,Gemm_Hipblaslt_1286,0.0104513
GemmAndBiasTunableOp_float_TN,tn_128_149_576_ld_576_576_128,Gemm_Hipblaslt_1284,0.023762
GemmAndBiasTunableOp_float_TN,tn_2_149_128_ld_128_128_2,Gemm_Hipblaslt_1286,0.0103827
GemmAndBiasTunableOp_float_TN,tn_4_149_128_ld_128_128_4,Gemm_Hipblaslt_1286,0.0104657
GemmAndBiasTunableOp_float_TN,tn_128_279_576_ld_576_576_128,Gemm_Hipblaslt_1285,0.0275968
GemmAndBiasTunableOp_float_TN,tn_2_279_128_ld_128_128_2,Gemm_Hipblaslt_1284,0.0104753
GemmAndBiasTunableOp_float_TN,tn_4_279_128_ld_128_128_4,Gemm_Hipblaslt_1286,0.0103359
GemmAndBiasTunableOp_float_TN,tn_128_124_576_ld_576_576_128,Gemm_Hipblaslt_1284,0.0230578
GemmAndBiasTunableOp_float_TN,tn_2_124_128_ld_128_128_2,Gemm_Hipblaslt_1286,0.010416
GemmAndBiasTunableOp_float_TN,tn_4_124_128_ld_128_128_4,Gemm_Hipblaslt_1284,0.0104317
GemmAndBiasTunableOp_float_TN,tn_128_327_576_ld_576_576_128,Gemm_Hipblaslt_1285,0.0306582
GemmAndBiasTunableOp_float_TN,tn_2_327_128_ld_128_128_2,Gemm_Hipblaslt_1284,0.0109426
GemmAndBiasTunableOp_float_TN,tn_4_327_128_ld_128_128_4,Gemm_Hipblaslt_1284,0.0108152
GemmAndBiasTunableOp_float_TN,tn_256_21_1152_ld_1152_1152_256,Gemm_Hipblaslt_1286,0.0330587
GemmAndBiasTunableOp_float_TN,tn_2_21_256_ld_256_256_2,Gemm_Hipblaslt_1286,0.013299
GemmAndBiasTunableOp_float_TN,tn_4_21_256_ld_256_256_4,Gemm_Hipblaslt_1286,0.0133672
GemmAndBiasTunableOp_float_TN,tn_10_21_256_ld_256_256_10,Gemm_Hipblaslt_1286,0.0129773
GemmAndBiasTunableOp_float_TN,tn_128_345_576_ld_576_576_128,Gemm_Hipblaslt_1285,0.0375052
GemmAndBiasTunableOp_float_TN,tn_2_345_128_ld_128_128_2,Gemm_Hipblaslt_1284,0.0113562
GemmAndBiasTunableOp_float_TN,tn_4_345_128_ld_128_128_4,Gemm_Hipblaslt_1286,0.0113346
GemmAndBiasTunableOp_float_TN,tn_128_98_576_ld_576_576_128,Gemm_Hipblaslt_1284,0.0212809
GemmAndBiasTunableOp_float_TN,tn_2_98_128_ld_128_128_2,Gemm_Hipblaslt_1284,0.0104713
GemmAndBiasTunableOp_float_TN,tn_4_98_128_ld_128_128_4,Gemm_Hipblaslt_1284,0.0105603
GemmAndBiasTunableOp_float_TN,tn_128_141_576_ld_576_576_128,Gemm_Hipblaslt_1284,0.0251991
GemmAndBiasTunableOp_float_TN,tn_2_141_128_ld_128_128_2,Gemm_Hipblaslt_1286,0.0104857
GemmAndBiasTunableOp_float_TN,tn_4_141_128_ld_128_128_4,Gemm_Hipblaslt_1286,0.0103851
GemmAndBiasTunableOp_float_TN,tn_128_20_576_ld_576_576_128,Gemm_Hipblaslt_1286,0.019958
GemmAndBiasTunableOp_float_TN,tn_2_20_128_ld_128_128_2,Gemm_Hipblaslt_1286,0.010632
GemmAndBiasTunableOp_float_TN,tn_4_20_128_ld_128_128_4,Gemm_Hipblaslt_1286,0.0105647
GemmAndBiasTunableOp_float_TN,tn_128_38_576_ld_576_576_128,Gemm_Hipblaslt_1286,0.0213298
GemmAndBiasTunableOp_float_TN,tn_2_38_128_ld_128_128_2,Gemm_Hipblaslt_1286,0.0105812
GemmAndBiasTunableOp_float_TN,tn_4_38_128_ld_128_128_4,Gemm_Hipblaslt_1286,0.01059
GemmAndBiasTunableOp_float_TN,tn_128_14_576_ld_576_576_128,Gemm_Hipblaslt_1286,0.0200001
GemmAndBiasTunableOp_float_TN,tn_2_14_128_ld_128_128_2,Gemm_Hipblaslt_1286,0.0106785
GemmAndBiasTunableOp_float_TN,tn_4_14_128_ld_128_128_4,Gemm_Hipblaslt_1286,0.0105503
GemmAndBiasTunableOp_float_TN,tn_128_218_576_ld_576_576_128,Gemm_Hipblaslt_1285,0.027148
GemmAndBiasTunableOp_float_TN,tn_2_218_128_ld_128_128_2,Gemm_Hipblaslt_1286,0.0105211
GemmAndBiasTunableOp_float_TN,tn_4_218_128_ld_128_128_4,Gemm_Hipblaslt_1286,0.0105082
GemmAndBiasTunableOp_float_TN,tn_256_28_1152_ld_1152_1152_256,Gemm_Hipblaslt_1286,0.0336759
GemmAndBiasTunableOp_float_TN,tn_2_28_256_ld_256_256_2,Gemm_Hipblaslt_1286,0.0133479
GemmAndBiasTunableOp_float_TN,tn_4_28_256_ld_256_256_4,Gemm_Hipblaslt_1286,0.0132766
GemmAndBiasTunableOp_float_TN,tn_10_28_256_ld_256_256_10,Gemm_Hipblaslt_1286,0.0130438
GemmAndBiasTunableOp_float_TN,tn_128_96_576_ld_576_576_128,Gemm_Hipblaslt_1284,0.0213205
GemmAndBiasTunableOp_float_TN,tn_2_96_128_ld_128_128_2,Gemm_Hipblaslt_1286,0.0103022
GemmAndBiasTunableOp_float_TN,tn_4_96_128_ld_128_128_4,Gemm_Hipblaslt_1286,0.0104213
GemmAndBiasTunableOp_float_TN,tn_128_283_576_ld_576_576_128,Gemm_Hipblaslt_1285,0.0335349
GemmAndBiasTunableOp_float_TN,tn_2_283_128_ld_128_128_2,Gemm_Hipblaslt_1284,0.010808
GemmAndBiasTunableOp_float_TN,tn_4_283_128_ld_128_128_4,Gemm_Hipblaslt_1284,0.0106401
GemmAndBiasTunableOp_float_TN,tn_128_243_576_ld_576_576_128,Gemm_Hipblaslt_1285,0.0273936
GemmAndBiasTunableOp_float_TN,tn_2_243_128_ld_128_128_2,Gemm_Hipblaslt_1286,0.0102723
GemmAndBiasTunableOp_float_TN,tn_4_243_128_ld_128_128_4,Gemm_Hipblaslt_1286,0.0103046
GemmAndBiasTunableOp_float_TN,tn_256_51_1152_ld_1152_1152_256,Gemm_Hipblaslt_1284,0.0356324
GemmAndBiasTunableOp_float_TN,tn_2_51_256_ld_256_256_2,Gemm_Hipblaslt_1286,0.0132778
GemmAndBiasTunableOp_float_TN,tn_4_51_256_ld_256_256_4,Gemm_Hipblaslt_1286,0.0132241
GemmAndBiasTunableOp_float_TN,tn_10_51_256_ld_256_256_10,Gemm_Hipblaslt_1286,0.0127733
GemmAndBiasTunableOp_float_TN,tn_128_259_576_ld_576_576_128,Gemm_Hipblaslt_1285,0.0291397
GemmAndBiasTunableOp_float_TN,tn_2_259_128_ld_128_128_2,Gemm_Hipblaslt_1284,0.0104593
GemmAndBiasTunableOp_float_TN,tn_4_259_128_ld_128_128_4,Gemm_Hipblaslt_1286,0.0103679
GemmAndBiasTunableOp_float_TN,tn_128_422_576_ld_576_576_128,Gemm_Hipblaslt_1285,0.0351098
GemmAndBiasTunableOp_float_TN,tn_2_422_128_ld_128_128_2,Gemm_Hipblaslt_1286,0.011183
GemmAndBiasTunableOp_float_TN,tn_4_422_128_ld_128_128_4,Gemm_Hipblaslt_1284,0.0109511
GemmAndBiasTunableOp_float_TN,tn_128_388_576_ld_576_576_128,Gemm_Hipblaslt_1285,0.032278
GemmAndBiasTunableOp_float_TN,tn_2_388_128_ld_128_128_2,Gemm_Hipblaslt_1284,0.0108713
GemmAndBiasTunableOp_float_TN,tn_4_388_128_ld_128_128_4,Gemm_Hipblaslt_1286,0.0109234
GemmAndBiasTunableOp_float_TN,tn_128_131_576_ld_576_576_128,Gemm_Hipblaslt_1286,0.0245543
GemmAndBiasTunableOp_float_TN,tn_2_131_128_ld_128_128_2,Gemm_Hipblaslt_1284,0.0104125
GemmAndBiasTunableOp_float_TN,tn_4_131_128_ld_128_128_4,Gemm_Hipblaslt_1286,0.0103976
GemmAndBiasTunableOp_float_TN,tn_128_199_576_ld_576_576_128,Gemm_Hipblaslt_1285,0.0266844
GemmAndBiasTunableOp_float_TN,tn_2_199_128_ld_128_128_2,Gemm_Hipblaslt_1286,0.0104533
GemmAndBiasTunableOp_float_TN,tn_4_199_128_ld_128_128_4,Gemm_Hipblaslt_1286,0.0104581
GemmAndBiasTunableOp_float_TN,tn_128_224_576_ld_576_576_128,Gemm_Hipblaslt_1285,0.0277607
GemmAndBiasTunableOp_float_TN,tn_2_224_128_ld_128_128_2,Gemm_Hipblaslt_1286,0.0105671
GemmAndBiasTunableOp_float_TN,tn_4_224_128_ld_128_128_4,Gemm_Hipblaslt_1286,0.0105407
GemmAndBiasTunableOp_float_TN,tn_128_19_576_ld_576_576_128,Gemm_Hipblaslt_1286,0.020265
GemmAndBiasTunableOp_float_TN,tn_2_19_128_ld_128_128_2,Gemm_Hipblaslt_1286,0.0106769
GemmAndBiasTunableOp_float_TN,tn_4_19_128_ld_128_128_4,Gemm_Hipblaslt_1286,0.0105615
GemmAndBiasTunableOp_float_TN,tn_128_3_576_ld_576_576_128,Gemm_Hipblaslt_1286,0.0198174
GemmAndBiasTunableOp_float_TN,tn_2_3_128_ld_128_128_2,Gemm_Hipblaslt_1286,0.0106316
GemmAndBiasTunableOp_float_TN,tn_4_3_128_ld_128_128_4,Gemm_Hipblaslt_1286,0.0106416
GemmAndBiasTunableOp_float_TN,tn_128_169_576_ld_576_576_128,Gemm_Hipblaslt_1285,0.0239796
GemmAndBiasTunableOp_float_TN,tn_2_169_128_ld_128_128_2,Gemm_Hipblaslt_1286,0.0103054
GemmAndBiasTunableOp_float_TN,tn_4_169_128_ld_128_128_4,Gemm_Hipblaslt_1284,0.0103952
GemmAndBiasTunableOp_float_TN,tn_128_166_576_ld_576_576_128,Gemm_Hipblaslt_1284,0.0274818
GemmAndBiasTunableOp_float_TN,tn_2_166_128_ld_128_128_2,Gemm_Hipblaslt_1286,0.0104922
GemmAndBiasTunableOp_float_TN,tn_4_166_128_ld_128_128_4,Gemm_Hipblaslt_1286,0.0103595
GemmAndBiasTunableOp_float_TN,tn_256_11_1152_ld_1152_1152_256,Gemm_Hipblaslt_1286,0.0323894
GemmAndBiasTunableOp_float_TN,tn_2_11_256_ld_256_256_2,Gemm_Hipblaslt_1286,0.0135279
GemmAndBiasTunableOp_float_TN,tn_4_11_256_ld_256_256_4,Gemm_Hipblaslt_1286,0.0133564
GemmAndBiasTunableOp_float_TN,tn_10_11_256_ld_256_256_10,Gemm_Hipblaslt_1286,0.0128298
GemmAndBiasTunableOp_float_TN,tn_128_138_576_ld_576_576_128,Gemm_Hipblaslt_1284,0.0241523
GemmAndBiasTunableOp_float_TN,tn_2_138_128_ld_128_128_2,Gemm_Hipblaslt_1284,0.0105086
GemmAndBiasTunableOp_float_TN,tn_4_138_128_ld_128_128_4,Gemm_Hipblaslt_1286,0.0103716
GemmAndBiasTunableOp_float_TN,tn_256_9_1152_ld_1152_1152_256,Gemm_Hipblaslt_1286,0.0324283
GemmAndBiasTunableOp_float_TN,tn_2_9_256_ld_256_256_2,Gemm_Hipblaslt_1286,0.0134069
GemmAndBiasTunableOp_float_TN,tn_4_9_256_ld_256_256_4,Gemm_Hipblaslt_1286,0.0134245
GemmAndBiasTunableOp_float_TN,tn_10_9_256_ld_256_256_10,Gemm_Hipblaslt_1286,0.0129776
GemmAndBiasTunableOp_float_TN,tn_128_68_576_ld_576_576_128,Gemm_Hipblaslt_1284,0.022084
GemmAndBiasTunableOp_float_TN,tn_2_68_128_ld_128_128_2,Gemm_Hipblaslt_1286,0.0103214
GemmAndBiasTunableOp_float_TN,tn_4_68_128_ld_128_128_4,Gemm_Hipblaslt_1286,0.010537
GemmAndBiasTunableOp_float_TN,tn_128_143_576_ld_576_576_128,Gemm_Hipblaslt_1284,0.0229281
GemmAndBiasTunableOp_float_TN,tn_2_143_128_ld_128_128_2,Gemm_Hipblaslt_1284,0.0103772
GemmAndBiasTunableOp_float_TN,tn_4_143_128_ld_128_128_4,Gemm_Hipblaslt_1286,0.010202
GemmAndBiasTunableOp_float_TN,tn_128_237_576_ld_576_576_128,Gemm_Hipblaslt_1285,0.0296807
GemmAndBiasTunableOp_float_TN,tn_2_237_128_ld_128_128_2,Gemm_Hipblaslt_1284,0.010483
GemmAndBiasTunableOp_float_TN,tn_4_237_128_ld_128_128_4,Gemm_Hipblaslt_1286,0.0103908
GemmAndBiasTunableOp_float_TN,tn_128_152_576_ld_576_576_128,Gemm_Hipblaslt_1284,0.0252211
GemmAndBiasTunableOp_float_TN,tn_2_152_128_ld_128_128_2,Gemm_Hipblaslt_1286,0.0104513
GemmAndBiasTunableOp_float_TN,tn_4_152_128_ld_128_128_4,Gemm_Hipblaslt_1284,0.0103839
GemmAndBiasTunableOp_float_TN,tn_128_108_576_ld_576_576_128,Gemm_Hipblaslt_1284,0.0217021
GemmAndBiasTunableOp_float_TN,tn_2_108_128_ld_128_128_2,Gemm_Hipblaslt_1286,0.0103491
GemmAndBiasTunableOp_float_TN,tn_4_108_128_ld_128_128_4,Gemm_Hipblaslt_1286,0.0102525
GemmAndBiasTunableOp_float_TN,tn_128_285_576_ld_576_576_128,Gemm_Hipblaslt_1285,0.0271797
GemmAndBiasTunableOp_float_TN,tn_2_285_128_ld_128_128_2,Gemm_Hipblaslt_1284,0.0103551
GemmAndBiasTunableOp_float_TN,tn_4_285_128_ld_128_128_4,Gemm_Hipblaslt_1286,0.0102469
GemmAndBiasTunableOp_float_TN,tn_128_67_576_ld_576_576_128,Gemm_Hipblaslt_1284,0.0211206
GemmAndBiasTunableOp_float_TN,tn_2_67_128_ld_128_128_2,Gemm_Hipblaslt_1286,0.0104417
GemmAndBiasTunableOp_float_TN,tn_4_67_128_ld_128_128_4,Gemm_Hipblaslt_1286,0.0105779
GemmAndBiasTunableOp_float_TN,tn_128_242_576_ld_576_576_128,Gemm_Hipblaslt_1285,0.0298863
GemmAndBiasTunableOp_float_TN,tn_2_242_128_ld_128_128_2,Gemm_Hipblaslt_1284,0.0107042
GemmAndBiasTunableOp_float_TN,tn_4_242_128_ld_128_128_4,Gemm_Hipblaslt_1286,0.0104749
GemmAndBiasTunableOp_float_TN,tn_128_55_576_ld_576_576_128,Gemm_Hipblaslt_1286,0.0200794
GemmAndBiasTunableOp_float_TN,tn_2_55_128_ld_128_128_2,Gemm_Hipblaslt_1286,0.0104734
GemmAndBiasTunableOp_float_TN,tn_4_55_128_ld_128_128_4,Gemm_Hipblaslt_1284,0.0105074
GemmAndBiasTunableOp_float_TN,tn_128_315_576_ld_576_576_128,Gemm_Hipblaslt_1285,0.0288733
GemmAndBiasTunableOp_float_TN,tn_2_315_128_ld_128_128_2,Gemm_Hipblaslt_1284,0.011032
GemmAndBiasTunableOp_float_TN,tn_4_315_128_ld_128_128_4,Gemm_Hipblaslt_1284,0.0109967
GemmAndBiasTunableOp_float_TN,tn_128_53_576_ld_576_576_128,Gemm_Hipblaslt_1286,0.0200975
GemmAndBiasTunableOp_float_TN,tn_2_53_128_ld_128_128_2,Gemm_Hipblaslt_1284,0.0104024
GemmAndBiasTunableOp_float_TN,tn_4_53_128_ld_128_128_4,Gemm_Hipblaslt_1286,0.0104718
GemmAndBiasTunableOp_float_TN,tn_128_162_576_ld_576_576_128,Gemm_Hipblaslt_1284,0.0258043
GemmAndBiasTunableOp_float_TN,tn_2_162_128_ld_128_128_2,Gemm_Hipblaslt_1286,0.010434
GemmAndBiasTunableOp_float_TN,tn_4_162_128_ld_128_128_4,Gemm_Hipblaslt_1286,0.0102838
GemmAndBiasTunableOp_float_TN,tn_128_168_576_ld_576_576_128,Gemm_Hipblaslt_1284,0.0267812
GemmAndBiasTunableOp_float_TN,tn_2_168_128_ld_128_128_2,Gemm_Hipblaslt_1286,0.0104265
GemmAndBiasTunableOp_float_TN,tn_4_168_128_ld_128_128_4,Gemm_Hipblaslt_1286,0.0103751
GemmAndBiasTunableOp_float_TN,tn_128_103_576_ld_576_576_128,Gemm_Hipblaslt_1284,0.0214019
GemmAndBiasTunableOp_float_TN,tn_2_103_128_ld_128_128_2,Gemm_Hipblaslt_1286,0.0103636
GemmAndBiasTunableOp_float_TN,tn_4_103_128_ld_128_128_4,Gemm_Hipblaslt_1286,0.0103331
GemmAndBiasTunableOp_float_TN,tn_128_188_576_ld_576_576_128,Gemm_Hipblaslt_1285,0.0288753
GemmAndBiasTunableOp_float_TN,tn_2_188_128_ld_128_128_2,Gemm_Hipblaslt_1286,0.0104136
GemmAndBiasTunableOp_float_TN,tn_4_188_128_ld_128_128_4,Gemm_Hipblaslt_1286,0.0104028
GemmAndBiasTunableOp_float_TN,tn_128_102_576_ld_576_576_128,Gemm_Hipblaslt_1284,0.0214268
GemmAndBiasTunableOp_float_TN,tn_2_102_128_ld_128_128_2,Gemm_Hipblaslt_1286,0.0103443
GemmAndBiasTunableOp_float_TN,tn_4_102_128_ld_128_128_4,Gemm_Hipblaslt_1286,0.0104425
GemmAndBiasTunableOp_float_TN,tn_128_147_576_ld_576_576_128,Gemm_Hipblaslt_1284,0.0243948
GemmAndBiasTunableOp_float_TN,tn_2_147_128_ld_128_128_2,Gemm_Hipblaslt_1286,0.0103387
GemmAndBiasTunableOp_float_TN,tn_4_147_128_ld_128_128_4,Gemm_Hipblaslt_1286,0.0103632
GemmAndBiasTunableOp_float_TN,tn_128_75_576_ld_576_576_128,Gemm_Hipblaslt_1286,0.0217385
GemmAndBiasTunableOp_float_TN,tn_2_75_128_ld_128_128_2,Gemm_Hipblaslt_1286,0.0106075
GemmAndBiasTunableOp_float_TN,tn_4_75_128_ld_128_128_4,Gemm_Hipblaslt_1286,0.0105531
GemmAndBiasTunableOp_float_TN,tn_128_28_576_ld_576_576_128,Gemm_Hipblaslt_1286,0.0204446
GemmAndBiasTunableOp_float_TN,tn_2_28_128_ld_128_128_2,Gemm_Hipblaslt_1286,0.0106141
GemmAndBiasTunableOp_float_TN,tn_4_28_128_ld_128_128_4,Gemm_Hipblaslt_1286,0.0106044
GemmAndBiasTunableOp_float_TN,tn_128_76_576_ld_576_576_128,Gemm_Hipblaslt_1286,0.0214801
GemmAndBiasTunableOp_float_TN,tn_2_76_128_ld_128_128_2,Gemm_Hipblaslt_1286,0.0103732
GemmAndBiasTunableOp_float_TN,tn_4_76_128_ld_128_128_4,Gemm_Hipblaslt_1286,0.0103186
GemmAndBiasTunableOp_float_TN,tn_128_241_576_ld_576_576_128,Gemm_Hipblaslt_1285,0.0272742
GemmAndBiasTunableOp_float_TN,tn_2_241_128_ld_128_128_2,Gemm_Hipblaslt_1284,0.0106377
GemmAndBiasTunableOp_float_TN,tn_4_241_128_ld_128_128_4,Gemm_Hipblaslt_1286,0.0105014
GemmAndBiasTunableOp_float_TN,tn_128_251_576_ld_576_576_128,Gemm_Hipblaslt_1285,0.027786
GemmAndBiasTunableOp_float_TN,tn_2_251_128_ld_128_128_2,Gemm_Hipblaslt_1286,0.0105695
GemmAndBiasTunableOp_float_TN,tn_4_251_128_ld_128_128_4,Gemm_Hipblaslt_1286,0.0106188
GemmAndBiasTunableOp_float_TN,tn_128_488_576_ld_576_576_128,Gemm_Hipblaslt_1285,0.0388528
GemmAndBiasTunableOp_float_TN,tn_2_488_128_ld_128_128_2,Gemm_Hipblaslt_1284,0.0112584
GemmAndBiasTunableOp_float_TN,tn_4_488_128_ld_128_128_4,Gemm_Hipblaslt_1286,0.0110958
GemmAndBiasTunableOp_float_TN,tn_128_365_576_ld_576_576_128,Gemm_Hipblaslt_1285,0.0316585
GemmAndBiasTunableOp_float_TN,tn_2_365_128_ld_128_128_2,Gemm_Hipblaslt_1284,0.0105959
GemmAndBiasTunableOp_float_TN,tn_4_365_128_ld_128_128_4,Gemm_Hipblaslt_1286,0.0104565
GemmAndBiasTunableOp_float_TN,tn_128_200_576_ld_576_576_128,Gemm_Hipblaslt_1285,0.0263044
GemmAndBiasTunableOp_float_TN,tn_2_200_128_ld_128_128_2,Gemm_Hipblaslt_1286,0.0103062
GemmAndBiasTunableOp_float_TN,tn_4_200_128_ld_128_128_4,Gemm_Hipblaslt_1286,0.0103287
GemmAndBiasTunableOp_float_TN,tn_128_142_576_ld_576_576_128,Gemm_Hipblaslt_1284,0.0240898
GemmAndBiasTunableOp_float_TN,tn_2_142_128_ld_128_128_2,Gemm_Hipblaslt_1286,0.0103936
GemmAndBiasTunableOp_float_TN,tn_4_142_128_ld_128_128_4,Gemm_Hipblaslt_1286,0.0104252
GemmAndBiasTunableOp_float_TN,tn_128_114_576_ld_576_576_128,Gemm_Hipblaslt_1284,0.0219515
GemmAndBiasTunableOp_float_TN,tn_2_114_128_ld_128_128_2,Gemm_Hipblaslt_1284,0.010396
GemmAndBiasTunableOp_float_TN,tn_4_114_128_ld_128_128_4,Gemm_Hipblaslt_1286,0.0102573
GemmAndBiasTunableOp_float_TN,tn_128_120_576_ld_576_576_128,Gemm_Hipblaslt_1286,0.0227292
GemmAndBiasTunableOp_float_TN,tn_2_120_128_ld_128_128_2,Gemm_Hipblaslt_1284,0.0102894
GemmAndBiasTunableOp_float_TN,tn_4_120_128_ld_128_128_4,Gemm_Hipblaslt_1286,0.0103442
GemmAndBiasTunableOp_float_TN,tn_128_171_576_ld_576_576_128,Gemm_Hipblaslt_1285,0.0243123
GemmAndBiasTunableOp_float_TN,tn_2_171_128_ld_128_128_2,Gemm_Hipblaslt_1286,0.0102726
GemmAndBiasTunableOp_float_TN,tn_4_171_128_ld_128_128_4,Gemm_Hipblaslt_1284,0.010481
GemmAndBiasTunableOp_float_TN,tn_128_322_576_ld_576_576_128,Gemm_Hipblaslt_1285,0.0295309
GemmAndBiasTunableOp_float_TN,tn_2_322_128_ld_128_128_2,Gemm_Hipblaslt_1284,0.0103519
GemmAndBiasTunableOp_float_TN,tn_4_322_128_ld_128_128_4,Gemm_Hipblaslt_1286,0.010398
GemmAndBiasTunableOp_float_TN,tn_128_84_576_ld_576_576_128,Gemm_Hipblaslt_1286,0.021149
GemmAndBiasTunableOp_float_TN,tn_2_84_128_ld_128_128_2,Gemm_Hipblaslt_1286,0.0104449
GemmAndBiasTunableOp_float_TN,tn_4_84_128_ld_128_128_4,Gemm_Hipblaslt_1286,0.0102983
GemmAndBiasTunableOp_float_TN,tn_128_97_576_ld_576_576_128,Gemm_Hipblaslt_1284,0.0214665
GemmAndBiasTunableOp_float_TN,tn_2_97_128_ld_128_128_2,Gemm_Hipblaslt_1286,0.0103451
GemmAndBiasTunableOp_float_TN,tn_4_97_128_ld_128_128_4,Gemm_Hipblaslt_1286,0.0103182
GemmAndBiasTunableOp_float_TN,tn_128_368_576_ld_576_576_128,Gemm_Hipblaslt_1285,0.0313631
GemmAndBiasTunableOp_float_TN,tn_2_368_128_ld_128_128_2,Gemm_Hipblaslt_1284,0.0107371
GemmAndBiasTunableOp_float_TN,tn_4_368_128_ld_128_128_4,Gemm_Hipblaslt_1284,0.0106481
GemmAndBiasTunableOp_float_TN,tn_128_291_576_ld_576_576_128,Gemm_Hipblaslt_1285,0.0273972
GemmAndBiasTunableOp_float_TN,tn_2_291_128_ld_128_128_2,Gemm_Hipblaslt_1286,0.0102773
GemmAndBiasTunableOp_float_TN,tn_4_291_128_ld_128_128_4,Gemm_Hipblaslt_1286,0.0102742
GemmAndBiasTunableOp_float_TN,tn_128_30_576_ld_576_576_128,Gemm_Hipblaslt_1286,0.0201331
GemmAndBiasTunableOp_float_TN,tn_2_30_128_ld_128_128_2,Gemm_Hipblaslt_1286,0.0106079
GemmAndBiasTunableOp_float_TN,tn_4_30_128_ld_128_128_4,Gemm_Hipblaslt_1284,0.0106802
GemmAndBiasTunableOp_float_TN,tn_128_125_576_ld_576_576_128,Gemm_Hipblaslt_1284,0.0220279
GemmAndBiasTunableOp_float_TN,tn_2_125_128_ld_128_128_2,Gemm_Hipblaslt_1286,0.0102148
GemmAndBiasTunableOp_float_TN,tn_4_125_128_ld_128_128_4,Gemm_Hipblaslt_1286,0.0105375
GemmAndBiasTunableOp_float_TN,tn_128_274_576_ld_576_576_128,Gemm_Hipblaslt_1285,0.0278726
GemmAndBiasTunableOp_float_TN,tn_2_274_128_ld_128_128_2,Gemm_Hipblaslt_1284,0.0104285
GemmAndBiasTunableOp_float_TN,tn_4_274_128_ld_128_128_4,Gemm_Hipblaslt_1286,0.0105138
GemmAndBiasTunableOp_float_TN,tn_128_172_576_ld_576_576_128,Gemm_Hipblaslt_1284,0.0252079
GemmAndBiasTunableOp_float_TN,tn_2_172_128_ld_128_128_2,Gemm_Hipblaslt_1286,0.0101792
GemmAndBiasTunableOp_float_TN,tn_4_172_128_ld_128_128_4,Gemm_Hipblaslt_1286,0.0102625
GemmAndBiasTunableOp_float_TN,tn_128_257_576_ld_576_576_128,Gemm_Hipblaslt_1285,0.025565
GemmAndBiasTunableOp_float_TN,tn_2_257_128_ld_128_128_2,Gemm_Hipblaslt_1286,0.0101763
GemmAndBiasTunableOp_float_TN,tn_4_257_128_ld_128_128_4,Gemm_Hipblaslt_1284,0.00996401
GemmAndBiasTunableOp_float_TN,tn_128_318_576_ld_576_576_128,Gemm_Hipblaslt_1285,0.0305071
GemmAndBiasTunableOp_float_TN,tn_2_318_128_ld_128_128_2,Gemm_Hipblaslt_1284,0.0110275
GemmAndBiasTunableOp_float_TN,tn_4_318_128_ld_128_128_4,Gemm_Hipblaslt_1284,0.0111097
GemmAndBiasTunableOp_float_TN,tn_128_150_576_ld_576_576_128,Gemm_Hipblaslt_1284,0.0236834
GemmAndBiasTunableOp_float_TN,tn_2_150_128_ld_128_128_2,Gemm_Hipblaslt_1286,0.0104469
GemmAndBiasTunableOp_float_TN,tn_4_150_128_ld_128_128_4,Gemm_Hipblaslt_1284,0.0104212
GemmAndBiasTunableOp_float_TN,tn_128_179_576_ld_576_576_128,Gemm_Hipblaslt_1285,0.0246741
GemmAndBiasTunableOp_float_TN,tn_2_179_128_ld_128_128_2,Gemm_Hipblaslt_1286,0.0103266
GemmAndBiasTunableOp_float_TN,tn_4_179_128_ld_128_128_4,Gemm_Hipblaslt_1286,0.0102927
GemmAndBiasTunableOp_float_TN,tn_128_113_576_ld_576_576_128,Gemm_Hipblaslt_1284,0.0213262
GemmAndBiasTunableOp_float_TN,tn_2_113_128_ld_128_128_2,Gemm_Hipblaslt_1286,0.0104545
GemmAndBiasTunableOp_float_TN,tn_4_113_128_ld_128_128_4,Gemm_Hipblaslt_1286,0.0102982
GemmAndBiasTunableOp_float_TN,tn_128_12_576_ld_576_576_128,Gemm_Hipblaslt_1286,0.0200406
GemmAndBiasTunableOp_float_TN,tn_2_12_128_ld_128_128_2,Gemm_Hipblaslt_1286,0.010658
GemmAndBiasTunableOp_float_TN,tn_4_12_128_ld_128_128_4,Gemm_Hipblaslt_1286,0.0106557
GemmAndBiasTunableOp_float_TN,tn_128_348_576_ld_576_576_128,Gemm_Hipblaslt_1285,0.0299441
GemmAndBiasTunableOp_float_TN,tn_2_348_128_ld_128_128_2,Gemm_Hipblaslt_1286,0.0103134
GemmAndBiasTunableOp_float_TN,tn_4_348_128_ld_128_128_4,Gemm_Hipblaslt_1284,0.010301
GemmAndBiasTunableOp_float_TN,tn_128_173_576_ld_576_576_128,Gemm_Hipblaslt_1285,0.0248356
GemmAndBiasTunableOp_float_TN,tn_2_173_128_ld_128_128_2,Gemm_Hipblaslt_1284,0.0102798
GemmAndBiasTunableOp_float_TN,tn_4_173_128_ld_128_128_4,Gemm_Hipblaslt_1286,0.0104244
GemmAndBiasTunableOp_float_TN,tn_128_132_576_ld_576_576_128,Gemm_Hipblaslt_1284,0.0219462
GemmAndBiasTunableOp_float_TN,tn_2_132_128_ld_128_128_2,Gemm_Hipblaslt_1286,0.0103127
GemmAndBiasTunableOp_float_TN,tn_4_132_128_ld_128_128_4,Gemm_Hipblaslt_1286,0.0102249
GemmAndBiasTunableOp_float_TN,tn_128_222_576_ld_576_576_128,Gemm_Hipblaslt_1285,0.0247802
GemmAndBiasTunableOp_float_TN,tn_2_222_128_ld_128_128_2,Gemm_Hipblaslt_1286,0.010374
GemmAndBiasTunableOp_float_TN,tn_4_222_128_ld_128_128_4,Gemm_Hipblaslt_1284,0.0103631
GemmAndBiasTunableOp_float_TN,tn_128_263_576_ld_576_576_128,Gemm_Hipblaslt_1285,0.0267495
GemmAndBiasTunableOp_float_TN,tn_2_263_128_ld_128_128_2,Gemm_Hipblaslt_1286,0.0104056
GemmAndBiasTunableOp_float_TN,tn_4_263_128_ld_128_128_4,Gemm_Hipblaslt_1286,0.0103142
GemmAndBiasTunableOp_float_TN,tn_256_18_1152_ld_1152_1152_256,Gemm_Hipblaslt_1286,0.0329577
GemmAndBiasTunableOp_float_TN,tn_2_18_256_ld_256_256_2,Gemm_Hipblaslt_1286,0.0131267
GemmAndBiasTunableOp_float_TN,tn_4_18_256_ld_256_256_4,Gemm_Hipblaslt_1286,0.0131952
GemmAndBiasTunableOp_float_TN,tn_10_18_256_ld_256_256_10,Gemm_Hipblaslt_1284,0.0131075
GemmAndBiasTunableOp_float_TN,tn_128_196_576_ld_576_576_128,Gemm_Hipblaslt_1285,0.0255425
GemmAndBiasTunableOp_float_TN,tn_2_196_128_ld_128_128_2,Gemm_Hipblaslt_1286,0.0104509
GemmAndBiasTunableOp_float_TN,tn_4_196_128_ld_128_128_4,Gemm_Hipblaslt_1286,0.010315
GemmAndBiasTunableOp_float_TN,tn_128_153_576_ld_576_576_128,Gemm_Hipblaslt_1284,0.0230795
GemmAndBiasTunableOp_float_TN,tn_2_153_128_ld_128_128_2,Gemm_Hipblaslt_1286,0.0104729
GemmAndBiasTunableOp_float_TN,tn_4_153_128_ld_128_128_4,Gemm_Hipblaslt_1286,0.0104092
GemmAndBiasTunableOp_float_TN,tn_128_349_576_ld_576_576_128,Gemm_Hipblaslt_1285,0.0299269
GemmAndBiasTunableOp_float_TN,tn_2_349_128_ld_128_128_2,Gemm_Hipblaslt_1284,0.0103432
GemmAndBiasTunableOp_float_TN,tn_4_349_128_ld_128_128_4,Gemm_Hipblaslt_1286,0.0103523
GemmAndBiasTunableOp_float_TN,tn_1024_917_12544_ld_12544_12544_1024,Gemm_Hipblaslt_1287,19.3295
GemmAndBiasTunableOp_float_TN,tn_1024_917_1024_ld_1024_1024_1024,Gemm_Hipblaslt_1285,0.885666
GemmAndBiasTunableOp_float_TN,tn_91_917_1024_ld_1024_1024_91,Gemm_Hipblaslt_1285,0.0885573
GemmAndBiasTunableOp_float_TN,tn_364_917_1024_ld_1024_1024_364,Gemm_Hipblaslt_1285,0.296922
GemmAndBiasTunableOp_float_TN,tn_128_278_576_ld_576_576_128,Gemm_Hipblaslt_1285,0.0270509
GemmAndBiasTunableOp_float_TN,tn_2_278_128_ld_128_128_2,Gemm_Hipblaslt_1284,0.0104292
GemmAndBiasTunableOp_float_TN,tn_4_278_128_ld_128_128_4,Gemm_Hipblaslt_1286,0.0103255
GemmAndBiasTunableOp_float_TN,tn_128_185_576_ld_576_576_128,Gemm_Hipblaslt_1285,0.0266987
GemmAndBiasTunableOp_float_TN,tn_2_185_128_ld_128_128_2,Gemm_Hipblaslt_1286,0.0102805
GemmAndBiasTunableOp_float_TN,tn_4_185_128_ld_128_128_4,Gemm_Hipblaslt_1286,0.0103903
GemmAndBiasTunableOp_float_TN,tn_128_460_576_ld_576_576_128,Gemm_Hipblaslt_1285,0.0403721
GemmAndBiasTunableOp_float_TN,tn_2_460_128_ld_128_128_2,Gemm_Hipblaslt_1286,0.0116904
GemmAndBiasTunableOp_float_TN,tn_4_460_128_ld_128_128_4,Gemm_Hipblaslt_1284,0.0118744
GemmAndBiasTunableOp_float_TN,tn_256_34_1152_ld_1152_1152_256,Gemm_Hipblaslt_1284,0.0340778
GemmAndBiasTunableOp_float_TN,tn_2_34_256_ld_256_256_2,Gemm_Hipblaslt_1286,0.0132269
GemmAndBiasTunableOp_float_TN,tn_4_34_256_ld_256_256_4,Gemm_Hipblaslt_1286,0.0132818
GemmAndBiasTunableOp_float_TN,tn_10_34_256_ld_256_256_10,Gemm_Hipblaslt_1286,0.0128859
GemmAndBiasTunableOp_float_TN,tn_128_240_576_ld_576_576_128,Gemm_Hipblaslt_1285,0.0267981
GemmAndBiasTunableOp_float_TN,tn_2_240_128_ld_128_128_2,Gemm_Hipblaslt_1284,0.0106052
GemmAndBiasTunableOp_float_TN,tn_4_240_128_ld_128_128_4,Gemm_Hipblaslt_1286,0.0103603
GemmAndBiasTunableOp_float_TN,tn_256_33_1152_ld_1152_1152_256,Gemm_Hipblaslt_1284,0.0341099
GemmAndBiasTunableOp_float_TN,tn_2_33_256_ld_256_256_2,Gemm_Hipblaslt_1286,0.0132001
GemmAndBiasTunableOp_float_TN,tn_4_33_256_ld_256_256_4,Gemm_Hipblaslt_1286,0.0133011
GemmAndBiasTunableOp_float_TN,tn_10_33_256_ld_256_256_10,Gemm_Hipblaslt_1286,0.0129147
GemmAndBiasTunableOp_float_TN,tn_256_81_1152_ld_1152_1152_256,Gemm_Hipblaslt_1285,0.0413739
GemmAndBiasTunableOp_float_TN,tn_2_81_256_ld_256_256_2,Gemm_Hipblaslt_1286,0.0130169
GemmAndBiasTunableOp_float_TN,tn_4_81_256_ld_256_256_4,Gemm_Hipblaslt_1286,0.0129316
GemmAndBiasTunableOp_float_TN,tn_10_81_256_ld_256_256_10,Gemm_Hipblaslt_1286,0.0128021
GemmAndBiasTunableOp_float_TN,tn_256_25_1152_ld_1152_1152_256,Gemm_Hipblaslt_1284,0.0335612
GemmAndBiasTunableOp_float_TN,tn_2_25_256_ld_256_256_2,Gemm_Hipblaslt_1284,0.0132674
GemmAndBiasTunableOp_float_TN,tn_4_25_256_ld_256_256_4,Gemm_Hipblaslt_1286,0.0132561
GemmAndBiasTunableOp_float_TN,tn_10_25_256_ld_256_256_10,Gemm_Hipblaslt_1286,0.0128394
GemmAndBiasTunableOp_float_TN,tn_256_50_1152_ld_1152_1152_256,Gemm_Hipblaslt_1284,0.0356119
GemmAndBiasTunableOp_float_TN,tn_2_50_256_ld_256_256_2,Gemm_Hipblaslt_1286,0.0131937
GemmAndBiasTunableOp_float_TN,tn_4_50_256_ld_256_256_4,Gemm_Hipblaslt_1286,0.0132493
GemmAndBiasTunableOp_float_TN,tn_10_50_256_ld_256_256_10,Gemm_Hipblaslt_1286,0.0129096
GemmAndBiasTunableOp_float_TN,tn_128_247_576_ld_576_576_128,Gemm_Hipblaslt_1285,0.0276873
GemmAndBiasTunableOp_float_TN,tn_2_247_128_ld_128_128_2,Gemm_Hipblaslt_1284,0.0104184
GemmAndBiasTunableOp_float_TN,tn_4_247_128_ld_128_128_4,Gemm_Hipblaslt_1286,0.0104124
GemmAndBiasTunableOp_float_TN,tn_256_27_1152_ld_1152_1152_256,Gemm_Hipblaslt_1284,0.0335292
GemmAndBiasTunableOp_float_TN,tn_2_27_256_ld_256_256_2,Gemm_Hipblaslt_1286,0.013269
GemmAndBiasTunableOp_float_TN,tn_4_27_256_ld_256_256_4,Gemm_Hipblaslt_1286,0.013148
GemmAndBiasTunableOp_float_TN,tn_10_27_256_ld_256_256_10,Gemm_Hipblaslt_1286,0.0128582
GemmAndBiasTunableOp_float_TN,tn_128_187_576_ld_576_576_128,Gemm_Hipblaslt_1285,0.0288508
GemmAndBiasTunableOp_float_TN,tn_2_187_128_ld_128_128_2,Gemm_Hipblaslt_1286,0.0103226
GemmAndBiasTunableOp_float_TN,tn_4_187_128_ld_128_128_4,Gemm_Hipblaslt_1286,0.0103162
GemmAndBiasTunableOp_float_TN,tn_128_189_576_ld_576_576_128,Gemm_Hipblaslt_1285,0.0249786
GemmAndBiasTunableOp_float_TN,tn_2_189_128_ld_128_128_2,Gemm_Hipblaslt_1286,0.0102906
GemmAndBiasTunableOp_float_TN,tn_4_189_128_ld_128_128_4,Gemm_Hipblaslt_1286,0.0104036
GemmAndBiasTunableOp_float_TN,tn_128_346_576_ld_576_576_128,Gemm_Hipblaslt_1285,0.0298478
GemmAndBiasTunableOp_float_TN,tn_2_346_128_ld_128_128_2,Gemm_Hipblaslt_1284,0.010329
GemmAndBiasTunableOp_float_TN,tn_4_346_128_ld_128_128_4,Gemm_Hipblaslt_1286,0.0102605
GemmAndBiasTunableOp_float_TN,tn_256_14_1152_ld_1152_1152_256,Gemm_Hipblaslt_1286,0.0323998
GemmAndBiasTunableOp_float_TN,tn_2_14_256_ld_256_256_2,Gemm_Hipblaslt_1286,0.0134711
GemmAndBiasTunableOp_float_TN,tn_4_14_256_ld_256_256_4,Gemm_Hipblaslt_1286,0.0132265
GemmAndBiasTunableOp_float_TN,tn_10_14_256_ld_256_256_10,Gemm_Hipblaslt_1286,0.0128779
GemmAndBiasTunableOp_float_TN,tn_128_198_576_ld_576_576_128,Gemm_Hipblaslt_1285,0.0265713
GemmAndBiasTunableOp_float_TN,tn_2_198_128_ld_128_128_2,Gemm_Hipblaslt_1286,0.0103972
GemmAndBiasTunableOp_float_TN,tn_4_198_128_ld_128_128_4,Gemm_Hipblaslt_1286,0.00985175
GemmAndBiasTunableOp_float_TN,tn_128_410_576_ld_576_576_128,Gemm_Hipblaslt_1285,0.033926
GemmAndBiasTunableOp_float_TN,tn_2_410_128_ld_128_128_2,Gemm_Hipblaslt_1284,0.0115402
GemmAndBiasTunableOp_float_TN,tn_4_410_128_ld_128_128_4,Gemm_Hipblaslt_1284,0.0115565
GemmAndBiasTunableOp_float_TN,tn_256_35_1152_ld_1152_1152_256,Gemm_Hipblaslt_1284,0.0339952
GemmAndBiasTunableOp_float_TN,tn_2_35_256_ld_256_256_2,Gemm_Hipblaslt_1286,0.0132157
GemmAndBiasTunableOp_float_TN,tn_4_35_256_ld_256_256_4,Gemm_Hipblaslt_1286,0.0133264
GemmAndBiasTunableOp_float_TN,tn_10_35_256_ld_256_256_10,Gemm_Hipblaslt_1286,0.0129372
GemmAndBiasTunableOp_float_TN,tn_128_418_576_ld_576_576_128,Gemm_Hipblaslt_1285,0.0348805
GemmAndBiasTunableOp_float_TN,tn_2_418_128_ld_128_128_2,Gemm_Hipblaslt_1284,0.0111983
GemmAndBiasTunableOp_float_TN,tn_4_418_128_ld_128_128_4,Gemm_Hipblaslt_1284,0.0107855
GemmAndBiasTunableOp_float_TN,tn_128_467_576_ld_576_576_128,Gemm_Hipblaslt_1285,0.0403443
GemmAndBiasTunableOp_float_TN,tn_2_467_128_ld_128_128_2,Gemm_Hipblaslt_1286,0.0116916
GemmAndBiasTunableOp_float_TN,tn_4_467_128_ld_128_128_4,Gemm_Hipblaslt_1284,0.0115393
GemmAndBiasTunableOp_float_TN,tn_128_238_576_ld_576_576_128,Gemm_Hipblaslt_1285,0.0262318
GemmAndBiasTunableOp_float_TN,tn_2_238_128_ld_128_128_2,Gemm_Hipblaslt_1284,0.0100417
GemmAndBiasTunableOp_float_TN,tn_4_238_128_ld_128_128_4,Gemm_Hipblaslt_1286,0.0104228
GemmAndBiasTunableOp_float_TN,tn_128_491_576_ld_576_576_128,Gemm_Hipblaslt_1285,0.0389986
GemmAndBiasTunableOp_float_TN,tn_2_491_128_ld_128_128_2,Gemm_Hipblaslt_1284,0.0111373
GemmAndBiasTunableOp_float_TN,tn_4_491_128_ld_128_128_4,Gemm_Hipblaslt_1284,0.0110825
GemmAndBiasTunableOp_float_TN,tn_128_122_576_ld_576_576_128,Gemm_Hipblaslt_1286,0.0238738
GemmAndBiasTunableOp_float_TN,tn_2_122_128_ld_128_128_2,Gemm_Hipblaslt_1284,0.010406
GemmAndBiasTunableOp_float_TN,tn_4_122_128_ld_128_128_4,Gemm_Hipblaslt_1286,0.010321
GemmAndBiasTunableOp_float_TN,tn_128_202_576_ld_576_576_128,Gemm_Hipblaslt_1285,0.0245278
GemmAndBiasTunableOp_float_TN,tn_2_202_128_ld_128_128_2,Gemm_Hipblaslt_1284,0.0104036
GemmAndBiasTunableOp_float_TN,tn_4_202_128_ld_128_128_4,Gemm_Hipblaslt_1286,0.0102569
GemmAndBiasTunableOp_float_TN,tn_128_99_576_ld_576_576_128,Gemm_Hipblaslt_1286,0.0238926
GemmAndBiasTunableOp_float_TN,tn_2_99_128_ld_128_128_2,Gemm_Hipblaslt_1286,0.0104248
GemmAndBiasTunableOp_float_TN,tn_4_99_128_ld_128_128_4,Gemm_Hipblaslt_1286,0.0104304
GemmAndBiasTunableOp_float_TN,tn_256_113_1152_ld_1152_1152_256,Gemm_Hipblaslt_1285,0.0450765
GemmAndBiasTunableOp_float_TN,tn_2_113_256_ld_256_256_2,Gemm_Hipblaslt_1286,0.0130218
GemmAndBiasTunableOp_float_TN,tn_4_113_256_ld_256_256_4,Gemm_Hipblaslt_1286,0.0129131
GemmAndBiasTunableOp_float_TN,tn_10_113_256_ld_256_256_10,Gemm_Hipblaslt_1286,0.0128109
GemmAndBiasTunableOp_float_TN,tn_256_22_1152_ld_1152_1152_256,Gemm_Hipblaslt_1286,0.0324151
GemmAndBiasTunableOp_float_TN,tn_2_22_256_ld_256_256_2,Gemm_Hipblaslt_1286,0.0128502
GemmAndBiasTunableOp_float_TN,tn_4_22_256_ld_256_256_4,Gemm_Hipblaslt_1286,0.012883
GemmAndBiasTunableOp_float_TN,tn_10_22_256_ld_256_256_10,Gemm_Hipblaslt_1286,0.0124422
GemmAndBiasTunableOp_float_TN,tn_128_207_576_ld_576_576_128,Gemm_Hipblaslt_1285,0.024358
GemmAndBiasTunableOp_float_TN,tn_2_207_128_ld_128_128_2,Gemm_Hipblaslt_1284,0.0103564
GemmAndBiasTunableOp_float_TN,tn_4_207_128_ld_128_128_4,Gemm_Hipblaslt_1286,0.0101712
GemmAndBiasTunableOp_float_TN,tn_128_94_576_ld_576_576_128,Gemm_Hipblaslt_1284,0.0205938
GemmAndBiasTunableOp_float_TN,tn_2_94_128_ld_128_128_2,Gemm_Hipblaslt_1284,0.0103014
GemmAndBiasTunableOp_float_TN,tn_4_94_128_ld_128_128_4,Gemm_Hipblaslt_1284,0.0102129
GemmAndBiasTunableOp_float_TN,tn_128_82_576_ld_576_576_128,Gemm_Hipblaslt_1286,0.0210354
GemmAndBiasTunableOp_float_TN,tn_2_82_128_ld_128_128_2,Gemm_Hipblaslt_1286,0.0101632
GemmAndBiasTunableOp_float_TN,tn_4_82_128_ld_128_128_4,Gemm_Hipblaslt_1284,0.010326
GemmAndBiasTunableOp_float_TN,tn_256_30_1152_ld_1152_1152_256,Gemm_Hipblaslt_1284,0.0335082
GemmAndBiasTunableOp_float_TN,tn_2_30_256_ld_256_256_2,Gemm_Hipblaslt_1286,0.0131329
GemmAndBiasTunableOp_float_TN,tn_4_30_256_ld_256_256_4,Gemm_Hipblaslt_1286,0.0130698
GemmAndBiasTunableOp_float_TN,tn_10_30_256_ld_256_256_10,Gemm_Hipblaslt_1286,0.0126612
GemmAndBiasTunableOp_float_TN,tn_128_107_576_ld_576_576_128,Gemm_Hipblaslt_1284,0.02458
GemmAndBiasTunableOp_float_TN,tn_2_107_128_ld_128_128_2,Gemm_Hipblaslt_1286,0.0104702
GemmAndBiasTunableOp_float_TN,tn_4_107_128_ld_128_128_4,Gemm_Hipblaslt_1286,0.0103788
GemmAndBiasTunableOp_float_TN,tn_128_469_576_ld_576_576_128,Gemm_Hipblaslt_1285,0.0358818
GemmAndBiasTunableOp_float_TN,tn_2_469_128_ld_128_128_2,Gemm_Hipblaslt_1284,0.0117379
GemmAndBiasTunableOp_float_TN,tn_4_469_128_ld_128_128_4,Gemm_Hipblaslt_1286,0.0117013
GemmAndBiasTunableOp_float_TN,tn_128_476_576_ld_576_576_128,Gemm_Hipblaslt_1285,0.0357732
GemmAndBiasTunableOp_float_TN,tn_2_476_128_ld_128_128_2,Gemm_Hipblaslt_1284,0.0116805
GemmAndBiasTunableOp_float_TN,tn_4_476_128_ld_128_128_4,Gemm_Hipblaslt_1284,0.011565
GemmAndBiasTunableOp_float_TN,tn_128_115_576_ld_576_576_128,Gemm_Hipblaslt_1284,0.0219414
GemmAndBiasTunableOp_float_TN,tn_2_115_128_ld_128_128_2,Gemm_Hipblaslt_1286,0.0102915
GemmAndBiasTunableOp_float_TN,tn_4_115_128_ld_128_128_4,Gemm_Hipblaslt_1284,0.010346
GemmAndBiasTunableOp_float_TN,tn_128_62_576_ld_576_576_128,Gemm_Hipblaslt_1286,0.0209792
GemmAndBiasTunableOp_float_TN,tn_2_62_128_ld_128_128_2,Gemm_Hipblaslt_1286,0.0103524
GemmAndBiasTunableOp_float_TN,tn_4_62_128_ld_128_128_4,Gemm_Hipblaslt_1286,0.0101404
GemmAndBiasTunableOp_float_TN,tn_128_256_576_ld_576_576_128,Gemm_Hipblaslt_1285,0.0290766
GemmAndBiasTunableOp_float_TN,tn_2_256_128_ld_128_128_2,Gemm_Hipblaslt_1284,0.0105727
GemmAndBiasTunableOp_float_TN,tn_4_256_128_ld_128_128_4,Gemm_Hipblaslt_1284,0.0105347
GemmAndBiasTunableOp_float_TN,tn_128_192_576_ld_576_576_128,Gemm_Hipblaslt_1285,0.0287579
GemmAndBiasTunableOp_float_TN,tn_2_192_128_ld_128_128_2,Gemm_Hipblaslt_1286,0.0105375
GemmAndBiasTunableOp_float_TN,tn_4_192_128_ld_128_128_4,Gemm_Hipblaslt_1284,0.0105607
GemmAndBiasTunableOp_float_TN,tn_128_183_576_ld_576_576_128,Gemm_Hipblaslt_1285,0.0269004
GemmAndBiasTunableOp_float_TN,tn_2_183_128_ld_128_128_2,Gemm_Hipblaslt_1286,0.0104273
GemmAndBiasTunableOp_float_TN,tn_4_183_128_ld_128_128_4,Gemm_Hipblaslt_1286,0.0103338
GemmAndBiasTunableOp_float_TN,tn_128_430_576_ld_576_576_128,Gemm_Hipblaslt_1285,0.0340327
GemmAndBiasTunableOp_float_TN,tn_2_430_128_ld_128_128_2,Gemm_Hipblaslt_1284,0.0110248
GemmAndBiasTunableOp_float_TN,tn_4_430_128_ld_128_128_4,Gemm_Hipblaslt_1286,0.0108441
GemmAndBiasTunableOp_float_TN,tn_128_225_576_ld_576_576_128,Gemm_Hipblaslt_1285,0.02907
GemmAndBiasTunableOp_float_TN,tn_2_225_128_ld_128_128_2,Gemm_Hipblaslt_1286,0.0104161
GemmAndBiasTunableOp_float_TN,tn_4_225_128_ld_128_128_4,Gemm_Hipblaslt_1286,0.0104229
GemmAndBiasTunableOp_float_TN,tn_128_226_576_ld_576_576_128,Gemm_Hipblaslt_1285,0.0264988
GemmAndBiasTunableOp_float_TN,tn_2_226_128_ld_128_128_2,Gemm_Hipblaslt_1284,0.0103728
GemmAndBiasTunableOp_float_TN,tn_4_226_128_ld_128_128_4,Gemm_Hipblaslt_1284,0.010372
GemmAndBiasTunableOp_float_TN,tn_128_272_576_ld_576_576_128,Gemm_Hipblaslt_1285,0.0283443
GemmAndBiasTunableOp_float_TN,tn_2_272_128_ld_128_128_2,Gemm_Hipblaslt_1284,0.0105935
GemmAndBiasTunableOp_float_TN,tn_4_272_128_ld_128_128_4,Gemm_Hipblaslt_1284,0.0105667
GemmAndBiasTunableOp_float_TN,tn_256_55_1152_ld_1152_1152_256,Gemm_Hipblaslt_1284,0.0355511
GemmAndBiasTunableOp_float_TN,tn_2_55_256_ld_256_256_2,Gemm_Hipblaslt_1284,0.013116
GemmAndBiasTunableOp_float_TN,tn_4_55_256_ld_256_256_4,Gemm_Hipblaslt_1286,0.0130318
GemmAndBiasTunableOp_float_TN,tn_10_55_256_ld_256_256_10,Gemm_Hipblaslt_1286,0.0125917
GemmAndBiasTunableOp_float_TN,tn_128_367_576_ld_576_576_128,Gemm_Hipblaslt_1285,0.0365394
GemmAndBiasTunableOp_float_TN,tn_2_367_128_ld_128_128_2,Gemm_Hipblaslt_1284,0.0110309
GemmAndBiasTunableOp_float_TN,tn_4_367_128_ld_128_128_4,Gemm_Hipblaslt_1284,0.0108088
GemmAndBiasTunableOp_float_TN,tn_128_167_576_ld_576_576_128,Gemm_Hipblaslt_1285,0.023835
GemmAndBiasTunableOp_float_TN,tn_2_167_128_ld_128_128_2,Gemm_Hipblaslt_1284,0.0102718
GemmAndBiasTunableOp_float_TN,tn_4_167_128_ld_128_128_4,Gemm_Hipblaslt_1284,0.0101836
GemmAndBiasTunableOp_float_TN,tn_128_234_576_ld_576_576_128,Gemm_Hipblaslt_1285,0.0299369
GemmAndBiasTunableOp_float_TN,tn_2_234_128_ld_128_128_2,Gemm_Hipblaslt_1286,0.0105767
GemmAndBiasTunableOp_float_TN,tn_4_234_128_ld_128_128_4,Gemm_Hipblaslt_1286,0.0104113
GemmAndBiasTunableOp_float_TN,tn_128_217_576_ld_576_576_128,Gemm_Hipblaslt_1285,0.0252932
GemmAndBiasTunableOp_float_TN,tn_2_217_128_ld_128_128_2,Gemm_Hipblaslt_1286,0.0101674
GemmAndBiasTunableOp_float_TN,tn_4_217_128_ld_128_128_4,Gemm_Hipblaslt_1286,0.0102776
GemmAndBiasTunableOp_float_TN,tn_128_311_576_ld_576_576_128,Gemm_Hipblaslt_1285,0.0348399
GemmAndBiasTunableOp_float_TN,tn_2_311_128_ld_128_128_2,Gemm_Hipblaslt_1284,0.0105473
GemmAndBiasTunableOp_float_TN,tn_4_311_128_ld_128_128_4,Gemm_Hipblaslt_1284,0.0104772
GemmAndBiasTunableOp_float_TN,tn_128_158_576_ld_576_576_128,Gemm_Hipblaslt_1284,0.0241783
GemmAndBiasTunableOp_float_TN,tn_2_158_128_ld_128_128_2,Gemm_Hipblaslt_1286,0.010288
GemmAndBiasTunableOp_float_TN,tn_4_158_128_ld_128_128_4,Gemm_Hipblaslt_1286,0.0103365
GemmAndBiasTunableOp_float_TN,tn_128_401_576_ld_576_576_128,Gemm_Hipblaslt_1285,0.0391595
GemmAndBiasTunableOp_float_TN,tn_2_401_128_ld_128_128_2,Gemm_Hipblaslt_1284,0.0108446
GemmAndBiasTunableOp_float_TN,tn_4_401_128_ld_128_128_4,Gemm_Hipblaslt_1286,0.0106828
GemmAndBiasTunableOp_float_TN,tn_128_111_576_ld_576_576_128,Gemm_Hipblaslt_1284,0.0231316
GemmAndBiasTunableOp_float_TN,tn_2_111_128_ld_128_128_2,Gemm_Hipblaslt_1286,0.0103
GemmAndBiasTunableOp_float_TN,tn_4_111_128_ld_128_128_4,Gemm_Hipblaslt_1286,0.0103674
GemmAndBiasTunableOp_float_TN,tn_128_157_576_ld_576_576_128,Gemm_Hipblaslt_1284,0.0262623
GemmAndBiasTunableOp_float_TN,tn_2_157_128_ld_128_128_2,Gemm_Hipblaslt_1286,0.0103501
GemmAndBiasTunableOp_float_TN,tn_4_157_128_ld_128_128_4,Gemm_Hipblaslt_1287,0.0121022
GemmAndBiasTunableOp_float_TN,tn_128_229_576_ld_576_576_128,Gemm_Hipblaslt_1285,0.0255802
GemmAndBiasTunableOp_float_TN,tn_2_229_128_ld_128_128_2,Gemm_Hipblaslt_1286,0.0103662
GemmAndBiasTunableOp_float_TN,tn_4_229_128_ld_128_128_4,Gemm_Hipblaslt_1286,0.0102844
GemmAndBiasTunableOp_float_TN,tn_128_412_576_ld_576_576_128,Gemm_Hipblaslt_1285,0.0344933
GemmAndBiasTunableOp_float_TN,tn_2_412_128_ld_128_128_2,Gemm_Hipblaslt_1286,0.0106191
GemmAndBiasTunableOp_float_TN,tn_4_412_128_ld_128_128_4,Gemm_Hipblaslt_1286,0.0104431
GemmAndBiasTunableOp_float_TN,tn_128_288_576_ld_576_576_128,Gemm_Hipblaslt_1285,0.0270835
GemmAndBiasTunableOp_float_TN,tn_2_288_128_ld_128_128_2,Gemm_Hipblaslt_1286,0.0103406
GemmAndBiasTunableOp_float_TN,tn_4_288_128_ld_128_128_4,Gemm_Hipblaslt_1286,0.0103116
GemmAndBiasTunableOp_float_TN,tn_128_265_576_ld_576_576_128,Gemm_Hipblaslt_1285,0.03036
GemmAndBiasTunableOp_float_TN,tn_2_265_128_ld_128_128_2,Gemm_Hipblaslt_1284,0.0107389
GemmAndBiasTunableOp_float_TN,tn_4_265_128_ld_128_128_4,Gemm_Hipblaslt_1286,0.0104086
GemmAndBiasTunableOp_float_TN,tn_256_44_1152_ld_1152_1152_256,Gemm_Hipblaslt_1284,0.0348219
GemmAndBiasTunableOp_float_TN,tn_2_44_256_ld_256_256_2,Gemm_Hipblaslt_1286,0.0130869
GemmAndBiasTunableOp_float_TN,tn_4_44_256_ld_256_256_4,Gemm_Hipblaslt_1286,0.0130356
GemmAndBiasTunableOp_float_TN,tn_10_44_256_ld_256_256_10,Gemm_Hipblaslt_1286,0.0125743
GemmAndBiasTunableOp_float_TN,tn_256_45_1152_ld_1152_1152_256,Gemm_Hipblaslt_1284,0.0350508
GemmAndBiasTunableOp_float_TN,tn_2_45_256_ld_256_256_2,Gemm_Hipblaslt_1286,0.0131506
GemmAndBiasTunableOp_float_TN,tn_4_45_256_ld_256_256_4,Gemm_Hipblaslt_1286,0.0131485
GemmAndBiasTunableOp_float_TN,tn_10_45_256_ld_256_256_10,Gemm_Hipblaslt_1286,0.012561
GemmAndBiasTunableOp_float_TN,tn_128_174_576_ld_576_576_128,Gemm_Hipblaslt_1285,0.0242774
GemmAndBiasTunableOp_float_TN,tn_2_174_128_ld_128_128_2,Gemm_Hipblaslt_1286,0.0102672
GemmAndBiasTunableOp_float_TN,tn_4_174_128_ld_128_128_4,Gemm_Hipblaslt_1286,0.0102496
GemmAndBiasTunableOp_float_TN,tn_128_325_576_ld_576_576_128,Gemm_Hipblaslt_1285,0.0346248
GemmAndBiasTunableOp_float_TN,tn_2_325_128_ld_128_128_2,Gemm_Hipblaslt_1284,0.0110823
GemmAndBiasTunableOp_float_TN,tn_4_325_128_ld_128_128_4,Gemm_Hipblaslt_1286,0.0108548
GemmAndBiasTunableOp_float_TN,tn_128_383_576_ld_576_576_128,Gemm_Hipblaslt_1285,0.0339267
GemmAndBiasTunableOp_float_TN,tn_2_383_128_ld_128_128_2,Gemm_Hipblaslt_1284,0.0106259
GemmAndBiasTunableOp_float_TN,tn_4_383_128_ld_128_128_4,Gemm_Hipblaslt_1286,0.0104443
GemmAndBiasTunableOp_float_TN,tn_256_17_1152_ld_1152_1152_256,Gemm_Hipblaslt_1286,0.0332487
GemmAndBiasTunableOp_float_TN,tn_2_17_256_ld_256_256_2,Gemm_Hipblaslt_1286,0.0130664
GemmAndBiasTunableOp_float_TN,tn_4_17_256_ld_256_256_4,Gemm_Hipblaslt_1286,0.012941
GemmAndBiasTunableOp_float_TN,tn_10_17_256_ld_256_256_10,Gemm_Hipblaslt_1286,0.0127927
GemmAndBiasTunableOp_float_TN,tn_128_502_576_ld_576_576_128,Gemm_Hipblaslt_1285,0.0396636
GemmAndBiasTunableOp_float_TN,tn_2_502_128_ld_128_128_2,Gemm_Hipblaslt_1284,0.0119885
GemmAndBiasTunableOp_float_TN,tn_4_502_128_ld_128_128_4,Gemm_Hipblaslt_1286,0.0115729
GemmAndBiasTunableOp_float_TN,tn_256_42_1152_ld_1152_1152_256,Gemm_Hipblaslt_1284,0.0345507
GemmAndBiasTunableOp_float_TN,tn_2_42_256_ld_256_256_2,Gemm_Hipblaslt_1286,0.0131174
GemmAndBiasTunableOp_float_TN,tn_4_42_256_ld_256_256_4,Gemm_Hipblaslt_1286,0.0130853
GemmAndBiasTunableOp_float_TN,tn_10_42_256_ld_256_256_10,Gemm_Hipblaslt_1286,0.0127215
GemmAndBiasTunableOp_float_TN,tn_128_338_576_ld_576_576_128,Gemm_Hipblaslt_1285,0.0355964
GemmAndBiasTunableOp_float_TN,tn_2_338_128_ld_128_128_2,Gemm_Hipblaslt_1284,0.0109112
GemmAndBiasTunableOp_float_TN,tn_4_338_128_ld_128_128_4,Gemm_Hipblaslt_1286,0.010799
GemmAndBiasTunableOp_float_TN,tn_128_90_576_ld_576_576_128,Gemm_Hipblaslt_1284,0.0207758
GemmAndBiasTunableOp_float_TN,tn_2_90_128_ld_128_128_2,Gemm_Hipblaslt_1286,0.0103178
GemmAndBiasTunableOp_float_TN,tn_4_90_128_ld_128_128_4,Gemm_Hipblaslt_1286,0.010299
GemmAndBiasTunableOp_float_TN,tn_256_82_1152_ld_1152_1152_256,Gemm_Hipblaslt_1285,0.0418677
GemmAndBiasTunableOp_float_TN,tn_2_82_256_ld_256_256_2,Gemm_Hipblaslt_1286,0.0129877
GemmAndBiasTunableOp_float_TN,tn_4_82_256_ld_256_256_4,Gemm_Hipblaslt_1286,0.0131711
GemmAndBiasTunableOp_float_TN,tn_10_82_256_ld_256_256_10,Gemm_Hipblaslt_1286,0.0127508
GemmAndBiasTunableOp_float_TN,tn_128_406_576_ld_576_576_128,Gemm_Hipblaslt_1285,0.0350345
GemmAndBiasTunableOp_float_TN,tn_2_406_128_ld_128_128_2,Gemm_Hipblaslt_1284,0.0113325
GemmAndBiasTunableOp_float_TN,tn_4_406_128_ld_128_128_4,Gemm_Hipblaslt_1284,0.011296
GemmAndBiasTunableOp_float_TN,tn_128_324_576_ld_576_576_128,Gemm_Hipblaslt_1285,0.0305129
GemmAndBiasTunableOp_float_TN,tn_2_324_128_ld_128_128_2,Gemm_Hipblaslt_1284,0.010712
GemmAndBiasTunableOp_float_TN,tn_4_324_128_ld_128_128_4,Gemm_Hipblaslt_1284,0.0105786
GemmAndBiasTunableOp_float_TN,tn_128_236_576_ld_576_576_128,Gemm_Hipblaslt_1285,0.0303642
GemmAndBiasTunableOp_float_TN,tn_2_236_128_ld_128_128_2,Gemm_Hipblaslt_1286,0.010262
GemmAndBiasTunableOp_float_TN,tn_4_236_128_ld_128_128_4,Gemm_Hipblaslt_1286,0.0101847
GemmAndBiasTunableOp_float_TN,tn_128_88_576_ld_576_576_128,Gemm_Hipblaslt_1284,0.0205634
GemmAndBiasTunableOp_float_TN,tn_2_88_128_ld_128_128_2,Gemm_Hipblaslt_1284,0.0103341
GemmAndBiasTunableOp_float_TN,tn_4_88_128_ld_128_128_4,Gemm_Hipblaslt_1284,0.0103595
GemmAndBiasTunableOp_float_TN,tn_256_38_1152_ld_1152_1152_256,Gemm_Hipblaslt_1284,0.0340531
GemmAndBiasTunableOp_float_TN,tn_2_38_256_ld_256_256_2,Gemm_Hipblaslt_1286,0.0129988
GemmAndBiasTunableOp_float_TN,tn_4_38_256_ld_256_256_4,Gemm_Hipblaslt_1286,0.0131211
GemmAndBiasTunableOp_float_TN,tn_10_38_256_ld_256_256_10,Gemm_Hipblaslt_1286,0.0128389
GemmAndBiasTunableOp_float_TN,tn_128_302_576_ld_576_576_128,Gemm_Hipblaslt_1285,0.0318378
GemmAndBiasTunableOp_float_TN,tn_2_302_128_ld_128_128_2,Gemm_Hipblaslt_1286,0.0107037
GemmAndBiasTunableOp_float_TN,tn_4_302_128_ld_128_128_4,Gemm_Hipblaslt_1284,0.0104917
GemmAndBiasTunableOp_float_TN,tn_128_317_576_ld_576_576_128,Gemm_Hipblaslt_1285,0.0275481
GemmAndBiasTunableOp_float_TN,tn_2_317_128_ld_128_128_2,Gemm_Hipblaslt_1284,0.0111429
GemmAndBiasTunableOp_float_TN,tn_4_317_128_ld_128_128_4,Gemm_Hipblaslt_1284,0.0108928
GemmAndBiasTunableOp_float_TN,tn_128_129_576_ld_576_576_128,Gemm_Hipblaslt_1284,0.024064
GemmAndBiasTunableOp_float_TN,tn_2_129_128_ld_128_128_2,Gemm_Hipblaslt_1286,0.01023
GemmAndBiasTunableOp_float_TN,tn_4_129_128_ld_128_128_4,Gemm_Hipblaslt_1284,0.0103218
GemmAndBiasTunableOp_float_TN,tn_256_15_1152_ld_1152_1152_256,Gemm_Hipblaslt_1286,0.0324382
GemmAndBiasTunableOp_float_TN,tn_2_15_256_ld_256_256_2,Gemm_Hipblaslt_1286,0.0130189
GemmAndBiasTunableOp_float_TN,tn_4_15_256_ld_256_256_4,Gemm_Hipblaslt_1286,0.0131043
GemmAndBiasTunableOp_float_TN,tn_10_15_256_ld_256_256_10,Gemm_Hipblaslt_1286,0.0127158
GemmAndBiasTunableOp_float_TN,tn_128_253_576_ld_576_576_128,Gemm_Hipblaslt_1285,0.0290971
GemmAndBiasTunableOp_float_TN,tn_2_253_128_ld_128_128_2,Gemm_Hipblaslt_1284,0.0106644
GemmAndBiasTunableOp_float_TN,tn_4_253_128_ld_128_128_4,Gemm_Hipblaslt_1286,0.0105081
GemmAndBiasTunableOp_float_TN,tn_128_329_576_ld_576_576_128,Gemm_Hipblaslt_1285,0.0349203
GemmAndBiasTunableOp_float_TN,tn_2_329_128_ld_128_128_2,Gemm_Hipblaslt_1286,0.01084
GemmAndBiasTunableOp_float_TN,tn_4_329_128_ld_128_128_4,Gemm_Hipblaslt_1284,0.0106232
GemmAndBiasTunableOp_float_TN,tn_128_340_576_ld_576_576_128,Gemm_Hipblaslt_1285,0.0299868
GemmAndBiasTunableOp_float_TN,tn_2_340_128_ld_128_128_2,Gemm_Hipblaslt_1286,0.0111329
GemmAndBiasTunableOp_float_TN,tn_4_340_128_ld_128_128_4,Gemm_Hipblaslt_1284,0.0111212
GemmAndBiasTunableOp_float_TN,tn_128_339_576_ld_576_576_128,Gemm_Hipblaslt_1285,0.0311509
GemmAndBiasTunableOp_float_TN,tn_2_339_128_ld_128_128_2,Gemm_Hipblaslt_1286,0.0102933
GemmAndBiasTunableOp_float_TN,tn_4_339_128_ld_128_128_4,Gemm_Hipblaslt_1286,0.0103478
GemmAndBiasTunableOp_float_TN,tn_128_289_576_ld_576_576_128,Gemm_Hipblaslt_1285,0.0293146
GemmAndBiasTunableOp_float_TN,tn_2_289_128_ld_128_128_2,Gemm_Hipblaslt_1284,0.0105762
GemmAndBiasTunableOp_float_TN,tn_4_289_128_ld_128_128_4,Gemm_Hipblaslt_1286,0.0104424
GemmAndBiasTunableOp_float_TN,tn_128_135_576_ld_576_576_128,Gemm_Hipblaslt_1284,0.0226962
GemmAndBiasTunableOp_float_TN,tn_2_135_128_ld_128_128_2,Gemm_Hipblaslt_1286,0.0104143
GemmAndBiasTunableOp_float_TN,tn_4_135_128_ld_128_128_4,Gemm_Hipblaslt_1284,0.0102697
GemmAndBiasTunableOp_float_TN,tn_128_176_576_ld_576_576_128,Gemm_Hipblaslt_1285,0.0260542
GemmAndBiasTunableOp_float_TN,tn_2_176_128_ld_128_128_2,Gemm_Hipblaslt_1286,0.0103967
GemmAndBiasTunableOp_float_TN,tn_4_176_128_ld_128_128_4,Gemm_Hipblaslt_1286,0.0102929
GemmAndBiasTunableOp_float_TN,tn_256_26_1152_ld_1152_1152_256,Gemm_Hipblaslt_1286,0.0338784
GemmAndBiasTunableOp_float_TN,tn_2_26_256_ld_256_256_2,Gemm_Hipblaslt_1286,0.0131419
GemmAndBiasTunableOp_float_TN,tn_4_26_256_ld_256_256_4,Gemm_Hipblaslt_1286,0.0130285
GemmAndBiasTunableOp_float_TN,tn_10_26_256_ld_256_256_10,Gemm_Hipblaslt_1286,0.0126361
GemmAndBiasTunableOp_float_TN,tn_128_287_576_ld_576_576_128,Gemm_Hipblaslt_1285,0.0273101
GemmAndBiasTunableOp_float_TN,tn_2_287_128_ld_128_128_2,Gemm_Hipblaslt_1286,0.0104921
GemmAndBiasTunableOp_float_TN,tn_4_287_128_ld_128_128_4,Gemm_Hipblaslt_1286,0.0102353
GemmAndBiasTunableOp_float_TN,tn_128_236_576_ld_576_576_128,Gemm_Hipblaslt_1285,0.0298593
GemmAndBiasTunableOp_float_TN,tn_2_236_128_ld_128_128_2,Gemm_Hipblaslt_1284,0.0105017
GemmAndBiasTunableOp_float_TN,tn_4_236_128_ld_128_128_4,Gemm_Hipblaslt_1286,0.0104452
GemmAndBiasTunableOp_float_TN,tn_128_277_576_ld_576_576_128,Gemm_Hipblaslt_1285,0.0310119
GemmAndBiasTunableOp_float_TN,tn_2_277_128_ld_128_128_2,Gemm_Hipblaslt_1286,0.0106637
GemmAndBiasTunableOp_float_TN,tn_4_277_128_ld_128_128_4,Gemm_Hipblaslt_1286,0.0105025
GemmAndBiasTunableOp_float_TN,tn_128_443_576_ld_576_576_128,Gemm_Hipblaslt_1285,0.0431315
GemmAndBiasTunableOp_float_TN,tn_2_443_128_ld_128_128_2,Gemm_Hipblaslt_1286,0.0116474
GemmAndBiasTunableOp_float_TN,tn_4_443_128_ld_128_128_4,Gemm_Hipblaslt_1286,0.0118563
GemmAndBiasTunableOp_float_TN,tn_256_16_1152_ld_1152_1152_256,Gemm_Hipblaslt_1286,0.0324746
GemmAndBiasTunableOp_float_TN,tn_2_16_256_ld_256_256_2,Gemm_Hipblaslt_1286,0.0130357
GemmAndBiasTunableOp_float_TN,tn_4_16_256_ld_256_256_4,Gemm_Hipblaslt_1286,0.0131788
GemmAndBiasTunableOp_float_TN,tn_10_16_256_ld_256_256_10,Gemm_Hipblaslt_1286,0.0129146
GemmAndBiasTunableOp_float_TN,tn_256_39_1152_ld_1152_1152_256,Gemm_Hipblaslt_1284,0.0341714
GemmAndBiasTunableOp_float_TN,tn_2_39_256_ld_256_256_2,Gemm_Hipblaslt_1286,0.0132285
GemmAndBiasTunableOp_float_TN,tn_4_39_256_ld_256_256_4,Gemm_Hipblaslt_1286,0.0130265
GemmAndBiasTunableOp_float_TN,tn_10_39_256_ld_256_256_10,Gemm_Hipblaslt_1286,0.0128117
GemmAndBiasTunableOp_float_TN,tn_128_197_576_ld_576_576_128,Gemm_Hipblaslt_1285,0.029095
GemmAndBiasTunableOp_float_TN,tn_2_197_128_ld_128_128_2,Gemm_Hipblaslt_1286,0.0105739
GemmAndBiasTunableOp_float_TN,tn_4_197_128_ld_128_128_4,Gemm_Hipblaslt_1286,0.010577
GemmAndBiasTunableOp_float_TN,tn_128_504_576_ld_576_576_128,Gemm_Hipblaslt_1285,0.0437991
GemmAndBiasTunableOp_float_TN,tn_2_504_128_ld_128_128_2,Gemm_Hipblaslt_1284,0.0117384
GemmAndBiasTunableOp_float_TN,tn_4_504_128_ld_128_128_4,Gemm_Hipblaslt_1284,0.0115921
GemmAndBiasTunableOp_float_TN,tn_128_439_576_ld_576_576_128,Gemm_Hipblaslt_1285,0.0364128
GemmAndBiasTunableOp_float_TN,tn_2_439_128_ld_128_128_2,Gemm_Hipblaslt_1284,0.0106636
GemmAndBiasTunableOp_float_TN,tn_4_439_128_ld_128_128_4,Gemm_Hipblaslt_1284,0.0105715
GemmAndBiasTunableOp_float_TN,tn_128_220_576_ld_576_576_128,Gemm_Hipblaslt_1285,0.0261768
GemmAndBiasTunableOp_float_TN,tn_2_220_128_ld_128_128_2,Gemm_Hipblaslt_1286,0.0102966
GemmAndBiasTunableOp_float_TN,tn_4_220_128_ld_128_128_4,Gemm_Hipblaslt_1286,0.0101835
GemmAndBiasTunableOp_float_TN,tn_128_178_576_ld_576_576_128,Gemm_Hipblaslt_1285,0.0256433
GemmAndBiasTunableOp_float_TN,tn_2_178_128_ld_128_128_2,Gemm_Hipblaslt_1286,0.0102617
GemmAndBiasTunableOp_float_TN,tn_4_178_128_ld_128_128_4,Gemm_Hipblaslt_1286,0.0101623
GemmAndBiasTunableOp_float_TN,tn_128_195_576_ld_576_576_128,Gemm_Hipblaslt_1285,0.0279161
GemmAndBiasTunableOp_float_TN,tn_2_195_128_ld_128_128_2,Gemm_Hipblaslt_1286,0.01043
GemmAndBiasTunableOp_float_TN,tn_4_195_128_ld_128_128_4,Gemm_Hipblaslt_1286,0.0103262
GemmAndBiasTunableOp_float_TN,tn_256_29_1152_ld_1152_1152_256,Gemm_Hipblaslt_1284,0.0337038
GemmAndBiasTunableOp_float_TN,tn_2_29_256_ld_256_256_2,Gemm_Hipblaslt_1286,0.0130305
GemmAndBiasTunableOp_float_TN,tn_4_29_256_ld_256_256_4,Gemm_Hipblaslt_1286,0.0129916
GemmAndBiasTunableOp_float_TN,tn_10_29_256_ld_256_256_10,Gemm_Hipblaslt_1286,0.0126858
GemmAndBiasTunableOp_float_TN,tn_128_433_576_ld_576_576_128,Gemm_Hipblaslt_1285,0.0363993
GemmAndBiasTunableOp_float_TN,tn_2_433_128_ld_128_128_2,Gemm_Hipblaslt_1286,0.0104212
GemmAndBiasTunableOp_float_TN,tn_4_433_128_ld_128_128_4,Gemm_Hipblaslt_1286,0.0105062
GemmAndBiasTunableOp_float_TN,tn_128_260_576_ld_576_576_128,Gemm_Hipblaslt_1285,0.0288009
GemmAndBiasTunableOp_float_TN,tn_2_260_128_ld_128_128_2,Gemm_Hipblaslt_1284,0.0106253
GemmAndBiasTunableOp_float_TN,tn_4_260_128_ld_128_128_4,Gemm_Hipblaslt_1286,0.01047
GemmAndBiasTunableOp_float_TN,tn_128_170_576_ld_576_576_128,Gemm_Hipblaslt_1284,0.0284932
GemmAndBiasTunableOp_float_TN,tn_2_170_128_ld_128_128_2,Gemm_Hipblaslt_1286,0.0104705
GemmAndBiasTunableOp_float_TN,tn_4_170_128_ld_128_128_4,Gemm_Hipblaslt_1286,0.0102789
GemmAndBiasTunableOp_float_TN,tn_128_154_576_ld_576_576_128,Gemm_Hipblaslt_1284,0.0276147
GemmAndBiasTunableOp_float_TN,tn_2_154_128_ld_128_128_2,Gemm_Hipblaslt_1286,0.0104416
GemmAndBiasTunableOp_float_TN,tn_4_154_128_ld_128_128_4,Gemm_Hipblaslt_1286,0.01041
GemmAndBiasTunableOp_float_TN,tn_128_308_576_ld_576_576_128,Gemm_Hipblaslt_1285,0.0275586
GemmAndBiasTunableOp_float_TN,tn_2_308_128_ld_128_128_2,Gemm_Hipblaslt_1286,0.0110969
GemmAndBiasTunableOp_float_TN,tn_4_308_128_ld_128_128_4,Gemm_Hipblaslt_1284,0.0108031
GemmAndBiasTunableOp_float_TN,tn_128_337_576_ld_576_576_128,Gemm_Hipblaslt_1285,0.0309923
GemmAndBiasTunableOp_float_TN,tn_2_337_128_ld_128_128_2,Gemm_Hipblaslt_1284,0.0103287
GemmAndBiasTunableOp_float_TN,tn_4_337_128_ld_128_128_4,Gemm_Hipblaslt_1286,0.0102421
GemmAndBiasTunableOp_float_TN,tn_128_440_576_ld_576_576_128,Gemm_Hipblaslt_1285,0.0359941
GemmAndBiasTunableOp_float_TN,tn_2_440_128_ld_128_128_2,Gemm_Hipblaslt_1284,0.010854
GemmAndBiasTunableOp_float_TN,tn_4_440_128_ld_128_128_4,Gemm_Hipblaslt_1286,0.0106549
GemmAndBiasTunableOp_float_TN,tn_128_227_576_ld_576_576_128,Gemm_Hipblaslt_1285,0.0311687
GemmAndBiasTunableOp_float_TN,tn_2_227_128_ld_128_128_2,Gemm_Hipblaslt_1284,0.0106523
GemmAndBiasTunableOp_float_TN,tn_4_227_128_ld_128_128_4,Gemm_Hipblaslt_1284,0.0107237
GemmAndBiasTunableOp_float_TN,tn_128_351_576_ld_576_576_128,Gemm_Hipblaslt_1285,0.0305655
GemmAndBiasTunableOp_float_TN,tn_2_351_128_ld_128_128_2,Gemm_Hipblaslt_1286,0.0108585
GemmAndBiasTunableOp_float_TN,tn_4_351_128_ld_128_128_4,Gemm_Hipblaslt_1286,0.0106733
GemmAndBiasTunableOp_float_TN,tn_128_307_576_ld_576_576_128,Gemm_Hipblaslt_1285,0.0306128
GemmAndBiasTunableOp_float_TN,tn_2_307_128_ld_128_128_2,Gemm_Hipblaslt_1284,0.0112215
GemmAndBiasTunableOp_float_TN,tn_4_307_128_ld_128_128_4,Gemm_Hipblaslt_1284,0.0111189
GemmAndBiasTunableOp_float_TN,tn_128_83_576_ld_576_576_128,Gemm_Hipblaslt_1286,0.0212099
GemmAndBiasTunableOp_float_TN,tn_2_83_128_ld_128_128_2,Gemm_Hipblaslt_1286,0.0102384
GemmAndBiasTunableOp_float_TN,tn_4_83_128_ld_128_128_4,Gemm_Hipblaslt_1286,0.0103795
GemmAndBiasTunableOp_float_TN,tn_128_275_576_ld_576_576_128,Gemm_Hipblaslt_1285,0.0270902
GemmAndBiasTunableOp_float_TN,tn_2_275_128_ld_128_128_2,Gemm_Hipblaslt_1284,0.0104797
GemmAndBiasTunableOp_float_TN,tn_4_275_128_ld_128_128_4,Gemm_Hipblaslt_1284,0.0104032
GemmAndBiasTunableOp_float_TN,tn_128_90_576_ld_576_576_128,Gemm_Hipblaslt_1286,0.0236866
GemmAndBiasTunableOp_float_TN,tn_2_90_128_ld_128_128_2,Gemm_Hipblaslt_1286,0.0103651
GemmAndBiasTunableOp_float_TN,tn_4_90_128_ld_128_128_4,Gemm_Hipblaslt_1286,0.0102205
GemmAndBiasTunableOp_float_TN,tn_128_245_576_ld_576_576_128,Gemm_Hipblaslt_1285,0.0290338
GemmAndBiasTunableOp_float_TN,tn_2_245_128_ld_128_128_2,Gemm_Hipblaslt_1284,0.0105126
GemmAndBiasTunableOp_float_TN,tn_4_245_128_ld_128_128_4,Gemm_Hipblaslt_1286,0.0103107
GemmAndBiasTunableOp_float_TN,tn_128_400_576_ld_576_576_128,Gemm_Hipblaslt_1285,0.0332357
GemmAndBiasTunableOp_float_TN,tn_2_400_128_ld_128_128_2,Gemm_Hipblaslt_1284,0.0114932
GemmAndBiasTunableOp_float_TN,tn_4_400_128_ld_128_128_4,Gemm_Hipblaslt_1284,0.0114015
GemmAndBiasTunableOp_float_TN,tn_128_328_576_ld_576_576_128,Gemm_Hipblaslt_1285,0.0305555
GemmAndBiasTunableOp_float_TN,tn_2_328_128_ld_128_128_2,Gemm_Hipblaslt_1284,0.0104088
GemmAndBiasTunableOp_float_TN,tn_4_328_128_ld_128_128_4,Gemm_Hipblaslt_1286,0.0103831
GemmAndBiasTunableOp_float_TN,tn_128_235_576_ld_576_576_128,Gemm_Hipblaslt_1285,0.0299969
GemmAndBiasTunableOp_float_TN,tn_2_235_128_ld_128_128_2,Gemm_Hipblaslt_1286,0.0104228
GemmAndBiasTunableOp_float_TN,tn_4_235_128_ld_128_128_4,Gemm_Hipblaslt_1284,0.0104328
GemmAndBiasTunableOp_float_TN,tn_256_71_1152_ld_1152_1152_256,Gemm_Hipblaslt_1284,0.0387975
GemmAndBiasTunableOp_float_TN,tn_2_71_256_ld_256_256_2,Gemm_Hipblaslt_1286,0.0129251
GemmAndBiasTunableOp_float_TN,tn_4_71_256_ld_256_256_4,Gemm_Hipblaslt_1286,0.0129764
GemmAndBiasTunableOp_float_TN,tn_10_71_256_ld_256_256_10,Gemm_Hipblaslt_1284,0.0129965
GemmAndBiasTunableOp_float_TN,tn_256_20_1152_ld_1152_1152_256,Gemm_Hipblaslt_1286,0.0331858
GemmAndBiasTunableOp_float_TN,tn_2_20_256_ld_256_256_2,Gemm_Hipblaslt_1286,0.0130799
GemmAndBiasTunableOp_float_TN,tn_4_20_256_ld_256_256_4,Gemm_Hipblaslt_1286,0.0132273
GemmAndBiasTunableOp_float_TN,tn_10_20_256_ld_256_256_10,Gemm_Hipblaslt_1286,0.0127989
GemmAndBiasTunableOp_float_TN,tn_256_20_1152_ld_1152_1152_256,Gemm_Hipblaslt_1286,0.0331745
GemmAndBiasTunableOp_float_TN,tn_2_20_256_ld_256_256_2,Gemm_Hipblaslt_1286,0.0129708
GemmAndBiasTunableOp_float_TN,tn_4_20_256_ld_256_256_4,Gemm_Hipblaslt_1286,0.0130947
GemmAndBiasTunableOp_float_TN,tn_10_20_256_ld_256_256_10,Gemm_Hipblaslt_1286,0.0126479
GemmAndBiasTunableOp_float_TN,tn_128_266_576_ld_576_576_128,Gemm_Hipblaslt_1285,0.0287622
GemmAndBiasTunableOp_float_TN,tn_2_266_128_ld_128_128_2,Gemm_Hipblaslt_1284,0.0103186
GemmAndBiasTunableOp_float_TN,tn_4_266_128_ld_128_128_4,Gemm_Hipblaslt_1286,0.0102437
GemmAndBiasTunableOp_float_TN,tn_256_85_1152_ld_1152_1152_256,Gemm_Hipblaslt_1285,0.0417803
GemmAndBiasTunableOp_float_TN,tn_2_85_256_ld_256_256_2,Gemm_Hipblaslt_1286,0.012966
GemmAndBiasTunableOp_float_TN,tn_4_85_256_ld_256_256_4,Gemm_Hipblaslt_1286,0.0130069
GemmAndBiasTunableOp_float_TN,tn_10_85_256_ld_256_256_10,Gemm_Hipblaslt_1286,0.0126322
GemmAndBiasTunableOp_float_TN,tn_256_85_1152_ld_1152_1152_256,Gemm_Hipblaslt_1285,0.0415086
GemmAndBiasTunableOp_float_TN,tn_2_85_256_ld_256_256_2,Gemm_Hipblaslt_1286,0.0130458
GemmAndBiasTunableOp_float_TN,tn_4_85_256_ld_256_256_4,Gemm_Hipblaslt_1286,0.0128903
GemmAndBiasTunableOp_float_TN,tn_10_85_256_ld_256_256_10,Gemm_Hipblaslt_1286,0.0125845
GemmAndBiasTunableOp_float_TN,tn_128_489_576_ld_576_576_128,Gemm_Hipblaslt_1285,0.0388275
GemmAndBiasTunableOp_float_TN,tn_2_489_128_ld_128_128_2,Gemm_Hipblaslt_1284,0.0119618
GemmAndBiasTunableOp_float_TN,tn_4_489_128_ld_128_128_4,Gemm_Hipblaslt_1284,0.0118631
GemmAndBiasTunableOp_float_TN,tn_128_190_576_ld_576_576_128,Gemm_Hipblaslt_1285,0.027981
GemmAndBiasTunableOp_float_TN,tn_2_190_128_ld_128_128_2,Gemm_Hipblaslt_1284,0.0105246
GemmAndBiasTunableOp_float_TN,tn_4_190_128_ld_128_128_4,Gemm_Hipblaslt_1286,0.0104356
GemmAndBiasTunableOp_float_TN,tn_128_250_576_ld_576_576_128,Gemm_Hipblaslt_1285,0.0275771
GemmAndBiasTunableOp_float_TN,tn_2_250_128_ld_128_128_2,Gemm_Hipblaslt_1284,0.0102148
GemmAndBiasTunableOp_float_TN,tn_4_250_128_ld_128_128_4,Gemm_Hipblaslt_1284,0.0102513
GemmAndBiasTunableOp_float_TN,tn_128_268_576_ld_576_576_128,Gemm_Hipblaslt_1285,0.0277574
GemmAndBiasTunableOp_float_TN,tn_2_268_128_ld_128_128_2,Gemm_Hipblaslt_1286,0.0102897
GemmAndBiasTunableOp_float_TN,tn_4_268_128_ld_128_128_4,Gemm_Hipblaslt_1286,0.0102785
GemmAndBiasTunableOp_float_TN,tn_128_362_576_ld_576_576_128,Gemm_Hipblaslt_1285,0.0356867
GemmAndBiasTunableOp_float_TN,tn_2_362_128_ld_128_128_2,Gemm_Hipblaslt_1286,0.0106861
GemmAndBiasTunableOp_float_TN,tn_4_362_128_ld_128_128_4,Gemm_Hipblaslt_1284,0.0105206
GemmAndBiasTunableOp_float_TN,tn_128_255_576_ld_576_576_128,Gemm_Hipblaslt_1285,0.0288884
GemmAndBiasTunableOp_float_TN,tn_2_255_128_ld_128_128_2,Gemm_Hipblaslt_1286,0.0104922
GemmAndBiasTunableOp_float_TN,tn_4_255_128_ld_128_128_4,Gemm_Hipblaslt_1286,0.0104489
GemmAndBiasTunableOp_float_TN,tn_128_306_576_ld_576_576_128,Gemm_Hipblaslt_1285,0.0347258
GemmAndBiasTunableOp_float_TN,tn_2_306_128_ld_128_128_2,Gemm_Hipblaslt_1284,0.0107734
GemmAndBiasTunableOp_float_TN,tn_4_306_128_ld_128_128_4,Gemm_Hipblaslt_1284,0.0108035
GemmAndBiasTunableOp_float_TN,tn_128_310_576_ld_576_576_128,Gemm_Hipblaslt_1287,0.0352828
GemmAndBiasTunableOp_float_TN,tn_2_310_128_ld_128_128_2,Gemm_Hipblaslt_1284,0.0109554
GemmAndBiasTunableOp_float_TN,tn_4_310_128_ld_128_128_4,Gemm_Hipblaslt_1286,0.0111045
GemmAndBiasTunableOp_float_TN,tn_128_254_576_ld_576_576_128,Gemm_Hipblaslt_1285,0.0278508
GemmAndBiasTunableOp_float_TN,tn_2_254_128_ld_128_128_2,Gemm_Hipblaslt_1286,0.0101776
GemmAndBiasTunableOp_float_TN,tn_4_254_128_ld_128_128_4,Gemm_Hipblaslt_1286,0.010214
GemmAndBiasTunableOp_float_TN,tn_128_160_576_ld_576_576_128,Gemm_Hipblaslt_1284,0.0230602
GemmAndBiasTunableOp_float_TN,tn_2_160_128_ld_128_128_2,Gemm_Hipblaslt_1286,0.0102573
GemmAndBiasTunableOp_float_TN,tn_4_160_128_ld_128_128_4,Gemm_Hipblaslt_1286,0.0101952
GemmAndBiasTunableOp_float_TN,tn_128_204_576_ld_576_576_128,Gemm_Hipblaslt_1285,0.0250199
GemmAndBiasTunableOp_float_TN,tn_2_204_128_ld_128_128_2,Gemm_Hipblaslt_1286,0.0101687
GemmAndBiasTunableOp_float_TN,tn_4_204_128_ld_128_128_4,Gemm_Hipblaslt_1286,0.0102229
GemmAndBiasTunableOp_float_TN,tn_128_284_576_ld_576_576_128,Gemm_Hipblaslt_1285,0.0335027
GemmAndBiasTunableOp_float_TN,tn_2_284_128_ld_128_128_2,Gemm_Hipblaslt_1286,0.0109277
GemmAndBiasTunableOp_float_TN,tn_4_284_128_ld_128_128_4,Gemm_Hipblaslt_1286,0.0107105
GemmAndBiasTunableOp_float_TN,tn_128_182_576_ld_576_576_128,Gemm_Hipblaslt_1285,0.0276412
GemmAndBiasTunableOp_float_TN,tn_2_182_128_ld_128_128_2,Gemm_Hipblaslt_1286,0.0102622
GemmAndBiasTunableOp_float_TN,tn_4_182_128_ld_128_128_4,Gemm_Hipblaslt_1286,0.0102328
GemmAndBiasTunableOp_float_TN,tn_256_74_1152_ld_1152_1152_256,Gemm_Hipblaslt_1284,0.0399888
GemmAndBiasTunableOp_float_TN,tn_2_74_256_ld_256_256_2,Gemm_Hipblaslt_1286,0.0131159
GemmAndBiasTunableOp_float_TN,tn_4_74_256_ld_256_256_4,Gemm_Hipblaslt_1286,0.0132036
GemmAndBiasTunableOp_float_TN,tn_10_74_256_ld_256_256_10,Gemm_Hipblaslt_1286,0.0126978
GemmAndBiasTunableOp_float_TN,tn_128_231_576_ld_576_576_128,Gemm_Hipblaslt_1285,0.0274364
GemmAndBiasTunableOp_float_TN,tn_2_231_128_ld_128_128_2,Gemm_Hipblaslt_1287,0.0120298
GemmAndBiasTunableOp_float_TN,tn_4_231_128_ld_128_128_4,Gemm_Hipblaslt_1286,0.0102344
GemmAndBiasTunableOp_float_TN,tn_128_413_576_ld_576_576_128,Gemm_Hipblaslt_1285,0.0351827
GemmAndBiasTunableOp_float_TN,tn_2_413_128_ld_128_128_2,Gemm_Hipblaslt_1286,0.0102653
GemmAndBiasTunableOp_float_TN,tn_4_413_128_ld_128_128_4,Gemm_Hipblaslt_1286,0.0103784
GemmAndBiasTunableOp_float_TN,tn_128_296_576_ld_576_576_128,Gemm_Hipblaslt_1285,0.0271212
GemmAndBiasTunableOp_float_TN,tn_2_296_128_ld_128_128_2,Gemm_Hipblaslt_1286,0.0103047
GemmAndBiasTunableOp_float_TN,tn_4_296_128_ld_128_128_4,Gemm_Hipblaslt_1284,0.0103228
GemmAndBiasTunableOp_float_TN,tn_2304_50_768_ld_768_768_2304,Gemm_Hipblaslt_1285,0.105926
GemmAndBiasTunableOp_float_TN,tn_768_50_768_ld_768_768_768,Gemm_Hipblaslt_1285,0.0393356
GemmAndBiasTunableOp_float_TN,tn_3072_50_768_ld_768_768_3072,Gemm_Hipblaslt_1285,0.139482
GemmAndBiasTunableOp_float_TN,tn_768_50_3072_ld_3072_3072_768,Gemm_Hipblaslt_1285,0.140293
GemmTunableOp_float_NN,nn_512_1_768_ld_512_38400_512,Gemm_Rocblas_-9,0.00968476
GemmAndBiasTunableOp_float_TN,tn_128_133_576_ld_576_576_128,Gemm_Hipblaslt_1284,0.022466
GemmAndBiasTunableOp_float_TN,tn_2_133_128_ld_128_128_2,Gemm_Hipblaslt_1286,0.0102506
GemmAndBiasTunableOp_float_TN,tn_4_133_128_ld_128_128_4,Gemm_Hipblaslt_1284,0.0102165
GemmAndBiasTunableOp_float_TN,tn_128_510_576_ld_576_576_128,Gemm_Hipblaslt_1285,0.0392989
GemmAndBiasTunableOp_float_TN,tn_2_510_128_ld_128_128_2,Gemm_Hipblaslt_1284,0.0117358
GemmAndBiasTunableOp_float_TN,tn_4_510_128_ld_128_128_4,Gemm_Hipblaslt_1284,0.0116441
GemmAndBiasTunableOp_float_TN,tn_256_37_1152_ld_1152_1152_256,Gemm_Hipblaslt_1284,0.0341299
GemmAndBiasTunableOp_float_TN,tn_2_37_256_ld_256_256_2,Gemm_Hipblaslt_1286,0.0129915
GemmAndBiasTunableOp_float_TN,tn_4_37_256_ld_256_256_4,Gemm_Hipblaslt_1286,0.0129722
GemmAndBiasTunableOp_float_TN,tn_10_37_256_ld_256_256_10,Gemm_Hipblaslt_1286,0.0127076
GemmAndBiasTunableOp_float_TN,tn_128_232_576_ld_576_576_128,Gemm_Hipblaslt_1285,0.0266562
GemmAndBiasTunableOp_float_TN,tn_2_232_128_ld_128_128_2,Gemm_Hipblaslt_1286,0.0102546
GemmAndBiasTunableOp_float_TN,tn_4_232_128_ld_128_128_4,Gemm_Hipblaslt_1286,0.0103276
GemmAndBiasTunableOp_float_TN,tn_128_354_576_ld_576_576_128,Gemm_Hipblaslt_1285,0.0310305
GemmAndBiasTunableOp_float_TN,tn_2_354_128_ld_128_128_2,Gemm_Hipblaslt_1286,0.0102302
GemmAndBiasTunableOp_float_TN,tn_4_354_128_ld_128_128_4,Gemm_Hipblaslt_1284,0.0102414
GemmAndBiasTunableOp_float_TN,tn_128_343_576_ld_576_576_128,Gemm_Hipblaslt_1285,0.0306662
GemmAndBiasTunableOp_float_TN,tn_2_343_128_ld_128_128_2,Gemm_Hipblaslt_1284,0.0110493
GemmAndBiasTunableOp_float_TN,tn_4_343_128_ld_128_128_4,Gemm_Hipblaslt_1284,0.0108117
GemmAndBiasTunableOp_float_TN,tn_128_479_576_ld_576_576_128,Gemm_Hipblaslt_1285,0.0405731
GemmAndBiasTunableOp_float_TN,tn_2_479_128_ld_128_128_2,Gemm_Hipblaslt_1286,0.0119022
GemmAndBiasTunableOp_float_TN,tn_4_479_128_ld_128_128_4,Gemm_Hipblaslt_1284,0.011982
GemmAndBiasTunableOp_float_TN,tn_128_408_576_ld_576_576_128,Gemm_Hipblaslt_1287,0.0480774
GemmAndBiasTunableOp_float_TN,tn_2_408_128_ld_128_128_2,Gemm_Hipblaslt_1287,0.0146221
GemmAndBiasTunableOp_float_TN,tn_4_408_128_ld_128_128_4,Gemm_Hipblaslt_1287,0.0145717
GemmAndBiasTunableOp_float_TN,tn_128_301_576_ld_576_576_128,Gemm_Hipblaslt_1285,0.0270611
GemmAndBiasTunableOp_float_TN,tn_2_301_128_ld_128_128_2,Gemm_Hipblaslt_1286,0.0102343
GemmAndBiasTunableOp_float_TN,tn_4_301_128_ld_128_128_4,Gemm_Hipblaslt_1286,0.0102619
GemmAndBiasTunableOp_float_TN,tn_128_258_576_ld_576_576_128,Gemm_Hipblaslt_1285,0.0259971
GemmAndBiasTunableOp_float_TN,tn_2_258_128_ld_128_128_2,Gemm_Hipblaslt_1286,0.0102029
GemmAndBiasTunableOp_float_TN,tn_4_258_128_ld_128_128_4,Gemm_Hipblaslt_1286,0.0101833
GemmAndBiasTunableOp_float_TN,tn_128_505_576_ld_576_576_128,Gemm_Hipblaslt_1285,0.0397566
GemmAndBiasTunableOp_float_TN,tn_2_505_128_ld_128_128_2,Gemm_Hipblaslt_1286,0.0103035
GemmAndBiasTunableOp_float_TN,tn_4_505_128_ld_128_128_4,Gemm_Hipblaslt_1286,0.0103315
GemmAndBiasTunableOp_float_TN,tn_128_210_576_ld_576_576_128,Gemm_Hipblaslt_1285,0.0245825
GemmAndBiasTunableOp_float_TN,tn_2_210_128_ld_128_128_2,Gemm_Hipblaslt_1286,0.0101528
GemmAndBiasTunableOp_float_TN,tn_4_210_128_ld_128_128_4,Gemm_Hipblaslt_1286,0.0101921
GemmAndBiasTunableOp_float_TN,tn_128_384_576_ld_576_576_128,Gemm_Hipblaslt_1285,0.032505
GemmAndBiasTunableOp_float_TN,tn_2_384_128_ld_128_128_2,Gemm_Hipblaslt_1286,0.0102663
GemmAndBiasTunableOp_float_TN,tn_4_384_128_ld_128_128_4,Gemm_Hipblaslt_1286,0.0101982
GemmAndBiasTunableOp_float_TN,tn_128_269_576_ld_576_576_128,Gemm_Hipblaslt_1285,0.0257314
GemmAndBiasTunableOp_float_TN,tn_2_269_128_ld_128_128_2,Gemm_Hipblaslt_1286,0.0101917
GemmAndBiasTunableOp_float_TN,tn_4_269_128_ld_128_128_4,Gemm_Hipblaslt_1286,0.010214
GemmAndBiasTunableOp_float_TN,tn_128_431_576_ld_576_576_128,Gemm_Hipblaslt_1285,0.0346983
GemmAndBiasTunableOp_float_TN,tn_2_431_128_ld_128_128_2,Gemm_Hipblaslt_1286,0.010259
GemmAndBiasTunableOp_float_TN,tn_4_431_128_ld_128_128_4,Gemm_Hipblaslt_1286,0.0102088
GemmAndBiasTunableOp_float_TN,tn_128_466_576_ld_576_576_128,Gemm_Hipblaslt_1285,0.0367909
GemmAndBiasTunableOp_float_TN,tn_2_466_128_ld_128_128_2,Gemm_Hipblaslt_1286,0.0103375
GemmAndBiasTunableOp_float_TN,tn_4_466_128_ld_128_128_4,Gemm_Hipblaslt_1284,0.0103747
GemmAndBiasTunableOp_float_TN,tn_128_331_576_ld_576_576_128,Gemm_Hipblaslt_1285,0.0306247
GemmAndBiasTunableOp_float_TN,tn_2_331_128_ld_128_128_2,Gemm_Hipblaslt_1286,0.0102981
GemmAndBiasTunableOp_float_TN,tn_4_331_128_ld_128_128_4,Gemm_Hipblaslt_1286,0.0102083
GemmAndBiasTunableOp_float_TN,tn_128_128_576_ld_576_576_128,Gemm_Hipblaslt_1284,0.0213544
GemmAndBiasTunableOp_float_TN,tn_2_128_128_ld_128_128_2,Gemm_Hipblaslt_1286,0.010155
GemmAndBiasTunableOp_float_TN,tn_4_128_128_ld_128_128_4,Gemm_Hipblaslt_1286,0.0101077
GemmAndBiasTunableOp_float_TN,tn_128_462_576_ld_576_576_128,Gemm_Hipblaslt_1285,0.0357754
GemmAndBiasTunableOp_float_TN,tn_2_462_128_ld_128_128_2,Gemm_Hipblaslt_1286,0.0102668
GemmAndBiasTunableOp_float_TN,tn_4_462_128_ld_128_128_4,Gemm_Hipblaslt_1286,0.010238
GemmAndBiasTunableOp_float_TN,tn_128_445_576_ld_576_576_128,Gemm_Hipblaslt_1286,0.0897071
GemmAndBiasTunableOp_float_TN,tn_2_445_128_ld_128_128_2,Gemm_Hipblaslt_1286,0.0356211
GemmAndBiasTunableOp_float_TN,tn_4_445_128_ld_128_128_4,Gemm_Hipblaslt_1286,0.0163575
GemmAndBiasTunableOp_float_TN,tn_128_470_576_ld_576_576_128,Gemm_Hipblaslt_1285,0.0358018
GemmAndBiasTunableOp_float_TN,tn_2_470_128_ld_128_128_2,Gemm_Hipblaslt_1286,0.0101807
GemmAndBiasTunableOp_float_TN,tn_4_470_128_ld_128_128_4,Gemm_Hipblaslt_1286,0.0102307
GemmAndBiasTunableOp_float_TN,tn_128_203_576_ld_576_576_128,Gemm_Hipblaslt_1285,0.024806
GemmAndBiasTunableOp_float_TN,tn_2_203_128_ld_128_128_2,Gemm_Hipblaslt_1286,0.0102547
GemmAndBiasTunableOp_float_TN,tn_4_203_128_ld_128_128_4,Gemm_Hipblaslt_1286,0.0102051
GemmAndBiasTunableOp_float_TN,tn_128_474_576_ld_576_576_128,Gemm_Hipblaslt_1285,0.0365665
GemmAndBiasTunableOp_float_TN,tn_2_474_128_ld_128_128_2,Gemm_Hipblaslt_1286,0.0103104
GemmAndBiasTunableOp_float_TN,tn_4_474_128_ld_128_128_4,Gemm_Hipblaslt_1286,0.0102595
GemmAndBiasTunableOp_float_TN,tn_128_163_576_ld_576_576_128,Gemm_Hipblaslt_1285,0.0238298
GemmAndBiasTunableOp_float_TN,tn_2_163_128_ld_128_128_2,Gemm_Hipblaslt_1286,0.0102259
GemmAndBiasTunableOp_float_TN,tn_4_163_128_ld_128_128_4,Gemm_Hipblaslt_1286,0.0102115
GemmAndBiasTunableOp_float_TN,tn_128_370_576_ld_576_576_128,Gemm_Hipblaslt_1287,0.0398378
GemmAndBiasTunableOp_float_TN,tn_2_370_128_ld_128_128_2,Gemm_Hipblaslt_1286,0.0101878
GemmAndBiasTunableOp_float_TN,tn_4_370_128_ld_128_128_4,Gemm_Hipblaslt_1286,0.0101306
GemmAndBiasTunableOp_float_TN,tn_128_477_576_ld_576_576_128,Gemm_Hipblaslt_1285,0.0360824
GemmAndBiasTunableOp_float_TN,tn_2_477_128_ld_128_128_2,Gemm_Hipblaslt_1286,0.0104067
GemmAndBiasTunableOp_float_TN,tn_4_477_128_ld_128_128_4,Gemm_Hipblaslt_1286,0.0102964
GemmAndBiasTunableOp_float_TN,tn_256_61_1152_ld_1152_1152_256,Gemm_Hipblaslt_1284,0.0362137
GemmAndBiasTunableOp_float_TN,tn_2_61_256_ld_256_256_2,Gemm_Hipblaslt_1286,0.0130328
GemmAndBiasTunableOp_float_TN,tn_4_61_256_ld_256_256_4,Gemm_Hipblaslt_1286,0.0128801
GemmAndBiasTunableOp_float_TN,tn_10_61_256_ld_256_256_10,Gemm_Hipblaslt_1286,0.0124793
GemmAndBiasTunableOp_float_TN,tn_256_24_1152_ld_1152_1152_256,Gemm_Hipblaslt_1286,0.0326191
GemmAndBiasTunableOp_float_TN,tn_2_24_256_ld_256_256_2,Gemm_Hipblaslt_1286,0.0129298
GemmAndBiasTunableOp_float_TN,tn_4_24_256_ld_256_256_4,Gemm_Hipblaslt_1286,0.013127
GemmAndBiasTunableOp_float_TN,tn_10_24_256_ld_256_256_10,Gemm_Hipblaslt_1286,0.0128325
GemmAndBiasTunableOp_float_TN,tn_128_228_576_ld_576_576_128,Gemm_Hipblaslt_1285,0.0244782
GemmAndBiasTunableOp_float_TN,tn_2_228_128_ld_128_128_2,Gemm_Hipblaslt_1286,0.0101971
GemmAndBiasTunableOp_float_TN,tn_4_228_128_ld_128_128_4,Gemm_Hipblaslt_1286,0.0102243
GemmAndBiasTunableOp_float_TN,tn_128_356_576_ld_576_576_128,Gemm_Hipblaslt_1285,0.0327408
GemmAndBiasTunableOp_float_TN,tn_2_356_128_ld_128_128_2,Gemm_Hipblaslt_1286,0.0103029
GemmAndBiasTunableOp_float_TN,tn_4_356_128_ld_128_128_4,Gemm_Hipblaslt_1286,0.0103273
GemmAndBiasTunableOp_float_TN,tn_128_216_576_ld_576_576_128,Gemm_Hipblaslt_1285,0.025917
GemmAndBiasTunableOp_float_TN,tn_2_216_128_ld_128_128_2,Gemm_Hipblaslt_1286,0.0106151
GemmAndBiasTunableOp_float_TN,tn_4_216_128_ld_128_128_4,Gemm_Hipblaslt_1286,0.0105706
GemmAndBiasTunableOp_float_TN,tn_128_316_576_ld_576_576_128,Gemm_Hipblaslt_1285,0.0271208
GemmAndBiasTunableOp_float_TN,tn_2_316_128_ld_128_128_2,Gemm_Hipblaslt_1286,0.0101879
GemmAndBiasTunableOp_float_TN,tn_4_316_128_ld_128_128_4,Gemm_Hipblaslt_1286,0.0101819
GemmAndBiasTunableOp_float_TN,tn_128_437_576_ld_576_576_128,Gemm_Hipblaslt_1285,0.0390372
GemmAndBiasTunableOp_float_TN,tn_2_437_128_ld_128_128_2,Gemm_Hipblaslt_1286,0.0102737
GemmAndBiasTunableOp_float_TN,tn_4_437_128_ld_128_128_4,Gemm_Hipblaslt_1286,0.0102508
GemmAndBiasTunableOp_float_TN,tn_128_448_576_ld_576_576_128,Gemm_Hipblaslt_1285,0.0351698
GemmAndBiasTunableOp_float_TN,tn_2_448_128_ld_128_128_2,Gemm_Hipblaslt_1286,0.010264
GemmAndBiasTunableOp_float_TN,tn_4_448_128_ld_128_128_4,Gemm_Hipblaslt_1286,0.0102275
GemmAndBiasTunableOp_float_TN,tn_128_397_576_ld_576_576_128,Gemm_Hipblaslt_1285,0.0312237
GemmAndBiasTunableOp_float_TN,tn_2_397_128_ld_128_128_2,Gemm_Hipblaslt_1286,0.0101302
GemmAndBiasTunableOp_float_TN,tn_4_397_128_ld_128_128_4,Gemm_Hipblaslt_1286,0.010246
GemmAndBiasTunableOp_float_TN,tn_256_229_1152_ld_1152_1152_256,Gemm_Hipblaslt_1285,0.0660454
GemmAndBiasTunableOp_float_TN,tn_2_229_256_ld_256_256_2,Gemm_Hipblaslt_1284,0.0131843
GemmAndBiasTunableOp_float_TN,tn_4_229_256_ld_256_256_4,Gemm_Hipblaslt_1286,0.0130104
GemmAndBiasTunableOp_float_TN,tn_10_229_256_ld_256_256_10,Gemm_Hipblaslt_1286,0.0127571
GemmAndBiasTunableOp_float_TN,tn_128_209_576_ld_576_576_128,Gemm_Hipblaslt_1285,0.0245453
GemmAndBiasTunableOp_float_TN,tn_2_209_128_ld_128_128_2,Gemm_Hipblaslt_1286,0.010258
GemmAndBiasTunableOp_float_TN,tn_4_209_128_ld_128_128_4,Gemm_Hipblaslt_1286,0.0101655
GemmAndBiasTunableOp_float_TN,tn_128_494_576_ld_576_576_128,Gemm_Hipblaslt_1285,0.0390741
GemmAndBiasTunableOp_float_TN,tn_2_494_128_ld_128_128_2,Gemm_Hipblaslt_1286,0.0103782
GemmAndBiasTunableOp_float_TN,tn_4_494_128_ld_128_128_4,Gemm_Hipblaslt_1286,0.0103165
GemmAndBiasTunableOp_float_TN,tn_256_36_1152_ld_1152_1152_256,Gemm_Hipblaslt_1284,0.0337813
GemmAndBiasTunableOp_float_TN,tn_2_36_256_ld_256_256_2,Gemm_Hipblaslt_1286,0.0129499
GemmAndBiasTunableOp_float_TN,tn_4_36_256_ld_256_256_4,Gemm_Hipblaslt_1286,0.0130592
GemmAndBiasTunableOp_float_TN,tn_10_36_256_ld_256_256_10,Gemm_Hipblaslt_1286,0.0125688
GemmAndBiasTunableOp_float_TN,tn_256_353_1152_ld_1152_1152_256,Gemm_Hipblaslt_1285,0.107008
GemmAndBiasTunableOp_float_TN,tn_2_353_256_ld_256_256_2,Gemm_Hipblaslt_1284,0.0140873
GemmAndBiasTunableOp_float_TN,tn_4_353_256_ld_256_256_4,Gemm_Hipblaslt_1286,0.0136167
GemmAndBiasTunableOp_float_TN,tn_10_353_256_ld_256_256_10,Gemm_Hipblaslt_1286,0.0135947
GemmAndBiasTunableOp_float_TN,tn_128_326_576_ld_576_576_128,Gemm_Hipblaslt_1285,0.0295134
GemmAndBiasTunableOp_float_TN,tn_2_326_128_ld_128_128_2,Gemm_Hipblaslt_1286,0.0098372
GemmAndBiasTunableOp_float_TN,tn_4_326_128_ld_128_128_4,Gemm_Hipblaslt_1286,0.0101758
GemmAndBiasTunableOp_float_TN,tn_128_344_576_ld_576_576_128,Gemm_Hipblaslt_1285,0.0296697
GemmAndBiasTunableOp_float_TN,tn_2_344_128_ld_128_128_2,Gemm_Hipblaslt_1286,0.0101574
GemmAndBiasTunableOp_float_TN,tn_4_344_128_ld_128_128_4,Gemm_Hipblaslt_1286,0.0101787
GemmAndBiasTunableOp_float_TN,tn_128_347_576_ld_576_576_128,Gemm_Hipblaslt_1285,0.0326525
GemmAndBiasTunableOp_float_TN,tn_2_347_128_ld_128_128_2,Gemm_Hipblaslt_1286,0.0110091
GemmAndBiasTunableOp_float_TN,tn_4_347_128_ld_128_128_4,Gemm_Hipblaslt_1284,0.0108131
GemmAndBiasTunableOp_float_TN,tn_128_294_576_ld_576_576_128,Gemm_Hipblaslt_1285,0.0296961
GemmAndBiasTunableOp_float_TN,tn_2_294_128_ld_128_128_2,Gemm_Hipblaslt_1286,0.0109642
GemmAndBiasTunableOp_float_TN,tn_4_294_128_ld_128_128_4,Gemm_Hipblaslt_1284,0.0109028
GemmAndBiasTunableOp_float_TN,tn_128_300_576_ld_576_576_128,Gemm_Hipblaslt_1286,0.0805411
GemmAndBiasTunableOp_float_TN,tn_2_300_128_ld_128_128_2,Gemm_Hipblaslt_1284,0.0288362
GemmAndBiasTunableOp_float_TN,tn_4_300_128_ld_128_128_4,Gemm_Hipblaslt_1286,0.0360292
GemmAndBiasTunableOp_float_TN,tn_128_262_576_ld_576_576_128,Gemm_Hipblaslt_1285,0.025816
GemmAndBiasTunableOp_float_TN,tn_2_262_128_ld_128_128_2,Gemm_Hipblaslt_1286,0.010305
GemmAndBiasTunableOp_float_TN,tn_4_262_128_ld_128_128_4,Gemm_Hipblaslt_1286,0.0102777
GemmAndBiasTunableOp_float_TN,tn_128_303_576_ld_576_576_128,Gemm_Hipblaslt_1285,0.0281263
GemmAndBiasTunableOp_float_TN,tn_2_303_128_ld_128_128_2,Gemm_Hipblaslt_1286,0.0101907
GemmAndBiasTunableOp_float_TN,tn_4_303_128_ld_128_128_4,Gemm_Hipblaslt_1286,0.0101983
GemmAndBiasTunableOp_float_TN,tn_128_358_576_ld_576_576_128,Gemm_Hipblaslt_1285,0.0316285
GemmAndBiasTunableOp_float_TN,tn_2_358_128_ld_128_128_2,Gemm_Hipblaslt_1286,0.0101927
GemmAndBiasTunableOp_float_TN,tn_4_358_128_ld_128_128_4,Gemm_Hipblaslt_1286,0.0102324
GemmAndBiasTunableOp_float_TN,tn_128_503_576_ld_576_576_128,Gemm_Hipblaslt_1285,0.0397655
GemmAndBiasTunableOp_float_TN,tn_2_503_128_ld_128_128_2,Gemm_Hipblaslt_1286,0.0101891
GemmAndBiasTunableOp_float_TN,tn_4_503_128_ld_128_128_4,Gemm_Hipblaslt_1286,0.0101983
GemmAndBiasTunableOp_float_TN,tn_256_31_1152_ld_1152_1152_256,Gemm_Hipblaslt_1284,0.0334268
GemmAndBiasTunableOp_float_TN,tn_2_31_256_ld_256_256_2,Gemm_Hipblaslt_1286,0.0130501
GemmAndBiasTunableOp_float_TN,tn_4_31_256_ld_256_256_4,Gemm_Hipblaslt_1286,0.0130076
GemmAndBiasTunableOp_float_TN,tn_10_31_256_ld_256_256_10,Gemm_Hipblaslt_1286,0.0126802
GemmAndBiasTunableOp_float_TN,tn_128_177_576_ld_576_576_128,Gemm_Hipblaslt_1285,0.0285628
GemmAndBiasTunableOp_float_TN,tn_2_177_128_ld_128_128_2,Gemm_Hipblaslt_1286,0.0102962
GemmAndBiasTunableOp_float_TN,tn_4_177_128_ld_128_128_4,Gemm_Hipblaslt_1286,0.0101354
GemmAndBiasTunableOp_float_TN,tn_128_357_576_ld_576_576_128,Gemm_Hipblaslt_1285,0.0308371
GemmAndBiasTunableOp_float_TN,tn_2_357_128_ld_128_128_2,Gemm_Hipblaslt_1286,0.0101495
GemmAndBiasTunableOp_float_TN,tn_4_357_128_ld_128_128_4,Gemm_Hipblaslt_1286,0.0102047
GemmAndBiasTunableOp_float_TN,tn_256_47_1152_ld_1152_1152_256,Gemm_Hipblaslt_1284,0.034318
GemmAndBiasTunableOp_float_TN,tn_2_47_256_ld_256_256_2,Gemm_Hipblaslt_1286,0.0129988
GemmAndBiasTunableOp_float_TN,tn_4_47_256_ld_256_256_4,Gemm_Hipblaslt_1286,0.0129155
GemmAndBiasTunableOp_float_TN,tn_10_47_256_ld_256_256_10,Gemm_Hipblaslt_1286,0.0126065
GemmAndBiasTunableOp_float_TN,tn_128_273_576_ld_576_576_128,Gemm_Hipblaslt_1285,0.0265395
GemmAndBiasTunableOp_float_TN,tn_2_273_128_ld_128_128_2,Gemm_Hipblaslt_1286,0.0102777
GemmAndBiasTunableOp_float_TN,tn_4_273_128_ld_128_128_4,Gemm_Hipblaslt_1286,0.0102356
GemmAndBiasTunableOp_float_TN,tn_128_424_576_ld_576_576_128,Gemm_Hipblaslt_1285,0.0339538
GemmAndBiasTunableOp_float_TN,tn_2_424_128_ld_128_128_2,Gemm_Hipblaslt_1286,0.0102071
GemmAndBiasTunableOp_float_TN,tn_4_424_128_ld_128_128_4,Gemm_Hipblaslt_1286,0.0101647
GemmAndBiasTunableOp_float_TN,tn_128_492_576_ld_576_576_128,Gemm_Hipblaslt_1285,0.0430332
GemmAndBiasTunableOp_float_TN,tn_2_492_128_ld_128_128_2,Gemm_Hipblaslt_1286,0.0110808
GemmAndBiasTunableOp_float_TN,tn_4_492_128_ld_128_128_4,Gemm_Hipblaslt_1284,0.0104432
GemmAndBiasTunableOp_float_TN,tn_128_230_576_ld_576_576_128,Gemm_Hipblaslt_1285,0.0246223
GemmAndBiasTunableOp_float_TN,tn_2_230_128_ld_128_128_2,Gemm_Hipblaslt_1286,0.0101867
GemmAndBiasTunableOp_float_TN,tn_4_230_128_ld_128_128_4,Gemm_Hipblaslt_1284,0.0101298
GemmAndBiasTunableOp_float_TN,tn_128_453_576_ld_576_576_128,Gemm_Hipblaslt_1287,0.0454478
GemmAndBiasTunableOp_float_TN,tn_2_453_128_ld_128_128_2,Gemm_Hipblaslt_1284,0.0102781
GemmAndBiasTunableOp_float_TN,tn_4_453_128_ld_128_128_4,Gemm_Hipblaslt_1286,0.0103414
GemmAndBiasTunableOp_float_TN,tn_128_382_576_ld_576_576_128,Gemm_Hipblaslt_1285,0.0311301
GemmAndBiasTunableOp_float_TN,tn_2_382_128_ld_128_128_2,Gemm_Hipblaslt_1286,0.0102168
GemmAndBiasTunableOp_float_TN,tn_4_382_128_ld_128_128_4,Gemm_Hipblaslt_1284,0.0103314
GemmAndBiasTunableOp_float_TN,tn_128_495_576_ld_576_576_128,Gemm_Hipblaslt_1285,0.273694
GemmAndBiasTunableOp_float_TN,tn_2_495_128_ld_128_128_2,Gemm_Hipblaslt_1284,0.0419882
GemmAndBiasTunableOp_float_TN,tn_4_495_128_ld_128_128_4,Gemm_Hipblaslt_1284,0.0308464
GemmAndBiasTunableOp_float_TN,tn_128_381_576_ld_576_576_128,Gemm_Hipblaslt_1286,0.12171
GemmAndBiasTunableOp_float_TN,tn_2_381_128_ld_128_128_2,Gemm_Hipblaslt_1284,0.0235199
GemmAndBiasTunableOp_float_TN,tn_4_381_128_ld_128_128_4,Gemm_Hipblaslt_1286,0.0317045
GemmAndBiasTunableOp_float_TN,tn_128_411_576_ld_576_576_128,Gemm_Hipblaslt_1287,0.127715
GemmAndBiasTunableOp_float_TN,tn_2_411_128_ld_128_128_2,Gemm_Hipblaslt_1286,0.0390319
GemmAndBiasTunableOp_float_TN,tn_4_411_128_ld_128_128_4,Gemm_Hipblaslt_1284,0.037394
GemmAndBiasTunableOp_float_TN,tn_128_201_576_ld_576_576_128,Gemm_Hipblaslt_1287,0.0532039
GemmAndBiasTunableOp_float_TN,tn_2_201_128_ld_128_128_2,Gemm_Hipblaslt_1286,0.0346212
GemmAndBiasTunableOp_float_TN,tn_4_201_128_ld_128_128_4,Gemm_Hipblaslt_1286,0.0336234
GemmAndBiasTunableOp_float_TN,tn_128_264_576_ld_576_576_128,Gemm_Hipblaslt_1287,0.035034
GemmAndBiasTunableOp_float_TN,tn_2_264_128_ld_128_128_2,Gemm_Hipblaslt_1286,0.0125136
GemmAndBiasTunableOp_float_TN,tn_4_264_128_ld_128_128_4,Gemm_Hipblaslt_1286,0.0114022
GemmAndBiasTunableOp_float_TN,tn_128_314_576_ld_576_576_128,Gemm_Hipblaslt_1287,0.0380586
GemmAndBiasTunableOp_float_TN,tn_2_314_128_ld_128_128_2,Gemm_Hipblaslt_1286,0.013372
GemmAndBiasTunableOp_float_TN,tn_4_314_128_ld_128_128_4,Gemm_Hipblaslt_1286,0.0134641
GemmAndBiasTunableOp_float_TN,tn_128_330_576_ld_576_576_128,Gemm_Hipblaslt_1287,0.039979
GemmAndBiasTunableOp_float_TN,tn_2_330_128_ld_128_128_2,Gemm_Hipblaslt_1286,0.0139174
GemmAndBiasTunableOp_float_TN,tn_4_330_128_ld_128_128_4,Gemm_Hipblaslt_1286,0.0138121
GemmAndBiasTunableOp_float_TN,tn_128_299_576_ld_576_576_128,Gemm_Hipblaslt_1287,0.0399088
GemmAndBiasTunableOp_float_TN,tn_2_299_128_ld_128_128_2,Gemm_Hipblaslt_1286,0.0140171
GemmAndBiasTunableOp_float_TN,tn_4_299_128_ld_128_128_4,Gemm_Hipblaslt_1286,0.0139571
GemmAndBiasTunableOp_float_TN,tn_128_395_576_ld_576_576_128,Gemm_Hipblaslt_1285,0.0402102
GemmAndBiasTunableOp_float_TN,tn_2_395_128_ld_128_128_2,Gemm_Hipblaslt_1284,0.0115806
GemmAndBiasTunableOp_float_TN,tn_4_395_128_ld_128_128_4,Gemm_Hipblaslt_1286,0.0113398
GemmAndBiasTunableOp_float_TN,tn_128_449_576_ld_576_576_128,Gemm_Hipblaslt_1285,0.0356997
GemmAndBiasTunableOp_float_TN,tn_2_449_128_ld_128_128_2,Gemm_Hipblaslt_1284,0.0116784
GemmAndBiasTunableOp_float_TN,tn_4_449_128_ld_128_128_4,Gemm_Hipblaslt_1284,0.0119317
GemmAndBiasTunableOp_float_TN,tn_128_373_576_ld_576_576_128,Gemm_Hipblaslt_1285,0.0339641
GemmAndBiasTunableOp_float_TN,tn_2_373_128_ld_128_128_2,Gemm_Hipblaslt_1284,0.0115077
GemmAndBiasTunableOp_float_TN,tn_4_373_128_ld_128_128_4,Gemm_Hipblaslt_1284,0.0116439
GemmAndBiasTunableOp_float_TN,tn_256_95_1152_ld_1152_1152_256,Gemm_Hipblaslt_1285,0.0416229
GemmAndBiasTunableOp_float_TN,tn_2_95_256_ld_256_256_2,Gemm_Hipblaslt_1286,0.0130197
GemmAndBiasTunableOp_float_TN,tn_4_95_256_ld_256_256_4,Gemm_Hipblaslt_1286,0.0129039
GemmAndBiasTunableOp_float_TN,tn_10_95_256_ld_256_256_10,Gemm_Hipblaslt_1286,0.012851
GemmAndBiasTunableOp_float_TN,tn_128_486_576_ld_576_576_128,Gemm_Hipblaslt_1285,0.0388496
GemmAndBiasTunableOp_float_TN,tn_2_486_128_ld_128_128_2,Gemm_Hipblaslt_1284,0.0120323
GemmAndBiasTunableOp_float_TN,tn_4_486_128_ld_128_128_4,Gemm_Hipblaslt_1284,0.0119326
GemmAndBiasTunableOp_float_TN,tn_128_425_576_ld_576_576_128,Gemm_Hipblaslt_1285,0.0420949
GemmAndBiasTunableOp_float_TN,tn_2_425_128_ld_128_128_2,Gemm_Hipblaslt_1286,0.0114007
GemmAndBiasTunableOp_float_TN,tn_4_425_128_ld_128_128_4,Gemm_Hipblaslt_1284,0.0112809
GemmAndBiasTunableOp_float_TN,tn_256_166_1152_ld_1152_1152_256,Gemm_Hipblaslt_1285,0.0526075
GemmAndBiasTunableOp_float_TN,tn_2_166_256_ld_256_256_2,Gemm_Hipblaslt_1286,0.0129211
GemmAndBiasTunableOp_float_TN,tn_4_166_256_ld_256_256_4,Gemm_Hipblaslt_1284,0.0131616
GemmAndBiasTunableOp_float_TN,tn_10_166_256_ld_256_256_10,Gemm_Hipblaslt_1286,0.0126907
GemmAndBiasTunableOp_float_TN,tn_128_391_576_ld_576_576_128,Gemm_Hipblaslt_1285,0.0401024
GemmAndBiasTunableOp_float_TN,tn_2_391_128_ld_128_128_2,Gemm_Hipblaslt_1286,0.0116227
GemmAndBiasTunableOp_float_TN,tn_4_391_128_ld_128_128_4,Gemm_Hipblaslt_1284,0.0115991
GemmAndBiasTunableOp_float_TN,tn_128_464_576_ld_576_576_128,Gemm_Hipblaslt_1285,0.0404425
GemmAndBiasTunableOp_float_TN,tn_2_464_128_ld_128_128_2,Gemm_Hipblaslt_1284,0.0120435
GemmAndBiasTunableOp_float_TN,tn_4_464_128_ld_128_128_4,Gemm_Hipblaslt_1284,0.0120343
GemmAndBiasTunableOp_float_TN,tn_128_223_576_ld_576_576_128,Gemm_Hipblaslt_1285,0.0259245
GemmAndBiasTunableOp_float_TN,tn_2_223_128_ld_128_128_2,Gemm_Hipblaslt_1286,0.010222
GemmAndBiasTunableOp_float_TN,tn_4_223_128_ld_128_128_4,Gemm_Hipblaslt_1286,0.0104277
GemmAndBiasTunableOp_float_TN,tn_128_475_576_ld_576_576_128,Gemm_Hipblaslt_1285,0.0358564
GemmAndBiasTunableOp_float_TN,tn_2_475_128_ld_128_128_2,Gemm_Hipblaslt_1284,0.0119758
GemmAndBiasTunableOp_float_TN,tn_4_475_128_ld_128_128_4,Gemm_Hipblaslt_1284,0.0119413
GemmAndBiasTunableOp_float_TN,tn_128_212_576_ld_576_576_128,Gemm_Hipblaslt_1285,0.0255517
GemmAndBiasTunableOp_float_TN,tn_2_212_128_ld_128_128_2,Gemm_Hipblaslt_1286,0.0107403
GemmAndBiasTunableOp_float_TN,tn_4_212_128_ld_128_128_4,Gemm_Hipblaslt_1284,0.0108132
GemmAndBiasTunableOp_float_TN,tn_128_485_576_ld_576_576_128,Gemm_Hipblaslt_1285,0.0430067
GemmAndBiasTunableOp_float_TN,tn_2_485_128_ld_128_128_2,Gemm_Hipblaslt_1284,0.0120503
GemmAndBiasTunableOp_float_TN,tn_4_485_128_ld_128_128_4,Gemm_Hipblaslt_1284,0.0118174
GemmAndBiasTunableOp_float_TN,tn_256_66_1152_ld_1152_1152_256,Gemm_Hipblaslt_1284,0.0387142
GemmAndBiasTunableOp_float_TN,tn_2_66_256_ld_256_256_2,Gemm_Hipblaslt_1286,0.0132842
GemmAndBiasTunableOp_float_TN,tn_4_66_256_ld_256_256_4,Gemm_Hipblaslt_1286,0.0129945
GemmAndBiasTunableOp_float_TN,tn_10_66_256_ld_256_256_10,Gemm_Hipblaslt_1286,0.0127965
GemmAndBiasTunableOp_float_TN,tn_128_500_576_ld_576_576_128,Gemm_Hipblaslt_1285,0.0391806
GemmAndBiasTunableOp_float_TN,tn_2_500_128_ld_128_128_2,Gemm_Hipblaslt_1284,0.012053
GemmAndBiasTunableOp_float_TN,tn_4_500_128_ld_128_128_4,Gemm_Hipblaslt_1284,0.0121529
GemmAndBiasTunableOp_float_TN,tn_128_377_576_ld_576_576_128,Gemm_Hipblaslt_1285,0.0395365
GemmAndBiasTunableOp_float_TN,tn_2_377_128_ld_128_128_2,Gemm_Hipblaslt_1284,0.0114108
GemmAndBiasTunableOp_float_TN,tn_4_377_128_ld_128_128_4,Gemm_Hipblaslt_1284,0.011371
GemmAndBiasTunableOp_float_TN,tn_128_405_576_ld_576_576_128,Gemm_Hipblaslt_1285,0.0415134
GemmAndBiasTunableOp_float_TN,tn_2_405_128_ld_128_128_2,Gemm_Hipblaslt_1284,0.0114649
GemmAndBiasTunableOp_float_TN,tn_4_405_128_ld_128_128_4,Gemm_Hipblaslt_1284,0.0113498
GemmAndBiasTunableOp_float_TN,tn_128_455_576_ld_576_576_128,Gemm_Hipblaslt_1285,0.0357209
GemmAndBiasTunableOp_float_TN,tn_2_455_128_ld_128_128_2,Gemm_Hipblaslt_1284,0.0115638
GemmAndBiasTunableOp_float_TN,tn_4_455_128_ld_128_128_4,Gemm_Hipblaslt_1286,0.0114207
GemmAndBiasTunableOp_float_TN,tn_128_508_576_ld_576_576_128,Gemm_Hipblaslt_1285,0.0436518
GemmAndBiasTunableOp_float_TN,tn_2_508_128_ld_128_128_2,Gemm_Hipblaslt_1284,0.0127336
GemmAndBiasTunableOp_float_TN,tn_4_508_128_ld_128_128_4,Gemm_Hipblaslt_1284,0.0116403
GemmAndBiasTunableOp_float_TN,tn_256_68_1152_ld_1152_1152_256,Gemm_Hipblaslt_1284,0.0386813
GemmAndBiasTunableOp_float_TN,tn_2_68_256_ld_256_256_2,Gemm_Hipblaslt_1286,0.0133214
GemmAndBiasTunableOp_float_TN,tn_4_68_256_ld_256_256_4,Gemm_Hipblaslt_1286,0.013281
GemmAndBiasTunableOp_float_TN,tn_10_68_256_ld_256_256_10,Gemm_Hipblaslt_1286,0.0129287
GemmAndBiasTunableOp_float_TN,tn_128_417_576_ld_576_576_128,Gemm_Hipblaslt_1285,0.0340971
GemmAndBiasTunableOp_float_TN,tn_2_417_128_ld_128_128_2,Gemm_Hipblaslt_1284,0.0118504
GemmAndBiasTunableOp_float_TN,tn_4_417_128_ld_128_128_4,Gemm_Hipblaslt_1284,0.0117762
GemmAndBiasTunableOp_float_TN,tn_128_484_576_ld_576_576_128,Gemm_Hipblaslt_1285,0.0389932
GemmAndBiasTunableOp_float_TN,tn_2_484_128_ld_128_128_2,Gemm_Hipblaslt_1286,0.0103916
GemmAndBiasTunableOp_float_TN,tn_4_484_128_ld_128_128_4,Gemm_Hipblaslt_1284,0.0103031
GemmAndBiasTunableOp_float_TN,tn_256_73_1152_ld_1152_1152_256,Gemm_Hipblaslt_1284,0.039734
GemmAndBiasTunableOp_float_TN,tn_2_73_256_ld_256_256_2,Gemm_Hipblaslt_1286,0.0133014
GemmAndBiasTunableOp_float_TN,tn_4_73_256_ld_256_256_4,Gemm_Hipblaslt_1286,0.0133332
GemmAndBiasTunableOp_float_TN,tn_10_73_256_ld_256_256_10,Gemm_Hipblaslt_1286,0.0128766
GemmAndBiasTunableOp_float_TN,tn_128_386_576_ld_576_576_128,Gemm_Hipblaslt_1285,0.0330074
GemmAndBiasTunableOp_float_TN,tn_2_386_128_ld_128_128_2,Gemm_Hipblaslt_1284,0.0115141
GemmAndBiasTunableOp_float_TN,tn_4_386_128_ld_128_128_4,Gemm_Hipblaslt_1284,0.0109963
GemmAndBiasTunableOp_float_TN,tn_128_353_576_ld_576_576_128,Gemm_Hipblaslt_1285,0.0318853
GemmAndBiasTunableOp_float_TN,tn_2_353_128_ld_128_128_2,Gemm_Hipblaslt_1284,0.011236
GemmAndBiasTunableOp_float_TN,tn_4_353_128_ld_128_128_4,Gemm_Hipblaslt_1284,0.0110969
GemmAndBiasTunableOp_float_TN,tn_128_321_576_ld_576_576_128,Gemm_Hipblaslt_1285,0.0296002
GemmAndBiasTunableOp_float_TN,tn_2_321_128_ld_128_128_2,Gemm_Hipblaslt_1284,0.0110083
GemmAndBiasTunableOp_float_TN,tn_4_321_128_ld_128_128_4,Gemm_Hipblaslt_1284,0.0113374
GemmAndBiasTunableOp_float_TN,tn_128_465_576_ld_576_576_128,Gemm_Hipblaslt_1284,0.183132
GemmAndBiasTunableOp_float_TN,tn_2_465_128_ld_128_128_2,Gemm_Hipblaslt_1284,0.0347896
GemmAndBiasTunableOp_float_TN,tn_4_465_128_ld_128_128_4,Gemm_Hipblaslt_1285,0.0349322
GemmAndBiasTunableOp_float_TN,tn_128_363_576_ld_576_576_128,Gemm_Hipblaslt_1285,0.0316617
GemmAndBiasTunableOp_float_TN,tn_2_363_128_ld_128_128_2,Gemm_Hipblaslt_1286,0.0102125
GemmAndBiasTunableOp_float_TN,tn_4_363_128_ld_128_128_4,Gemm_Hipblaslt_1286,0.0102297
GemmAndBiasTunableOp_float_TN,tn_128_482_576_ld_576_576_128,Gemm_Hipblaslt_1285,0.0391462
GemmAndBiasTunableOp_float_TN,tn_2_482_128_ld_128_128_2,Gemm_Hipblaslt_1286,0.0103026
GemmAndBiasTunableOp_float_TN,tn_4_482_128_ld_128_128_4,Gemm_Hipblaslt_1286,0.0103631
GemmAndBiasTunableOp_float_TN,tn_256_43_1152_ld_1152_1152_256,Gemm_Hipblaslt_1284,0.034271
GemmAndBiasTunableOp_float_TN,tn_2_43_256_ld_256_256_2,Gemm_Hipblaslt_1286,0.0129512
GemmAndBiasTunableOp_float_TN,tn_4_43_256_ld_256_256_4,Gemm_Hipblaslt_1286,0.0130345
GemmAndBiasTunableOp_float_TN,tn_10_43_256_ld_256_256_10,Gemm_Hipblaslt_1286,0.0126559
GemmAndBiasTunableOp_float_TN,tn_128_248_576_ld_576_576_128,Gemm_Hipblaslt_1285,0.0255253
GemmAndBiasTunableOp_float_TN,tn_2_248_128_ld_128_128_2,Gemm_Hipblaslt_1286,0.0102256
GemmAndBiasTunableOp_float_TN,tn_4_248_128_ld_128_128_4,Gemm_Hipblaslt_1286,0.0101279
GemmAndBiasTunableOp_float_TN,tn_128_456_576_ld_576_576_128,Gemm_Hipblaslt_1285,0.0375007
GemmAndBiasTunableOp_float_TN,tn_2_456_128_ld_128_128_2,Gemm_Hipblaslt_1286,0.0102998
GemmAndBiasTunableOp_float_TN,tn_4_456_128_ld_128_128_4,Gemm_Hipblaslt_1286,0.0102457
GemmAndBiasTunableOp_float_TN,tn_128_350_576_ld_576_576_128,Gemm_Hipblaslt_1285,0.0304775
GemmAndBiasTunableOp_float_TN,tn_2_350_128_ld_128_128_2,Gemm_Hipblaslt_1286,0.0101796
GemmAndBiasTunableOp_float_TN,tn_4_350_128_ld_128_128_4,Gemm_Hipblaslt_1286,0.0102233
GemmAndBiasTunableOp_float_TN,tn_128_499_576_ld_576_576_128,Gemm_Hipblaslt_1285,0.0395653
GemmAndBiasTunableOp_float_TN,tn_2_499_128_ld_128_128_2,Gemm_Hipblaslt_1286,0.0103563
GemmAndBiasTunableOp_float_TN,tn_4_499_128_ld_128_128_4,Gemm_Hipblaslt_1286,0.0102477
GemmAndBiasTunableOp_float_TN,tn_128_297_576_ld_576_576_128,Gemm_Hipblaslt_1285,0.027374
GemmAndBiasTunableOp_float_TN,tn_2_297_128_ld_128_128_2,Gemm_Hipblaslt_1286,0.0102669
GemmAndBiasTunableOp_float_TN,tn_4_297_128_ld_128_128_4,Gemm_Hipblaslt_1286,0.010277
GemmAndBiasTunableOp_float_TN,tn_256_77_1152_ld_1152_1152_256,Gemm_Hipblaslt_1284,0.039375
GemmAndBiasTunableOp_float_TN,tn_2_77_256_ld_256_256_2,Gemm_Hipblaslt_1286,0.0128542
GemmAndBiasTunableOp_float_TN,tn_4_77_256_ld_256_256_4,Gemm_Hipblaslt_1286,0.0128322
GemmAndBiasTunableOp_float_TN,tn_10_77_256_ld_256_256_10,Gemm_Hipblaslt_1286,0.0128042
GemmAndBiasTunableOp_float_TN,tn_128_221_576_ld_576_576_128,Gemm_Hipblaslt_1285,0.0246292
GemmAndBiasTunableOp_float_TN,tn_2_221_128_ld_128_128_2,Gemm_Hipblaslt_1286,0.0102738
GemmAndBiasTunableOp_float_TN,tn_4_221_128_ld_128_128_4,Gemm_Hipblaslt_1286,0.0101604
GemmAndBiasTunableOp_float_TN,tn_128_436_576_ld_576_576_128,Gemm_Hipblaslt_1285,0.035477
GemmAndBiasTunableOp_float_TN,tn_2_436_128_ld_128_128_2,Gemm_Hipblaslt_1284,0.0116034
GemmAndBiasTunableOp_float_TN,tn_4_436_128_ld_128_128_4,Gemm_Hipblaslt_1284,0.0114636
GemmAndBiasTunableOp_float_TN,tn_128_393_576_ld_576_576_128,Gemm_Hipblaslt_1285,0.032345
GemmAndBiasTunableOp_float_TN,tn_2_393_128_ld_128_128_2,Gemm_Hipblaslt_1286,0.0102173
GemmAndBiasTunableOp_float_TN,tn_4_393_128_ld_128_128_4,Gemm_Hipblaslt_1286,0.0102742
GemmAndBiasTunableOp_float_TN,tn_128_463_576_ld_576_576_128,Gemm_Hipblaslt_1285,0.03585
GemmAndBiasTunableOp_float_TN,tn_2_463_128_ld_128_128_2,Gemm_Hipblaslt_1286,0.0103339
GemmAndBiasTunableOp_float_TN,tn_4_463_128_ld_128_128_4,Gemm_Hipblaslt_1284,0.0103119
GemmAndBiasTunableOp_float_TN,tn_128_181_576_ld_576_576_128,Gemm_Hipblaslt_1285,0.0254432
GemmAndBiasTunableOp_float_TN,tn_2_181_128_ld_128_128_2,Gemm_Hipblaslt_1286,0.0101277
GemmAndBiasTunableOp_float_TN,tn_4_181_128_ld_128_128_4,Gemm_Hipblaslt_1286,0.0102027
GemmAndBiasTunableOp_float_TN,tn_128_403_576_ld_576_576_128,Gemm_Hipblaslt_1285,0.0341622
GemmAndBiasTunableOp_float_TN,tn_2_403_128_ld_128_128_2,Gemm_Hipblaslt_1286,0.0101919
GemmAndBiasTunableOp_float_TN,tn_4_403_128_ld_128_128_4,Gemm_Hipblaslt_1286,0.0101682
GemmAndBiasTunableOp_float_TN,tn_128_421_576_ld_576_576_128,Gemm_Hipblaslt_1285,0.0338657
GemmAndBiasTunableOp_float_TN,tn_2_421_128_ld_128_128_2,Gemm_Hipblaslt_1286,0.0102816
GemmAndBiasTunableOp_float_TN,tn_4_421_128_ld_128_128_4,Gemm_Hipblaslt_1286,0.0102312
GemmAndBiasTunableOp_float_TN,tn_128_233_576_ld_576_576_128,Gemm_Hipblaslt_1285,0.0247623
GemmAndBiasTunableOp_float_TN,tn_2_233_128_ld_128_128_2,Gemm_Hipblaslt_1286,0.0102227
GemmAndBiasTunableOp_float_TN,tn_4_233_128_ld_128_128_4,Gemm_Hipblaslt_1286,0.010246
GemmAndBiasTunableOp_float_TN,tn_128_419_576_ld_576_576_128,Gemm_Hipblaslt_1285,0.0338858
GemmAndBiasTunableOp_float_TN,tn_2_419_128_ld_128_128_2,Gemm_Hipblaslt_1286,0.0103189
GemmAndBiasTunableOp_float_TN,tn_4_419_128_ld_128_128_4,Gemm_Hipblaslt_1286,0.0102343
GemmAndBiasTunableOp_float_TN,tn_128_145_576_ld_576_576_128,Gemm_Hipblaslt_1284,0.0229683
GemmAndBiasTunableOp_float_TN,tn_2_145_128_ld_128_128_2,Gemm_Hipblaslt_1286,0.0102135
GemmAndBiasTunableOp_float_TN,tn_4_145_128_ld_128_128_4,Gemm_Hipblaslt_1286,0.0101787
GemmAndBiasTunableOp_float_TN,tn_128_451_576_ld_576_576_128,Gemm_Hipblaslt_1285,0.0358884
GemmAndBiasTunableOp_float_TN,tn_2_451_128_ld_128_128_2,Gemm_Hipblaslt_1286,0.0101979
GemmAndBiasTunableOp_float_TN,tn_4_451_128_ld_128_128_4,Gemm_Hipblaslt_1286,0.010214
GemmAndBiasTunableOp_float_TN,tn_128_208_576_ld_576_576_128,Gemm_Hipblaslt_1285,0.0240855
GemmAndBiasTunableOp_float_TN,tn_2_208_128_ld_128_128_2,Gemm_Hipblaslt_1286,0.0102075
GemmAndBiasTunableOp_float_TN,tn_4_208_128_ld_128_128_4,Gemm_Hipblaslt_1286,0.0102256
GemmAndBiasTunableOp_float_TN,tn_128_446_576_ld_576_576_128,Gemm_Hipblaslt_1285,0.0352268
GemmAndBiasTunableOp_float_TN,tn_2_446_128_ld_128_128_2,Gemm_Hipblaslt_1286,0.0102637
GemmAndBiasTunableOp_float_TN,tn_4_446_128_ld_128_128_4,Gemm_Hipblaslt_1286,0.0102472
GemmAndBiasTunableOp_float_TN,tn_128_286_576_ld_576_576_128,Gemm_Hipblaslt_1285,0.0266396
GemmAndBiasTunableOp_float_TN,tn_2_286_128_ld_128_128_2,Gemm_Hipblaslt_1286,0.0101602
GemmAndBiasTunableOp_float_TN,tn_4_286_128_ld_128_128_4,Gemm_Hipblaslt_1286,0.0102449
GemmAndBiasTunableOp_float_TN,tn_128_429_576_ld_576_576_128,Gemm_Hipblaslt_1285,0.0345892
GemmAndBiasTunableOp_float_TN,tn_2_429_128_ld_128_128_2,Gemm_Hipblaslt_1286,0.0103634
GemmAndBiasTunableOp_float_TN,tn_4_429_128_ld_128_128_4,Gemm_Hipblaslt_1286,0.0102364
GemmAndBiasTunableOp_float_TN,tn_128_478_576_ld_576_576_128,Gemm_Hipblaslt_1285,0.036351
GemmAndBiasTunableOp_float_TN,tn_2_478_128_ld_128_128_2,Gemm_Hipblaslt_1286,0.0102805
GemmAndBiasTunableOp_float_TN,tn_4_478_128_ld_128_128_4,Gemm_Hipblaslt_1286,0.0102336
GemmAndBiasTunableOp_float_TN,tn_256_167_1152_ld_1152_1152_256,Gemm_Hipblaslt_1285,0.0523566
GemmAndBiasTunableOp_float_TN,tn_2_167_256_ld_256_256_2,Gemm_Hipblaslt_1286,0.0128906
GemmAndBiasTunableOp_float_TN,tn_4_167_256_ld_256_256_4,Gemm_Hipblaslt_1286,0.0127919
GemmAndBiasTunableOp_float_TN,tn_10_167_256_ld_256_256_10,Gemm_Hipblaslt_1286,0.0125572
GemmAndBiasTunableOp_float_TN,tn_256_285_1152_ld_1152_1152_256,Gemm_Hipblaslt_1285,0.0838493
GemmAndBiasTunableOp_float_TN,tn_2_285_256_ld_256_256_2,Gemm_Hipblaslt_1286,0.0132071
GemmAndBiasTunableOp_float_TN,tn_4_285_256_ld_256_256_4,Gemm_Hipblaslt_1286,0.0129402
GemmAndBiasTunableOp_float_TN,tn_10_285_256_ld_256_256_10,Gemm_Hipblaslt_1286,0.012816
GemmAndBiasTunableOp_float_TN,tn_128_498_576_ld_576_576_128,Gemm_Hipblaslt_1285,0.03876
GemmAndBiasTunableOp_float_TN,tn_2_498_128_ld_128_128_2,Gemm_Hipblaslt_1286,0.0103317
GemmAndBiasTunableOp_float_TN,tn_4_498_128_ld_128_128_4,Gemm_Hipblaslt_1286,0.0102272
GemmAndBiasTunableOp_float_TN,tn_256_53_1152_ld_1152_1152_256,Gemm_Hipblaslt_1284,0.0352197
GemmAndBiasTunableOp_float_TN,tn_2_53_256_ld_256_256_2,Gemm_Hipblaslt_1286,0.0129467
GemmAndBiasTunableOp_float_TN,tn_4_53_256_ld_256_256_4,Gemm_Hipblaslt_1286,0.0129824
GemmAndBiasTunableOp_float_TN,tn_10_53_256_ld_256_256_10,Gemm_Hipblaslt_1286,0.0125709
GemmAndBiasTunableOp_float_TN,tn_128_471_576_ld_576_576_128,Gemm_Hipblaslt_1285,0.0356333
GemmAndBiasTunableOp_float_TN,tn_2_471_128_ld_128_128_2,Gemm_Hipblaslt_1286,0.0103791
GemmAndBiasTunableOp_float_TN,tn_4_471_128_ld_128_128_4,Gemm_Hipblaslt_1286,0.0103434
GemmAndBiasTunableOp_float_TN,tn_256_32_1152_ld_1152_1152_256,Gemm_Hipblaslt_1284,0.0333538
GemmAndBiasTunableOp_float_TN,tn_2_32_256_ld_256_256_2,Gemm_Hipblaslt_1286,0.0130221
GemmAndBiasTunableOp_float_TN,tn_4_32_256_ld_256_256_4,Gemm_Hipblaslt_1286,0.0129083
GemmAndBiasTunableOp_float_TN,tn_10_32_256_ld_256_256_10,Gemm_Hipblaslt_1286,0.0126738
GemmAndBiasTunableOp_float_TN,tn_128_342_576_ld_576_576_128,Gemm_Hipblaslt_1285,0.0295142
GemmAndBiasTunableOp_float_TN,tn_2_342_128_ld_128_128_2,Gemm_Hipblaslt_1286,0.0101883
GemmAndBiasTunableOp_float_TN,tn_4_342_128_ld_128_128_4,Gemm_Hipblaslt_1286,0.0102096
GemmAndBiasTunableOp_float_TN,tn_256_78_1152_ld_1152_1152_256,Gemm_Hipblaslt_1284,0.0394533
GemmAndBiasTunableOp_float_TN,tn_2_78_256_ld_256_256_2,Gemm_Hipblaslt_1286,0.0128486
GemmAndBiasTunableOp_float_TN,tn_4_78_256_ld_256_256_4,Gemm_Hipblaslt_1286,0.0128489
GemmAndBiasTunableOp_float_TN,tn_10_78_256_ld_256_256_10,Gemm_Hipblaslt_1286,0.0124766
GemmAndBiasTunableOp_float_TN,tn_256_86_1152_ld_1152_1152_256,Gemm_Hipblaslt_1285,0.0415337
GemmAndBiasTunableOp_float_TN,tn_2_86_256_ld_256_256_2,Gemm_Hipblaslt_1286,0.0128157
GemmAndBiasTunableOp_float_TN,tn_4_86_256_ld_256_256_4,Gemm_Hipblaslt_1286,0.0129111
GemmAndBiasTunableOp_float_TN,tn_10_86_256_ld_256_256_10,Gemm_Hipblaslt_1286,0.0125283
GemmAndBiasTunableOp_float_TN,tn_128_385_576_ld_576_576_128,Gemm_Hipblaslt_1284,0.0995498
GemmAndBiasTunableOp_float_TN,tn_2_385_128_ld_128_128_2,Gemm_Hipblaslt_1285,0.0304272
GemmAndBiasTunableOp_float_TN,tn_4_385_128_ld_128_128_4,Gemm_Hipblaslt_1286,0.0368544
GemmAndBiasTunableOp_float_TN,tn_128_389_576_ld_576_576_128,Gemm_Hipblaslt_1285,0.031946
GemmAndBiasTunableOp_float_TN,tn_2_389_128_ld_128_128_2,Gemm_Hipblaslt_1286,0.0102869
GemmAndBiasTunableOp_float_TN,tn_4_389_128_ld_128_128_4,Gemm_Hipblaslt_1286,0.0101699
GemmAndBiasTunableOp_float_TN,tn_256_80_1152_ld_1152_1152_256,Gemm_Hipblaslt_1284,0.0392229
GemmAndBiasTunableOp_float_TN,tn_2_80_256_ld_256_256_2,Gemm_Hipblaslt_1286,0.0128245
GemmAndBiasTunableOp_float_TN,tn_4_80_256_ld_256_256_4,Gemm_Hipblaslt_1286,0.0128116
GemmAndBiasTunableOp_float_TN,tn_10_80_256_ld_256_256_10,Gemm_Hipblaslt_1286,0.0125764
GemmAndBiasTunableOp_float_TN,tn_256_52_1152_ld_1152_1152_256,Gemm_Hipblaslt_1284,0.0351836
GemmAndBiasTunableOp_float_TN,tn_2_52_256_ld_256_256_2,Gemm_Hipblaslt_1286,0.0129463
GemmAndBiasTunableOp_float_TN,tn_4_52_256_ld_256_256_4,Gemm_Hipblaslt_1286,0.0129956
GemmAndBiasTunableOp_float_TN,tn_10_52_256_ld_256_256_10,Gemm_Hipblaslt_1286,0.0126194
GemmAndBiasTunableOp_float_TN,tn_128_293_576_ld_576_576_128,Gemm_Hipblaslt_1285,0.0270556
GemmAndBiasTunableOp_float_TN,tn_2_293_128_ld_128_128_2,Gemm_Hipblaslt_1286,0.0102003
GemmAndBiasTunableOp_float_TN,tn_4_293_128_ld_128_128_4,Gemm_Hipblaslt_1286,0.0102604
GemmAndBiasTunableOp_float_TN,tn_128_442_576_ld_576_576_128,Gemm_Hipblaslt_1285,0.0352871
GemmAndBiasTunableOp_float_TN,tn_2_442_128_ld_128_128_2,Gemm_Hipblaslt_1284,0.0102533
GemmAndBiasTunableOp_float_TN,tn_4_442_128_ld_128_128_4,Gemm_Hipblaslt_1286,0.0102228
GemmAndBiasTunableOp_float_TN,tn_128_281_576_ld_576_576_128,Gemm_Hipblaslt_1285,0.0267744
GemmAndBiasTunableOp_float_TN,tn_2_281_128_ld_128_128_2,Gemm_Hipblaslt_1286,0.010224
GemmAndBiasTunableOp_float_TN,tn_4_281_128_ld_128_128_4,Gemm_Hipblaslt_1286,0.0102248
GemmAndBiasTunableOp_float_TN,tn_128_372_576_ld_576_576_128,Gemm_Hipblaslt_1285,0.0319781
GemmAndBiasTunableOp_float_TN,tn_2_372_128_ld_128_128_2,Gemm_Hipblaslt_1286,0.0103091
GemmAndBiasTunableOp_float_TN,tn_4_372_128_ld_128_128_4,Gemm_Hipblaslt_1286,0.0102732
GemmAndBiasTunableOp_float_TN,tn_128_298_576_ld_576_576_128,Gemm_Hipblaslt_1285,0.0269619
GemmAndBiasTunableOp_float_TN,tn_2_298_128_ld_128_128_2,Gemm_Hipblaslt_1286,0.0101927
GemmAndBiasTunableOp_float_TN,tn_4_298_128_ld_128_128_4,Gemm_Hipblaslt_1286,0.0102152
GemmAndBiasTunableOp_float_TN,tn_256_84_1152_ld_1152_1152_256,Gemm_Hipblaslt_1285,0.0415733
GemmAndBiasTunableOp_float_TN,tn_2_84_256_ld_256_256_2,Gemm_Hipblaslt_1286,0.0128341
GemmAndBiasTunableOp_float_TN,tn_4_84_256_ld_256_256_4,Gemm_Hipblaslt_1286,0.0131912
GemmAndBiasTunableOp_float_TN,tn_10_84_256_ld_256_256_10,Gemm_Hipblaslt_1286,0.0124899
GemmAndBiasTunableOp_float_TN,tn_128_468_576_ld_576_576_128,Gemm_Hipblaslt_1285,0.0359283
GemmAndBiasTunableOp_float_TN,tn_2_468_128_ld_128_128_2,Gemm_Hipblaslt_1286,0.010291
GemmAndBiasTunableOp_float_TN,tn_4_468_128_ld_128_128_4,Gemm_Hipblaslt_1286,0.0102921
GemmAndBiasTunableOp_float_TN,tn_128_396_576_ld_576_576_128,Gemm_Hipblaslt_1285,0.031193
GemmAndBiasTunableOp_float_TN,tn_2_396_128_ld_128_128_2,Gemm_Hipblaslt_1286,0.0102805
GemmAndBiasTunableOp_float_TN,tn_4_396_128_ld_128_128_4,Gemm_Hipblaslt_1286,0.0101768
GemmAndBiasTunableOp_float_TN,tn_128_472_576_ld_576_576_128,Gemm_Hipblaslt_1285,0.0355472
GemmAndBiasTunableOp_float_TN,tn_2_472_128_ld_128_128_2,Gemm_Hipblaslt_1286,0.0103683
GemmAndBiasTunableOp_float_TN,tn_4_472_128_ld_128_128_4,Gemm_Hipblaslt_1286,0.0102124
GemmAndBiasTunableOp_float_TN,tn_128_387_576_ld_576_576_128,Gemm_Hipblaslt_1287,0.080964
GemmAndBiasTunableOp_float_TN,tn_2_387_128_ld_128_128_2,Gemm_Hipblaslt_1286,0.0425368
GemmAndBiasTunableOp_float_TN,tn_4_387_128_ld_128_128_4,Gemm_Hipblaslt_1285,0.0393208
GemmAndBiasTunableOp_float_TN,tn_128_511_576_ld_576_576_128,Gemm_Hipblaslt_1287,0.132344
GemmAndBiasTunableOp_float_TN,tn_2_511_128_ld_128_128_2,Gemm_Hipblaslt_1286,0.038002
GemmAndBiasTunableOp_float_TN,tn_4_511_128_ld_128_128_4,Gemm_Hipblaslt_1285,0.0502121
GemmAndBiasTunableOp_float_TN,tn_128_402_576_ld_576_576_128,Gemm_Hipblaslt_1286,0.236069
GemmAndBiasTunableOp_float_TN,tn_2_402_128_ld_128_128_2,Gemm_Hipblaslt_1286,0.0705371
GemmAndBiasTunableOp_float_TN,tn_4_402_128_ld_128_128_4,Gemm_Hipblaslt_1286,0.0516993
GemmAndBiasTunableOp_float_TN,tn_128_352_576_ld_576_576_128,Gemm_Hipblaslt_1287,0.104598
GemmAndBiasTunableOp_float_TN,tn_2_352_128_ld_128_128_2,Gemm_Hipblaslt_1286,0.0254467
GemmAndBiasTunableOp_float_TN,tn_4_352_128_ld_128_128_4,Gemm_Hipblaslt_1287,0.0489562
GemmAndBiasTunableOp_float_TN,tn_128_309_576_ld_576_576_128,Gemm_Hipblaslt_1287,0.0902928
GemmAndBiasTunableOp_float_TN,tn_2_309_128_ld_128_128_2,Gemm_Hipblaslt_1287,0.0258214
GemmAndBiasTunableOp_float_TN,tn_4_309_128_ld_128_128_4,Gemm_Hipblaslt_1287,0.0504878
GemmAndBiasTunableOp_float_TN,tn_128_497_576_ld_576_576_128,Gemm_Hipblaslt_1286,0.133108
GemmAndBiasTunableOp_float_TN,tn_2_497_128_ld_128_128_2,Gemm_Hipblaslt_1287,0.0228482
GemmAndBiasTunableOp_float_TN,tn_4_497_128_ld_128_128_4,Gemm_Hipblaslt_1286,0.0593406
GemmAndBiasTunableOp_float_TN,tn_256_274_1152_ld_1152_1152_256,Gemm_Hipblaslt_1284,0.183301
GemmAndBiasTunableOp_float_TN,tn_2_274_256_ld_256_256_2,Gemm_Hipblaslt_1286,0.0525674
GemmAndBiasTunableOp_float_TN,tn_4_274_256_ld_256_256_4,Gemm_Hipblaslt_1286,0.0709765
GemmAndBiasTunableOp_float_TN,tn_10_274_256_ld_256_256_10,Gemm_Hipblaslt_1285,0.0325448
GemmAndBiasTunableOp_float_TN,tn_128_320_576_ld_576_576_128,Gemm_Hipblaslt_1287,0.0902127
GemmAndBiasTunableOp_float_TN,tn_2_320_128_ld_128_128_2,Gemm_Hipblaslt_1286,0.034711
GemmAndBiasTunableOp_float_TN,tn_4_320_128_ld_128_128_4,Gemm_Hipblaslt_1286,0.0328354
GemmAndBiasTunableOp_float_TN,tn_128_312_576_ld_576_576_128,Gemm_Hipblaslt_1287,0.0419165
GemmAndBiasTunableOp_float_TN,tn_2_312_128_ld_128_128_2,Gemm_Hipblaslt_1286,0.0134845
GemmAndBiasTunableOp_float_TN,tn_4_312_128_ld_128_128_4,Gemm_Hipblaslt_1286,0.0136469
GemmAndBiasTunableOp_float_TN,tn_128_434_576_ld_576_576_128,Gemm_Hipblaslt_1287,0.0478325
GemmAndBiasTunableOp_float_TN,tn_2_434_128_ld_128_128_2,Gemm_Hipblaslt_1286,0.0127673
GemmAndBiasTunableOp_float_TN,tn_4_434_128_ld_128_128_4,Gemm_Hipblaslt_1286,0.012191
GemmAndBiasTunableOp_float_TN,tn_256_181_1152_ld_1152_1152_256,Gemm_Hipblaslt_1287,0.0779692
GemmAndBiasTunableOp_float_TN,tn_2_181_256_ld_256_256_2,Gemm_Hipblaslt_1286,0.0170593
GemmAndBiasTunableOp_float_TN,tn_4_181_256_ld_256_256_4,Gemm_Hipblaslt_1286,0.0170581
GemmAndBiasTunableOp_float_TN,tn_10_181_256_ld_256_256_10,Gemm_Hipblaslt_1286,0.0184384
GemmAndBiasTunableOp_float_TN,tn_128_379_576_ld_576_576_128,Gemm_Hipblaslt_1285,0.0312625
GemmAndBiasTunableOp_float_TN,tn_2_379_128_ld_128_128_2,Gemm_Hipblaslt_1284,0.0103374
GemmAndBiasTunableOp_float_TN,tn_4_379_128_ld_128_128_4,Gemm_Hipblaslt_1286,0.0102637
GemmAndBiasTunableOp_float_TN,tn_128_290_576_ld_576_576_128,Gemm_Hipblaslt_1285,0.0297147
GemmAndBiasTunableOp_float_TN,tn_2_290_128_ld_128_128_2,Gemm_Hipblaslt_1286,0.0102193
GemmAndBiasTunableOp_float_TN,tn_4_290_128_ld_128_128_4,Gemm_Hipblaslt_1286,0.0102994
GemmAndBiasTunableOp_float_TN,tn_256_57_1152_ld_1152_1152_256,Gemm_Hipblaslt_1284,0.0364503
GemmAndBiasTunableOp_float_TN,tn_2_57_256_ld_256_256_2,Gemm_Hipblaslt_1286,0.0129949
GemmAndBiasTunableOp_float_TN,tn_4_57_256_ld_256_256_4,Gemm_Hipblaslt_1286,0.0129897
GemmAndBiasTunableOp_float_TN,tn_10_57_256_ld_256_256_10,Gemm_Hipblaslt_1284,0.0127468
GemmAndBiasTunableOp_float_TN,tn_128_432_576_ld_576_576_128,Gemm_Hipblaslt_1285,0.0336498
GemmAndBiasTunableOp_float_TN,tn_2_432_128_ld_128_128_2,Gemm_Hipblaslt_1284,0.0115558
GemmAndBiasTunableOp_float_TN,tn_4_432_128_ld_128_128_4,Gemm_Hipblaslt_1286,0.0115938
GemmAndBiasTunableOp_float_TN,tn_128_380_576_ld_576_576_128,Gemm_Hipblaslt_1285,0.0336417
GemmAndBiasTunableOp_float_TN,tn_2_380_128_ld_128_128_2,Gemm_Hipblaslt_1286,0.0105615
GemmAndBiasTunableOp_float_TN,tn_4_380_128_ld_128_128_4,Gemm_Hipblaslt_1284,0.0104465
GemmAndBiasTunableOp_float_TN,tn_128_360_576_ld_576_576_128,Gemm_Hipblaslt_1285,0.0321999
GemmAndBiasTunableOp_float_TN,tn_2_360_128_ld_128_128_2,Gemm_Hipblaslt_1284,0.0112664
GemmAndBiasTunableOp_float_TN,tn_4_360_128_ld_128_128_4,Gemm_Hipblaslt_1284,0.0113001
GemmAndBiasTunableOp_float_TN,tn_128_487_576_ld_576_576_128,Gemm_Hipblaslt_1285,0.042997
GemmAndBiasTunableOp_float_TN,tn_2_487_128_ld_128_128_2,Gemm_Hipblaslt_1286,0.0120131
GemmAndBiasTunableOp_float_TN,tn_4_487_128_ld_128_128_4,Gemm_Hipblaslt_1286,0.0119625
GemmAndBiasTunableOp_float_TN,tn_128_420_576_ld_576_576_128,Gemm_Hipblaslt_1285,0.0416845
GemmAndBiasTunableOp_float_TN,tn_2_420_128_ld_128_128_2,Gemm_Hipblaslt_1286,0.0115389
GemmAndBiasTunableOp_float_TN,tn_4_420_128_ld_128_128_4,Gemm_Hipblaslt_1286,0.0117506
GemmAndBiasTunableOp_float_TN,tn_128_493_576_ld_576_576_128,Gemm_Hipblaslt_1285,0.0437212
GemmAndBiasTunableOp_float_TN,tn_2_493_128_ld_128_128_2,Gemm_Hipblaslt_1284,0.0120863
GemmAndBiasTunableOp_float_TN,tn_4_493_128_ld_128_128_4,Gemm_Hipblaslt_1284,0.0118299
GemmAndBiasTunableOp_float_TN,tn_256_48_1152_ld_1152_1152_256,Gemm_Hipblaslt_1284,0.0343668
GemmAndBiasTunableOp_float_TN,tn_2_48_256_ld_256_256_2,Gemm_Hipblaslt_1286,0.0132181
GemmAndBiasTunableOp_float_TN,tn_4_48_256_ld_256_256_4,Gemm_Hipblaslt_1286,0.0132181
GemmAndBiasTunableOp_float_TN,tn_10_48_256_ld_256_256_10,Gemm_Hipblaslt_1286,0.0129424
GemmAndBiasTunableOp_float_TN,tn_128_376_576_ld_576_576_128,Gemm_Hipblaslt_1285,0.0393766
GemmAndBiasTunableOp_float_TN,tn_2_376_128_ld_128_128_2,Gemm_Hipblaslt_1284,0.011452
GemmAndBiasTunableOp_float_TN,tn_4_376_128_ld_128_128_4,Gemm_Hipblaslt_1284,0.0113473
GemmAndBiasTunableOp_float_TN,tn_256_49_1152_ld_1152_1152_256,Gemm_Hipblaslt_1284,0.0353354
GemmAndBiasTunableOp_float_TN,tn_2_49_256_ld_256_256_2,Gemm_Hipblaslt_1286,0.0131111
GemmAndBiasTunableOp_float_TN,tn_4_49_256_ld_256_256_4,Gemm_Hipblaslt_1286,0.0130683
GemmAndBiasTunableOp_float_TN,tn_10_49_256_ld_256_256_10,Gemm_Hipblaslt_1286,0.0128567
GemmAndBiasTunableOp_float_TN,tn_128_374_576_ld_576_576_128,Gemm_Hipblaslt_1285,0.030873
GemmAndBiasTunableOp_float_TN,tn_2_374_128_ld_128_128_2,Gemm_Hipblaslt_1286,0.0102745
GemmAndBiasTunableOp_float_TN,tn_4_374_128_ld_128_128_4,Gemm_Hipblaslt_1286,0.0102453
GemmAndBiasTunableOp_float_TN,tn_128_366_576_ld_576_576_128,Gemm_Hipblaslt_1287,0.103533
GemmAndBiasTunableOp_float_TN,tn_2_366_128_ld_128_128_2,Gemm_Hipblaslt_1284,0.0225878
GemmAndBiasTunableOp_float_TN,tn_4_366_128_ld_128_128_4,Gemm_Hipblaslt_1286,0.077116
GemmAndBiasTunableOp_float_TN,tn_128_390_576_ld_576_576_128,Gemm_Hipblaslt_1287,0.107325
GemmAndBiasTunableOp_float_TN,tn_2_390_128_ld_128_128_2,Gemm_Hipblaslt_1286,0.0399741
GemmAndBiasTunableOp_float_TN,tn_4_390_128_ld_128_128_4,Gemm_Hipblaslt_1286,0.0456628
GemmAndBiasTunableOp_float_TN,tn_128_319_576_ld_576_576_128,Gemm_Hipblaslt_1285,0.0308785
GemmAndBiasTunableOp_float_TN,tn_2_319_128_ld_128_128_2,Gemm_Hipblaslt_1286,0.0101868
GemmAndBiasTunableOp_float_TN,tn_4_319_128_ld_128_128_4,Gemm_Hipblaslt_1284,0.0102537
GemmAndBiasTunableOp_float_TN,tn_128_276_576_ld_576_576_128,Gemm_Hipblaslt_1285,0.0269584
GemmAndBiasTunableOp_float_TN,tn_2_276_128_ld_128_128_2,Gemm_Hipblaslt_1286,0.0102758
GemmAndBiasTunableOp_float_TN,tn_4_276_128_ld_128_128_4,Gemm_Hipblaslt_1286,0.0101812
GemmAndBiasTunableOp_float_TN,tn_128_450_576_ld_576_576_128,Gemm_Hipblaslt_1285,0.0929947
GemmAndBiasTunableOp_float_TN,tn_2_450_128_ld_128_128_2,Gemm_Hipblaslt_1286,0.0355305
GemmAndBiasTunableOp_float_TN,tn_4_450_128_ld_128_128_4,Gemm_Hipblaslt_1286,0.0386665
GemmAndBiasTunableOp_float_TN,tn_128_435_576_ld_576_576_128,Gemm_Hipblaslt_1286,0.114475
GemmAndBiasTunableOp_float_TN,tn_2_435_128_ld_128_128_2,Gemm_Hipblaslt_1287,0.0266531
GemmAndBiasTunableOp_float_TN,tn_4_435_128_ld_128_128_4,Gemm_Hipblaslt_1286,0.0314577
GemmAndBiasTunableOp_float_TN,tn_128_426_576_ld_576_576_128,Gemm_Hipblaslt_1285,0.084571
GemmAndBiasTunableOp_float_TN,tn_2_426_128_ld_128_128_2,Gemm_Hipblaslt_1286,0.0347225
GemmAndBiasTunableOp_float_TN,tn_4_426_128_ld_128_128_4,Gemm_Hipblaslt_1286,0.0355652
GemmAndBiasTunableOp_float_TN,tn_128_323_576_ld_576_576_128,Gemm_Hipblaslt_1285,0.0310186
GemmAndBiasTunableOp_float_TN,tn_2_323_128_ld_128_128_2,Gemm_Hipblaslt_1287,0.0174988
GemmAndBiasTunableOp_float_TN,tn_4_323_128_ld_128_128_4,Gemm_Hipblaslt_1284,0.0159316
GemmAndBiasTunableOp_float_TN,tn_128_398_576_ld_576_576_128,Gemm_Hipblaslt_1285,0.0316448
GemmAndBiasTunableOp_float_TN,tn_2_398_128_ld_128_128_2,Gemm_Hipblaslt_1285,0.0154724
GemmAndBiasTunableOp_float_TN,tn_4_398_128_ld_128_128_4,Gemm_Hipblaslt_1287,0.0165263
GemmAndBiasTunableOp_float_TN,tn_256_63_1152_ld_1152_1152_256,Gemm_Hipblaslt_1284,0.0356658
GemmAndBiasTunableOp_float_TN,tn_2_63_256_ld_256_256_2,Gemm_Hipblaslt_1286,0.0131203
GemmAndBiasTunableOp_float_TN,tn_4_63_256_ld_256_256_4,Gemm_Hipblaslt_1287,0.0190373
GemmAndBiasTunableOp_float_TN,tn_10_63_256_ld_256_256_10,Gemm_Hipblaslt_1286,0.0173291
GemmAndBiasTunableOp_float_TN,tn_256_130_1152_ld_1152_1152_256,Gemm_Hipblaslt_1285,0.0466141
GemmAndBiasTunableOp_float_TN,tn_2_130_256_ld_256_256_2,Gemm_Hipblaslt_1286,0.015593
GemmAndBiasTunableOp_float_TN,tn_4_130_256_ld_256_256_4,Gemm_Hipblaslt_1284,0.0165638
GemmAndBiasTunableOp_float_TN,tn_10_130_256_ld_256_256_10,Gemm_Hipblaslt_1284,0.0156566
GemmAndBiasTunableOp_float_TN,tn_128_457_576_ld_576_576_128,Gemm_Hipblaslt_1285,0.0356854
GemmAndBiasTunableOp_float_TN,tn_2_457_128_ld_128_128_2,Gemm_Hipblaslt_1287,0.0183333
GemmAndBiasTunableOp_float_TN,tn_4_457_128_ld_128_128_4,Gemm_Hipblaslt_1287,0.0176833
GemmAndBiasTunableOp_float_TN,tn_256_62_1152_ld_1152_1152_256,Gemm_Hipblaslt_1284,0.0357312
GemmAndBiasTunableOp_float_TN,tn_2_62_256_ld_256_256_2,Gemm_Hipblaslt_1285,0.0185093
GemmAndBiasTunableOp_float_TN,tn_4_62_256_ld_256_256_4,Gemm_Hipblaslt_1287,0.0192223
GemmAndBiasTunableOp_float_TN,tn_10_62_256_ld_256_256_10,Gemm_Hipblaslt_1286,0.0162048
GemmAndBiasTunableOp_float_TN,tn_128_459_576_ld_576_576_128,Gemm_Hipblaslt_1285,0.0355635
GemmAndBiasTunableOp_float_TN,tn_2_459_128_ld_128_128_2,Gemm_Hipblaslt_1285,0.0124174
GemmAndBiasTunableOp_float_TN,tn_4_459_128_ld_128_128_4,Gemm_Hipblaslt_1287,0.0156057
GemmAndBiasTunableOp_float_TN,tn_128_438_576_ld_576_576_128,Gemm_Hipblaslt_1285,0.0356167
GemmAndBiasTunableOp_float_TN,tn_2_438_128_ld_128_128_2,Gemm_Hipblaslt_1285,0.0148336
GemmAndBiasTunableOp_float_TN,tn_4_438_128_ld_128_128_4,Gemm_Hipblaslt_1287,0.0168673
GemmAndBiasTunableOp_float_TN,tn_128_428_576_ld_576_576_128,Gemm_Hipblaslt_1285,0.0339754
GemmAndBiasTunableOp_float_TN,tn_2_428_128_ld_128_128_2,Gemm_Hipblaslt_1286,0.0124939
GemmAndBiasTunableOp_float_TN,tn_4_428_128_ld_128_128_4,Gemm_Hipblaslt_1287,0.0173535
GemmAndBiasTunableOp_float_TN,tn_128_414_576_ld_576_576_128,Gemm_Hipblaslt_1285,0.0350999
GemmAndBiasTunableOp_float_TN,tn_2_414_128_ld_128_128_2,Gemm_Hipblaslt_1286,0.0131987
GemmAndBiasTunableOp_float_TN,tn_4_414_128_ld_128_128_4,Gemm_Hipblaslt_1287,0.0166397
GemmAndBiasTunableOp_float_TN,tn_256_94_1152_ld_1152_1152_256,Gemm_Hipblaslt_1285,0.0413009
GemmAndBiasTunableOp_float_TN,tn_2_94_256_ld_256_256_2,Gemm_Hipblaslt_1287,0.0154599
GemmAndBiasTunableOp_float_TN,tn_4_94_256_ld_256_256_4,Gemm_Hipblaslt_1287,0.0180019
GemmAndBiasTunableOp_float_TN,tn_10_94_256_ld_256_256_10,Gemm_Hipblaslt_1284,0.0173877
GemmAndBiasTunableOp_float_TN,tn_256_141_1152_ld_1152_1152_256,Gemm_Hipblaslt_1285,0.0466104
GemmAndBiasTunableOp_float_TN,tn_2_141_256_ld_256_256_2,Gemm_Hipblaslt_1286,0.0147792
GemmAndBiasTunableOp_float_TN,tn_4_141_256_ld_256_256_4,Gemm_Hipblaslt_1287,0.0181421
GemmAndBiasTunableOp_float_TN,tn_10_141_256_ld_256_256_10,Gemm_Hipblaslt_1287,0.0194278
GemmAndBiasTunableOp_float_TN,tn_256_75_1152_ld_1152_1152_256,Gemm_Hipblaslt_1284,0.0390076
GemmAndBiasTunableOp_float_TN,tn_2_75_256_ld_256_256_2,Gemm_Hipblaslt_1284,0.0170471
GemmAndBiasTunableOp_float_TN,tn_4_75_256_ld_256_256_4,Gemm_Hipblaslt_1286,0.0173137
GemmAndBiasTunableOp_float_TN,tn_10_75_256_ld_256_256_10,Gemm_Hipblaslt_1287,0.0162411
GemmAndBiasTunableOp_float_TN,tn_128_332_576_ld_576_576_128,Gemm_Hipblaslt_1285,0.0295602
GemmAndBiasTunableOp_float_TN,tn_2_332_128_ld_128_128_2,Gemm_Hipblaslt_1287,0.0172592
GemmAndBiasTunableOp_float_TN,tn_4_332_128_ld_128_128_4,Gemm_Hipblaslt_1287,0.0169772
GemmAndBiasTunableOp_float_TN,tn_128_452_576_ld_576_576_128,Gemm_Hipblaslt_1285,0.0382458
GemmAndBiasTunableOp_float_TN,tn_2_452_128_ld_128_128_2,Gemm_Hipblaslt_1286,0.0133914
GemmAndBiasTunableOp_float_TN,tn_4_452_128_ld_128_128_4,Gemm_Hipblaslt_1287,0.0176651
GemmAndBiasTunableOp_float_TN,tn_256_123_1152_ld_1152_1152_256,Gemm_Hipblaslt_1285,0.0446124
GemmAndBiasTunableOp_float_TN,tn_2_123_256_ld_256_256_2,Gemm_Hipblaslt_1285,0.0150173
GemmAndBiasTunableOp_float_TN,tn_4_123_256_ld_256_256_4,Gemm_Hipblaslt_1286,0.0183357
GemmAndBiasTunableOp_float_TN,tn_10_123_256_ld_256_256_10,Gemm_Hipblaslt_1287,0.0155676
GemmAndBiasTunableOp_float_TN,tn_256_60_1152_ld_1152_1152_256,Gemm_Hipblaslt_1284,0.0358484
GemmAndBiasTunableOp_float_TN,tn_2_60_256_ld_256_256_2,Gemm_Hipblaslt_1284,0.0156026
GemmAndBiasTunableOp_float_TN,tn_4_60_256_ld_256_256_4,Gemm_Hipblaslt_1284,0.0178467
GemmAndBiasTunableOp_float_TN,tn_10_60_256_ld_256_256_10,Gemm_Hipblaslt_1287,0.0157015
GemmAndBiasTunableOp_float_TN,tn_128_441_576_ld_576_576_128,Gemm_Hipblaslt_1285,0.0352371
GemmAndBiasTunableOp_float_TN,tn_2_441_128_ld_128_128_2,Gemm_Hipblaslt_1285,0.0132044
GemmAndBiasTunableOp_float_TN,tn_4_441_128_ld_128_128_4,Gemm_Hipblaslt_1287,0.0168575
GemmAndBiasTunableOp_float_TN,tn_128_361_576_ld_576_576_128,Gemm_Hipblaslt_1285,0.0320763
GemmAndBiasTunableOp_float_TN,tn_2_361_128_ld_128_128_2,Gemm_Hipblaslt_1284,0.013156
GemmAndBiasTunableOp_float_TN,tn_4_361_128_ld_128_128_4,Gemm_Hipblaslt_1287,0.0163974
GemmAndBiasTunableOp_float_TN,tn_128_394_576_ld_576_576_128,Gemm_Hipblaslt_1287,0.0392666
GemmAndBiasTunableOp_float_TN,tn_2_394_128_ld_128_128_2,Gemm_Hipblaslt_1286,0.0144823
GemmAndBiasTunableOp_float_TN,tn_4_394_128_ld_128_128_4,Gemm_Hipblaslt_1287,0.0162217
GemmAndBiasTunableOp_float_TN,tn_128_490_576_ld_576_576_128,Gemm_Hipblaslt_1285,0.0427305
GemmAndBiasTunableOp_float_TN,tn_2_490_128_ld_128_128_2,Gemm_Hipblaslt_1287,0.0180765
GemmAndBiasTunableOp_float_TN,tn_4_490_128_ld_128_128_4,Gemm_Hipblaslt_1287,0.0191206
GemmAndBiasTunableOp_float_TN,tn_128_375_576_ld_576_576_128,Gemm_Hipblaslt_1285,0.0391511
GemmAndBiasTunableOp_float_TN,tn_2_375_128_ld_128_128_2,Gemm_Hipblaslt_1286,0.0136373
GemmAndBiasTunableOp_float_TN,tn_4_375_128_ld_128_128_4,Gemm_Hipblaslt_1287,0.0164274
GemmAndBiasTunableOp_float_TN,tn_256_92_1152_ld_1152_1152_256,Gemm_Hipblaslt_1285,0.0430882
GemmAndBiasTunableOp_float_TN,tn_2_92_256_ld_256_256_2,Gemm_Hipblaslt_1284,0.0162115
GemmAndBiasTunableOp_float_TN,tn_4_92_256_ld_256_256_4,Gemm_Hipblaslt_1284,0.0177196
GemmAndBiasTunableOp_float_TN,tn_10_92_256_ld_256_256_10,Gemm_Hipblaslt_1284,0.0171249
GemmAndBiasTunableOp_float_TN,tn_256_293_1152_ld_1152_1152_256,Gemm_Hipblaslt_1285,0.0835966
GemmAndBiasTunableOp_float_TN,tn_2_293_256_ld_256_256_2,Gemm_Hipblaslt_1286,0.0139897
GemmAndBiasTunableOp_float_TN,tn_4_293_256_ld_256_256_4,Gemm_Hipblaslt_1287,0.0180938
GemmAndBiasTunableOp_float_TN,tn_10_293_256_ld_256_256_10,Gemm_Hipblaslt_1287,0.017585
GemmAndBiasTunableOp_float_TN,tn_128_409_576_ld_576_576_128,Gemm_Hipblaslt_1285,0.0413104
GemmAndBiasTunableOp_float_TN,tn_2_409_128_ld_128_128_2,Gemm_Hipblaslt_1287,0.018019
GemmAndBiasTunableOp_float_TN,tn_4_409_128_ld_128_128_4,Gemm_Hipblaslt_1285,0.0174717
GemmAndBiasTunableOp_float_TN,tn_128_335_576_ld_576_576_128,Gemm_Hipblaslt_1285,0.0314343
GemmAndBiasTunableOp_float_TN,tn_2_335_128_ld_128_128_2,Gemm_Hipblaslt_1285,0.0122153
GemmAndBiasTunableOp_float_TN,tn_4_335_128_ld_128_128_4,Gemm_Hipblaslt_1287,0.0164046
GemmAndBiasTunableOp_float_TN,tn_128_501_576_ld_576_576_128,Gemm_Hipblaslt_1285,0.0431827
GemmAndBiasTunableOp_float_TN,tn_2_501_128_ld_128_128_2,Gemm_Hipblaslt_1286,0.012642
GemmAndBiasTunableOp_float_TN,tn_4_501_128_ld_128_128_4,Gemm_Hipblaslt_1287,0.0165875
GemmAndBiasTunableOp_float_TN,tn_1024_957_12544_ld_12544_12544_1024,Gemm_Hipblaslt_1285,19.2334
GemmAndBiasTunableOp_float_TN,tn_1024_957_1024_ld_1024_1024_1024,Gemm_Hipblaslt_1285,0.960998
GemmAndBiasTunableOp_float_TN,tn_91_957_1024_ld_1024_1024_91,Gemm_Hipblaslt_1285,0.0852897
GemmAndBiasTunableOp_float_TN,tn_364_957_1024_ld_1024_1024_364,Gemm_Hipblaslt_1285,0.328379
GemmAndBiasTunableOp_float_TN,tn_256_216_1152_ld_1152_1152_256,Gemm_Hipblaslt_1285,0.0638837
GemmAndBiasTunableOp_float_TN,tn_2_216_256_ld_256_256_2,Gemm_Hipblaslt_1286,0.012843
GemmAndBiasTunableOp_float_TN,tn_4_216_256_ld_256_256_4,Gemm_Hipblaslt_1287,0.0177926
GemmAndBiasTunableOp_float_TN,tn_10_216_256_ld_256_256_10,Gemm_Hipblaslt_1287,0.0154562
GemmAndBiasTunableOp_float_TN,tn_128_507_576_ld_576_576_128,Gemm_Hipblaslt_1285,0.0393518
GemmAndBiasTunableOp_float_TN,tn_2_507_128_ld_128_128_2,Gemm_Hipblaslt_1285,0.0149005
GemmAndBiasTunableOp_float_TN,tn_4_507_128_ld_128_128_4,Gemm_Hipblaslt_1287,0.0161596
GemmAndBiasTunableOp_float_TN,tn_256_58_1152_ld_1152_1152_256,Gemm_Hipblaslt_1284,0.0358677
GemmAndBiasTunableOp_float_TN,tn_2_58_256_ld_256_256_2,Gemm_Hipblaslt_1287,0.0157541
GemmAndBiasTunableOp_float_TN,tn_4_58_256_ld_256_256_4,Gemm_Hipblaslt_1284,0.017497
GemmAndBiasTunableOp_float_TN,tn_10_58_256_ld_256_256_10,Gemm_Hipblaslt_1287,0.0156309
GemmAndBiasTunableOp_float_TN,tn_256_59_1152_ld_1152_1152_256,Gemm_Hipblaslt_1284,0.0358197
GemmAndBiasTunableOp_float_TN,tn_2_59_256_ld_256_256_2,Gemm_Hipblaslt_1287,0.0200376
GemmAndBiasTunableOp_float_TN,tn_4_59_256_ld_256_256_4,Gemm_Hipblaslt_1287,0.019078
GemmAndBiasTunableOp_float_TN,tn_10_59_256_ld_256_256_10,Gemm_Hipblaslt_1287,0.015568
GemmAndBiasTunableOp_float_TN,tn_128_483_576_ld_576_576_128,Gemm_Hipblaslt_1285,0.0428226
GemmAndBiasTunableOp_float_TN,tn_2_483_128_ld_128_128_2,Gemm_Hipblaslt_1284,0.0143361
GemmAndBiasTunableOp_float_TN,tn_4_483_128_ld_128_128_4,Gemm_Hipblaslt_1284,0.0157246
GemmAndBiasTunableOp_float_TN,tn_256_46_1152_ld_1152_1152_256,Gemm_Hipblaslt_1284,0.0338049
GemmAndBiasTunableOp_float_TN,tn_2_46_256_ld_256_256_2,Gemm_Hipblaslt_1286,0.0182787
GemmAndBiasTunableOp_float_TN,tn_4_46_256_ld_256_256_4,Gemm_Hipblaslt_1284,0.0176526
GemmAndBiasTunableOp_float_TN,tn_10_46_256_ld_256_256_10,Gemm_Hipblaslt_1286,0.0138304
GemmAndBiasTunableOp_float_TN,tn_256_65_1152_ld_1152_1152_256,Gemm_Hipblaslt_1284,0.0378934
GemmAndBiasTunableOp_float_TN,tn_2_65_256_ld_256_256_2,Gemm_Hipblaslt_1284,0.0168693
GemmAndBiasTunableOp_float_TN,tn_4_65_256_ld_256_256_4,Gemm_Hipblaslt_1286,0.012817
GemmAndBiasTunableOp_float_TN,tn_10_65_256_ld_256_256_10,Gemm_Hipblaslt_1287,0.0175716
GemmAndBiasTunableOp_float_TN,tn_128_371_576_ld_576_576_128,Gemm_Hipblaslt_1285,0.0326397
GemmAndBiasTunableOp_float_TN,tn_2_371_128_ld_128_128_2,Gemm_Hipblaslt_1286,0.0111852
GemmAndBiasTunableOp_float_TN,tn_4_371_128_ld_128_128_4,Gemm_Hipblaslt_1287,0.0161173
GemmAndBiasTunableOp_float_TN,tn_256_70_1152_ld_1152_1152_256,Gemm_Hipblaslt_1284,0.038109
GemmAndBiasTunableOp_float_TN,tn_2_70_256_ld_256_256_2,Gemm_Hipblaslt_1284,0.0159365
GemmAndBiasTunableOp_float_TN,tn_4_70_256_ld_256_256_4,Gemm_Hipblaslt_1284,0.0153733
GemmAndBiasTunableOp_float_TN,tn_10_70_256_ld_256_256_10,Gemm_Hipblaslt_1287,0.0156743
GemmAndBiasTunableOp_float_TN,tn_256_64_1152_ld_1152_1152_256,Gemm_Hipblaslt_1284,0.0357134
GemmAndBiasTunableOp_float_TN,tn_2_64_256_ld_256_256_2,Gemm_Hipblaslt_1285,0.0182367
GemmAndBiasTunableOp_float_TN,tn_4_64_256_ld_256_256_4,Gemm_Hipblaslt_1287,0.0154554
GemmAndBiasTunableOp_float_TN,tn_10_64_256_ld_256_256_10,Gemm_Hipblaslt_1284,0.0142818
GemmAndBiasTunableOp_float_TN,tn_128_415_576_ld_576_576_128,Gemm_Hipblaslt_1285,0.0337328
GemmAndBiasTunableOp_float_TN,tn_2_415_128_ld_128_128_2,Gemm_Hipblaslt_1284,0.0161997
GemmAndBiasTunableOp_float_TN,tn_4_415_128_ld_128_128_4,Gemm_Hipblaslt_1287,0.017012
GemmAndBiasTunableOp_float_TN,tn_128_473_576_ld_576_576_128,Gemm_Hipblaslt_1285,0.0401662
GemmAndBiasTunableOp_float_TN,tn_2_473_128_ld_128_128_2,Gemm_Hipblaslt_1286,0.0121132
GemmAndBiasTunableOp_float_TN,tn_4_473_128_ld_128_128_4,Gemm_Hipblaslt_1287,0.0168221
GemmAndBiasTunableOp_float_TN,tn_256_76_1152_ld_1152_1152_256,Gemm_Hipblaslt_1284,0.0390226
GemmAndBiasTunableOp_float_TN,tn_2_76_256_ld_256_256_2,Gemm_Hipblaslt_1287,0.0184921
GemmAndBiasTunableOp_float_TN,tn_4_76_256_ld_256_256_4,Gemm_Hipblaslt_1287,0.0176628
GemmAndBiasTunableOp_float_TN,tn_10_76_256_ld_256_256_10,Gemm_Hipblaslt_1287,0.0202047
GemmAndBiasTunableOp_float_TN,tn_256_79_1152_ld_1152_1152_256,Gemm_Hipblaslt_1284,0.0391205
GemmAndBiasTunableOp_float_TN,tn_2_79_256_ld_256_256_2,Gemm_Hipblaslt_1286,0.0174479
GemmAndBiasTunableOp_float_TN,tn_4_79_256_ld_256_256_4,Gemm_Hipblaslt_1287,0.0156824
GemmAndBiasTunableOp_float_TN,tn_10_79_256_ld_256_256_10,Gemm_Hipblaslt_1287,0.0201931
GemmAndBiasTunableOp_float_TN,tn_256_219_1152_ld_1152_1152_256,Gemm_Hipblaslt_1285,0.064004
GemmAndBiasTunableOp_float_TN,tn_2_219_256_ld_256_256_2,Gemm_Hipblaslt_1284,0.012858
GemmAndBiasTunableOp_float_TN,tn_4_219_256_ld_256_256_4,Gemm_Hipblaslt_1284,0.0177811
GemmAndBiasTunableOp_float_TN,tn_10_219_256_ld_256_256_10,Gemm_Hipblaslt_1287,0.0154311
GemmAndBiasTunableOp_float_TN,tn_128_427_576_ld_576_576_128,Gemm_Hipblaslt_1285,0.0417551
GemmAndBiasTunableOp_float_TN,tn_2_427_128_ld_128_128_2,Gemm_Hipblaslt_1286,0.0117894
GemmAndBiasTunableOp_float_TN,tn_4_427_128_ld_128_128_4,Gemm_Hipblaslt_1287,0.01583
GemmAndBiasTunableOp_float_TN,tn_256_69_1152_ld_1152_1152_256,Gemm_Hipblaslt_1284,0.0395017
GemmAndBiasTunableOp_float_TN,tn_2_69_256_ld_256_256_2,Gemm_Hipblaslt_1285,0.0153435
GemmAndBiasTunableOp_float_TN,tn_4_69_256_ld_256_256_4,Gemm_Hipblaslt_1284,0.0133741
GemmAndBiasTunableOp_float_TN,tn_10_69_256_ld_256_256_10,Gemm_Hipblaslt_1286,0.0170044
GemmAndBiasTunableOp_float_TN,tn_128_292_576_ld_576_576_128,Gemm_Hipblaslt_1285,0.141149
GemmAndBiasTunableOp_float_TN,tn_2_292_128_ld_128_128_2,Gemm_Hipblaslt_1287,0.0229121
GemmAndBiasTunableOp_float_TN,tn_4_292_128_ld_128_128_4,Gemm_Hipblaslt_1286,0.020858
GemmAndBiasTunableOp_float_TN,tn_128_509_576_ld_576_576_128,Gemm_Hipblaslt_1285,0.0437537
GemmAndBiasTunableOp_float_TN,tn_2_509_128_ld_128_128_2,Gemm_Hipblaslt_1284,0.0117009
GemmAndBiasTunableOp_float_TN,tn_4_509_128_ld_128_128_4,Gemm_Hipblaslt_1286,0.0118356
GemmAndBiasTunableOp_float_TN,tn_256_93_1152_ld_1152_1152_256,Gemm_Hipblaslt_1285,0.0416209
GemmAndBiasTunableOp_float_TN,tn_2_93_256_ld_256_256_2,Gemm_Hipblaslt_1286,0.0130478
GemmAndBiasTunableOp_float_TN,tn_4_93_256_ld_256_256_4,Gemm_Hipblaslt_1286,0.0128017
GemmAndBiasTunableOp_float_TN,tn_10_93_256_ld_256_256_10,Gemm_Hipblaslt_1286,0.0125877
GemmAndBiasTunableOp_float_TN,tn_128_359_576_ld_576_576_128,Gemm_Hipblaslt_1285,0.0309772
GemmAndBiasTunableOp_float_TN,tn_2_359_128_ld_128_128_2,Gemm_Hipblaslt_1286,0.0102173
GemmAndBiasTunableOp_float_TN,tn_4_359_128_ld_128_128_4,Gemm_Hipblaslt_1286,0.0101748
GemmAndBiasTunableOp_float_TN,tn_128_392_576_ld_576_576_128,Gemm_Hipblaslt_1285,0.0399918
GemmAndBiasTunableOp_float_TN,tn_2_392_128_ld_128_128_2,Gemm_Hipblaslt_1286,0.011525
GemmAndBiasTunableOp_float_TN,tn_4_392_128_ld_128_128_4,Gemm_Hipblaslt_1284,0.0114977
GemmAndBiasTunableOp_float_TN,tn_256_88_1152_ld_1152_1152_256,Gemm_Hipblaslt_1285,0.0413928
GemmAndBiasTunableOp_float_TN,tn_2_88_256_ld_256_256_2,Gemm_Hipblaslt_1286,0.0130734
GemmAndBiasTunableOp_float_TN,tn_4_88_256_ld_256_256_4,Gemm_Hipblaslt_1286,0.0129849
GemmAndBiasTunableOp_float_TN,tn_10_88_256_ld_256_256_10,Gemm_Hipblaslt_1286,0.0127396
GemmAndBiasTunableOp_float_TN,tn_256_56_1152_ld_1152_1152_256,Gemm_Hipblaslt_1284,0.0352957
GemmAndBiasTunableOp_float_TN,tn_2_56_256_ld_256_256_2,Gemm_Hipblaslt_1286,0.0129736
GemmAndBiasTunableOp_float_TN,tn_4_56_256_ld_256_256_4,Gemm_Hipblaslt_1286,0.0128955
GemmAndBiasTunableOp_float_TN,tn_10_56_256_ld_256_256_10,Gemm_Hipblaslt_1286,0.0126566
GemmAndBiasTunableOp_float_TN,tn_256_176_1152_ld_1152_1152_256,Gemm_Hipblaslt_1285,0.0525078
GemmAndBiasTunableOp_float_TN,tn_2_176_256_ld_256_256_2,Gemm_Hipblaslt_1286,0.0129844
GemmAndBiasTunableOp_float_TN,tn_4_176_256_ld_256_256_4,Gemm_Hipblaslt_1286,0.0130542
GemmAndBiasTunableOp_float_TN,tn_10_176_256_ld_256_256_10,Gemm_Hipblaslt_1286,0.0127708
GemmAndBiasTunableOp_float_TN,tn_256_360_1152_ld_1152_1152_256,Gemm_Hipblaslt_1285,0.1033
GemmAndBiasTunableOp_float_TN,tn_2_360_256_ld_256_256_2,Gemm_Hipblaslt_1286,0.0129311
GemmAndBiasTunableOp_float_TN,tn_4_360_256_ld_256_256_4,Gemm_Hipblaslt_1286,0.0129084
GemmAndBiasTunableOp_float_TN,tn_10_360_256_ld_256_256_10,Gemm_Hipblaslt_1286,0.0128462
GemmAndBiasTunableOp_float_TN,tn_128_447_576_ld_576_576_128,Gemm_Hipblaslt_1285,0.0354664
GemmAndBiasTunableOp_float_TN,tn_2_447_128_ld_128_128_2,Gemm_Hipblaslt_1286,0.0114479
GemmAndBiasTunableOp_float_TN,tn_4_447_128_ld_128_128_4,Gemm_Hipblaslt_1286,0.0114215
GemmAndBiasTunableOp_float_TN,tn_256_112_1152_ld_1152_1152_256,Gemm_Hipblaslt_1285,0.0423186
GemmAndBiasTunableOp_float_TN,tn_2_112_256_ld_256_256_2,Gemm_Hipblaslt_1286,0.013013
GemmAndBiasTunableOp_float_TN,tn_4_112_256_ld_256_256_4,Gemm_Hipblaslt_1286,0.0130746
GemmAndBiasTunableOp_float_TN,tn_10_112_256_ld_256_256_10,Gemm_Hipblaslt_1286,0.0128045
GemmAndBiasTunableOp_float_TN,tn_128_423_576_ld_576_576_128,Gemm_Hipblaslt_1285,0.0342682
GemmAndBiasTunableOp_float_TN,tn_2_423_128_ld_128_128_2,Gemm_Hipblaslt_1286,0.0115285
GemmAndBiasTunableOp_float_TN,tn_4_423_128_ld_128_128_4,Gemm_Hipblaslt_1286,0.0115886
GemmAndBiasTunableOp_float_TN,tn_128_333_576_ld_576_576_128,Gemm_Hipblaslt_1285,0.0319702
GemmAndBiasTunableOp_float_TN,tn_2_333_128_ld_128_128_2,Gemm_Hipblaslt_1286,0.0102721
GemmAndBiasTunableOp_float_TN,tn_4_333_128_ld_128_128_4,Gemm_Hipblaslt_1286,0.0102573
GemmAndBiasTunableOp_float_TN,tn_256_512_1152_ld_1152_1152_256,Gemm_Hipblaslt_1285,0.138207
GemmAndBiasTunableOp_float_TN,tn_2_512_256_ld_256_256_2,Gemm_Hipblaslt_1286,0.0155861
GemmAndBiasTunableOp_float_TN,tn_4_512_256_ld_256_256_4,Gemm_Hipblaslt_1284,0.0155966
GemmAndBiasTunableOp_float_TN,tn_10_512_256_ld_256_256_10,Gemm_Hipblaslt_1284,0.0156679
GemmAndBiasTunableOp_float_TN,tn_128_496_576_ld_576_576_128,Gemm_Hipblaslt_1285,0.0431068
GemmAndBiasTunableOp_float_TN,tn_2_496_128_ld_128_128_2,Gemm_Hipblaslt_1284,0.0120856
GemmAndBiasTunableOp_float_TN,tn_4_496_128_ld_128_128_4,Gemm_Hipblaslt_1286,0.0117661
GemmAndBiasTunableOp_float_TN,tn_256_121_1152_ld_1152_1152_256,Gemm_Hipblaslt_1285,0.0453197
GemmAndBiasTunableOp_float_TN,tn_2_121_256_ld_256_256_2,Gemm_Hipblaslt_1286,0.0129808
GemmAndBiasTunableOp_float_TN,tn_4_121_256_ld_256_256_4,Gemm_Hipblaslt_1286,0.013091
GemmAndBiasTunableOp_float_TN,tn_10_121_256_ld_256_256_10,Gemm_Hipblaslt_1286,0.0127488
GemmAndBiasTunableOp_float_TN,tn_256_110_1152_ld_1152_1152_256,Gemm_Hipblaslt_1285,0.0427185
GemmAndBiasTunableOp_float_TN,tn_2_110_256_ld_256_256_2,Gemm_Hipblaslt_1286,0.0129873
GemmAndBiasTunableOp_float_TN,tn_4_110_256_ld_256_256_4,Gemm_Hipblaslt_1286,0.0130197
GemmAndBiasTunableOp_float_TN,tn_10_110_256_ld_256_256_10,Gemm_Hipblaslt_1286,0.0126426
GemmAndBiasTunableOp_float_TN,tn_256_107_1152_ld_1152_1152_256,Gemm_Hipblaslt_1285,0.0423935
GemmAndBiasTunableOp_float_TN,tn_2_107_256_ld_256_256_2,Gemm_Hipblaslt_1286,0.0128129
GemmAndBiasTunableOp_float_TN,tn_4_107_256_ld_256_256_4,Gemm_Hipblaslt_1286,0.0128935
GemmAndBiasTunableOp_float_TN,tn_10_107_256_ld_256_256_10,Gemm_Hipblaslt_1286,0.0124346
GemmAndBiasTunableOp_float_TN,tn_256_406_1152_ld_1152_1152_256,Gemm_Hipblaslt_1285,0.11468
GemmAndBiasTunableOp_float_TN,tn_2_406_256_ld_256_256_2,Gemm_Hipblaslt_1286,0.0130057
GemmAndBiasTunableOp_float_TN,tn_4_406_256_ld_256_256_4,Gemm_Hipblaslt_1286,0.0129865
GemmAndBiasTunableOp_float_TN,tn_10_406_256_ld_256_256_10,Gemm_Hipblaslt_1286,0.0127689
GemmAndBiasTunableOp_float_TN,tn_128_364_576_ld_576_576_128,Gemm_Hipblaslt_1285,0.0308353
GemmAndBiasTunableOp_float_TN,tn_2_364_128_ld_128_128_2,Gemm_Hipblaslt_1284,0.0109285
GemmAndBiasTunableOp_float_TN,tn_4_364_128_ld_128_128_4,Gemm_Hipblaslt_1284,0.0107371
GemmAndBiasTunableOp_float_TN,tn_256_139_1152_ld_1152_1152_256,Gemm_Hipblaslt_1287,0.204362
GemmAndBiasTunableOp_float_TN,tn_2_139_256_ld_256_256_2,Gemm_Hipblaslt_1284,0.0262658
GemmAndBiasTunableOp_float_TN,tn_4_139_256_ld_256_256_4,Gemm_Hipblaslt_1284,0.0362924
GemmAndBiasTunableOp_float_TN,tn_10_139_256_ld_256_256_10,Gemm_Hipblaslt_1286,0.0803025
GemmAndBiasTunableOp_float_TN,tn_128_506_576_ld_576_576_128,Gemm_Hipblaslt_1285,0.0393196
GemmAndBiasTunableOp_float_TN,tn_2_506_128_ld_128_128_2,Gemm_Hipblaslt_1286,0.0101944
GemmAndBiasTunableOp_float_TN,tn_4_506_128_ld_128_128_4,Gemm_Hipblaslt_1284,0.0104044
GemmAndBiasTunableOp_float_TN,tn_128_444_576_ld_576_576_128,Gemm_Hipblaslt_1285,0.0359016
GemmAndBiasTunableOp_float_TN,tn_2_444_128_ld_128_128_2,Gemm_Hipblaslt_1286,0.0102966
GemmAndBiasTunableOp_float_TN,tn_4_444_128_ld_128_128_4,Gemm_Hipblaslt_1286,0.0102285
GemmAndBiasTunableOp_float_TN,tn_256_127_1152_ld_1152_1152_256,Gemm_Hipblaslt_1285,0.0452977
GemmAndBiasTunableOp_float_TN,tn_2_127_256_ld_256_256_2,Gemm_Hipblaslt_1286,0.0130413
GemmAndBiasTunableOp_float_TN,tn_4_127_256_ld_256_256_4,Gemm_Hipblaslt_1286,0.0128554
GemmAndBiasTunableOp_float_TN,tn_10_127_256_ld_256_256_10,Gemm_Hipblaslt_1286,0.0127176
GemmAndBiasTunableOp_float_TN,tn_128_461_576_ld_576_576_128,Gemm_Hipblaslt_1285,0.0360034
GemmAndBiasTunableOp_float_TN,tn_2_461_128_ld_128_128_2,Gemm_Hipblaslt_1286,0.0103964
GemmAndBiasTunableOp_float_TN,tn_4_461_128_ld_128_128_4,Gemm_Hipblaslt_1286,0.0104597
GemmAndBiasTunableOp_float_TN,tn_256_83_1152_ld_1152_1152_256,Gemm_Hipblaslt_1285,0.0414705
GemmAndBiasTunableOp_float_TN,tn_2_83_256_ld_256_256_2,Gemm_Hipblaslt_1286,0.0131528
GemmAndBiasTunableOp_float_TN,tn_4_83_256_ld_256_256_4,Gemm_Hipblaslt_1286,0.0131404
GemmAndBiasTunableOp_float_TN,tn_10_83_256_ld_256_256_10,Gemm_Hipblaslt_1286,0.0128478
GemmAndBiasTunableOp_float_TN,tn_256_135_1152_ld_1152_1152_256,Gemm_Hipblaslt_1285,0.0506005
GemmAndBiasTunableOp_float_TN,tn_2_135_256_ld_256_256_2,Gemm_Hipblaslt_1286,0.012946
GemmAndBiasTunableOp_float_TN,tn_4_135_256_ld_256_256_4,Gemm_Hipblaslt_1286,0.0129952
GemmAndBiasTunableOp_float_TN,tn_10_135_256_ld_256_256_10,Gemm_Hipblaslt_1286,0.012677
GemmAndBiasTunableOp_float_TN,tn_256_99_1152_ld_1152_1152_256,Gemm_Hipblaslt_1285,0.0426712
GemmAndBiasTunableOp_float_TN,tn_2_99_256_ld_256_256_2,Gemm_Hipblaslt_1286,0.0129011
GemmAndBiasTunableOp_float_TN,tn_4_99_256_ld_256_256_4,Gemm_Hipblaslt_1286,0.012889
GemmAndBiasTunableOp_float_TN,tn_10_99_256_ld_256_256_10,Gemm_Hipblaslt_1286,0.012542
GemmAndBiasTunableOp_float_TN,tn_256_237_1152_ld_1152_1152_256,Gemm_Hipblaslt_1285,0.0653952
GemmAndBiasTunableOp_float_TN,tn_2_237_256_ld_256_256_2,Gemm_Hipblaslt_1286,0.0129764
GemmAndBiasTunableOp_float_TN,tn_4_237_256_ld_256_256_4,Gemm_Hipblaslt_1286,0.013057
GemmAndBiasTunableOp_float_TN,tn_10_237_256_ld_256_256_10,Gemm_Hipblaslt_1286,0.0126855
GemmAndBiasTunableOp_float_TN,tn_256_133_1152_ld_1152_1152_256,Gemm_Hipblaslt_1285,0.047223
GemmAndBiasTunableOp_float_TN,tn_2_133_256_ld_256_256_2,Gemm_Hipblaslt_1286,0.0129303
GemmAndBiasTunableOp_float_TN,tn_4_133_256_ld_256_256_4,Gemm_Hipblaslt_1286,0.0130646
GemmAndBiasTunableOp_float_TN,tn_10_133_256_ld_256_256_10,Gemm_Hipblaslt_1286,0.0126482
